,별점,주문메뉴,리뷰,사진
0,5,"['알리오올리오', '베이컨크림리조또']",뚜껑에 서비스로 빵이 붙어있어요 알리오올리오랑 크림리조또 먹었는데 맛있게 잘먹었습니다. 저는 만족스러웠어요,['https://rev-static.yogiyo.co.kr/63135de0edc482ce09c8dd4d959cc9bc_tn.jpg']
1,5,"['쉬림프알리오올리오', '베이컨토마토파스타', '쉬림프로제파스타']",오늘 처음 시켜봤눈데 로제는 보통이고다른거는 맛있어요서비스로 후렌치후라이 주셨는데양도 많고 넘넘 맛있어요^^,[]
2,5,"['알리오올리오', '베이컨토마토파스타']",안녕하세용 ㅎㅎ 금방 배달 시켜먹었는데  65분 걸린다더니  거의 체감 30분만에온것같네용 날씨도 춥고 그런데 아주 빨리 그것도 옆집에서 막만든것처럼 아주뜨겁고 맛있게배달왓습니당너무 맛있게 허겁지겁먹느라고 사진도 못찍었네요 ㅎㅎ솔직히말해서 다른 매장가서 먹는것보다 몇배는 더 맛있습니다 알리오올리오 특히 짱.맛있어요^^감사합니다 이렇게 추운날 맛있는 음식을 배달해주셔서 감사합니당,[]
3,5,"['베이컨크림파스타', '쉬림프로제파스타']",배달빠르고 맛있어요~,[]
4,5,"['베이컨크림파스타', '사이다 355mL']",배달이 빨라서 식지도 않고 왔어요~ 따끈따끈하고 면도 적당히 잘 익어있어서 좋았네요 ^ㅁ^ 사진엔 없지만 빵도 하나 같이 와서 맛있게 먹었어요 앞으로 종종 시켜먹을 것 같아요 ㅋㅋ,['https://rev-static.yogiyo.co.kr/acee0cd2b7bc5e668bcff6efb15ae1be_tn.jpg']
5,5,"['쉬림프크림파스타', '양념감자튀김']",파스타도 파스타지만 양념감자도 진짜 맛있었어용 배부르게 잘 먹었습니다,['https://rev-static.yogiyo.co.kr/18e81232bb07f7841726ee279a79b884_tn.jpg']
6,5,"['베이컨크림파스타', '쉬림프크림리조또', '양념감자튀김']",생각보다 양이 많더라구요 맛은 물론 맛잇고 배달도 빨라서 따끈따끈한 상태로먹을수 있어좋앗어요ㅎㅎ 후기도 다 좋아서 믿고 시켜먹을수 있겠어요 짱이에요,['https://rev-static.yogiyo.co.kr/c7c132e4f77f5d179548542addcd657d_tn.jpg']
7,5,"['상하이스파이시파스타', '베이컨크림리조또']",55분 걸린대서 잠깐 나갔다 오는 사이에 이미 배달 와 있어서 깜짝 놀랐어요. 한...25분? 쯤 걸린 것 같네요. 맛도 괜찮았어요. 스파이시 파스타 쪽은 기대보다는 심심한 편이긴 했지만 양도 충분했고! 리조또 쪽은 크림맛 듬뿍이라 좋았는데 양이... 양이... 폭발했어요. 리조또 정말 잔뜩 먹고 싶어서 좋긴 했는데^^ 다른 식당정도의 양 생각하면 당황할 수도 있겠네요. 전체적으로 만족스러운 점심이었어요! 저녁을 먹을 수가 없어서 든든히 먹어야 했는데 충분했던 것 같아요. 잘 먹었습니다!,['https://rev-static.yogiyo.co.kr/eae36749db53a5502283860ca8b589c4_tn.jpg']
8,5,"['베이컨크림파스타', '양념감자튀김']",면은 좀 굳었는데도 고소하니 맛나네요. 감자튀김은 양이 많아 남겨놨다 나중에 먹어야겠어요.,[]
9,5,"['해산물크림파스타', '양념감자튀김']",까먹고있다가 리뷰씁니다클레임 말고는 리뷰 써본 역사가 없는데여기는 진짜 좋네요.. 양념감자는 그냥 보통 양념감자 맛이지만 사이드메뉴니까 넘어가고메인 메뉴가 가격대비 퀄리티가 정말 좋습니다..!!맛있게 먹었습니다다음에 면이 생각나면 이쪽에서 주문할것 같아요 ㅎㅎ,[]
10,5,"['쉬림프알리오올리오', '망고에이드']","면이 조금 불었지만 그래도 맛있어요 ! 빵두 맛있구 양도 적당하구 , 다음엔 리조또 시켜먹으려구요 ㅋㅋ 대박나세요",['https://rev-static.yogiyo.co.kr/0115e04760f8a876865384bf361bf6ac_tn.jpg']
11,5,"['베이컨토마토파스타', '양념감자튀김', '사이다 355mL']",맛있었어요! 크림파스타도 맛있었는데 토마토파스타도 맛있네요 이번에도 역시나 배달 엄청 빠르고! 너무 뜨거워서 깜짝 놀랐어요 ㅇㅁㅇ 양념감자 맛있다는 리뷰가 많아서 저도 시켜봤는데 야금야금 먹기 좋은 양념이더라구요 파스타 다 먹고 맥주랑 먹었어요 ㅋㅋㅋㅋㅋ 맛있게 잘 먹었습니당,['https://rev-static.yogiyo.co.kr/ea10f9d3d34694cf44d05a32793c192e_tn.jpg']
12,5,[],👍👍👍👍👍,[]
13,4,['해산물로제파스타'],파스타가 땡길때 가끔 먹는데 맛있어요,[]
14,5,"['쉬림프크림파스타', '해산물토마토파스타', '양념감자튀김']",예상시간보다 빨리 왔어요 맛나요!!,[]
15,5,"['해산물로제파스타', '양념감자튀김']",이번엔 사진 찍어서 같이 올릴려고 했는데도착하자마자 바로 먹어버렸어요 ㅠㅠㅋㅋ다음번엔 사진 첨부해서 올릴게요~역시 크림도 맛있었는데 로제도 맛나네요배달해주시는분도 친절하시고 배달시키면서 가장 만족하는곳이에요 ㅎㅎ 수고하세요 다음에 또 시킬게요 다음번엔 리조또 한번.. ㅎㅎ,[]
16,4,"['쉬림프알리오올리오', '버팔로윙 3개']",잘먹었습니다 :)여기는 면이 통통하네요!,['https://rev-static.yogiyo.co.kr/2317088d8ae370b3414a644f32649912_tn.jpg']
17,5,"['해산물토마토파스타', '베이컨크림리조또', '콜라 355mL']",마싯어요~~ 기대안하고 시켰는데 너무 마싯어서 다음날 또 시켜먹었어요 ㅋㅋㅋㅋㅋ 이틀연속 자주시켜먹을께요 ~,['https://rev-static.yogiyo.co.kr/82ef89028585db8efd4f617a64d0b7ca_tn.jpg']
18,5,"['알리오올리오', '베이컨크림리조또']",친구한테 맛있다고 자랑했더니 자기도 한 번 먹어보자고 해서 이번엔 두 개 시켜서 먹어봤는데! 리조또 밥알 이렇게 고슬고슬 맛있어도 되는지 ;ㅅ;💕 리조또보다 파스타 더 좋아했는데 지금까지 맛있는 리조또를 못 만나서 그랬던 것 같아요 진짜 맛있었어용 ㅠㅅㅠ 알리오올리오 평이 좋아서 시켜봤는데 입맛 까탈스러운 친구도 맛있다고 다 먹었네요 ㅋㅋ 언제 뭘 시켜도 맛있을 것 같아요 이번에도 잘 먹었습니당~,"['https://rev-static.yogiyo.co.kr/cfd341d489e06eedbbdb3cfc18c61812_tn.jpg', 'https://rev-static.yogiyo.co.kr/973cacb623bc4699d1326fe748903be1_tn.jpg']"
19,5,"['쉬림프알리오올리오', '양념감자튀김']",늘 맛이어요 ^^ 항상주문해요 !!!,[]
20,5,"['쉬림프토마토파스타', '치즈스틱 3개']",찾았다.... 여깁니다 여기에요...... 이제 맨날 시켜먹어야지 ㅠㅠㅠㅠㅠ 감동 ㅠㅠㅠ 빵도 맛있고 파스타도 맛있고 피클도 맛있고 치즈스틱도 맛있고 양도 많고 배달도 빨리오고 말이 필요하나요 ㅠㅠㅠ,[]
21,5,"['베이컨크림파스타', '양념감자튀김']",아 맛도 있는데 양이 정말 ㅎㄷㄷㄷ,[]
22,5,"['베이컨토마토파스타', '자몽에이드']",항상 잘시켜먹거잇어요 양도 너무좋고 맛도잇구요~~,[]
23,5,"['알리오올리오', '치즈스틱 3개', '청포도에이드']",후기에 알리오올리오가 맛있다길래 주문해봤눈데 가격도 너무 저렴하고 너무 맛있고 !! 무엇보다도 갓 만들어서 파스타 뜨끈뜨끈해욥!! 면발이 탱글탱글!! 50분걸린다햇는데 20분도 안걸린거같아용😉 ㅎㅎ  서비스로 주신 모닝빵도 쫄깃하니 맛있네용:) 앞으로 자주 시켜먹겠습니당😍 번창하세요:),['https://rev-static.yogiyo.co.kr/9eca6e6b768bfedf3422440c546e88d3_tn.jpg']
24,5,"['베이컨크림파스타', '쉬림프알리오올리오', '양념감자튀김', '모닝빵（1개）']",맛도양도 서비스도 최고네요배달만좀 빨랐으면해요,[]
25,5,"['베이컨크림파스타', '버팔로윙 3개']",배달도 생각보다 빨리오고 맛있네요 잘먹었습니다종종 시켜먹을게요~서비스 모닝빵도 맛있었어요,[]
26,5,"['해산물크림리조또', '사이다 355mL']",정말 맜있게 잘먹었습니다^^,[]
27,4,['해산물크림리조또'],맛있어요 따뜻해요ㅎㅎ,['https://rev-static.yogiyo.co.kr/ec32b94f87fa65ab1d3ca6d2641bf403_tn.jpg']
28,5,['해산물토마토리조또'],항상 느끼는거지만 모닝빵 진짜 따끈하고 말랑해서 너무 맛있어요! 스파게티만 먹어봤었는데 리조또도 진짜 맛있구 양도 1인분 훨 넘는거 같아요 앞으로 파스타나 리조또먹을땐 여기서 👍🏻👍🏻 너무너무 맛있게 잘 먹었습니당,"['https://rev-static.yogiyo.co.kr/253ddd9bc1a4edb0db306fbdee7b8ed9_tn.jpg', 'https://rev-static.yogiyo.co.kr/2dc14eae258dd77eb0ea7ed8cb032182_tn.jpg']"
29,3,"['쉬림프로제파스타', '버팔로윙 3개']",처음 시켜먹어보는데 면이 통통하네요'-'!새우가 많아서 좋았어요~ㅎㅎ,['https://rev-static.yogiyo.co.kr/128a140d29b84ad86d01cc3691264948_tn.jpg']
30,5,"['알리오올리오', '쉬림프로제파스타']",맛있고 양도 많아서 애들이랑 배불리 잘 먹었습니다~사이다 서비스도 감사해요,[]
31,5,"['해산물로제파스타', '양념감자튀김', '청포도에이드']",맛잇어여 ~~~~~~~,[]
32,5,"['쉬림프크림파스타', '쉬림프알리오올리오']",됸맛입니다 여러분 파스타하새오,[]
33,5,"['베이컨로제파스타', '양념감자튀김']",언제 먹어도 최고의맛!,[]
34,5,"['알리오올리오', '베이컨크림리조또', '모닝빵（1개）', '치즈스틱 3개']",핵맛 진짜 걱정말고 시켜드세요 리죠또 양도 푸짐하고 너무조하~♡,[]
35,5,['해산물로제리조또'],주문동시에 바로 조리 들어가서 그런가 항상 배달예상시간이 어마어마하네요ㅠㅠ 그래도 기다려서 먹을만큼 양도 많고 맛이 훌륭해요! 요새는 리조또에 빠져있답니다ㅎㅎ 해물도 잔뜩에 양이 많아서 한번에 다 못먹고 나눠먹었어오!,['https://rev-static.yogiyo.co.kr/22431572bd74762768c048ebe6948cba_tn.jpg']
36,5,"['베이컨로제파스타', '치즈스틱 3개', '사이다 355mL']","일이주에 한번은 꼭 시켜먹는거같아요❤️이번엔 베이컨 로제 시켜봤는데 역시나 맛있더군요ㅠㅠ 배달도 늘 빨라서 면도 탱글탱글하고 ~~모닝빵도 짱맛,, ㅎㅎ 그리고 치즈스틱이 진짜 너무너무ㅜ너무 맛있어요ㅠㅠㅠ 늘 맛있는 음식 감사합니당:)",['https://rev-static.yogiyo.co.kr/c31aa1183009ae9310be2aa4cb8d6891_tn.jpg']
37,4,"['쉬림프토마토파스타', '양념감자튀김']",감자튀김 가격대비 매우푸짐하고 파스타도 새우 많이들어있어요잘먹었어요~,[]
38,5,"['베이컨토마토파스타', '쉬림프크림리조또', '모닝빵（1개）', '콜라 355mL']",양도많도맛있어요♡♡,"['https://rev-static.yogiyo.co.kr/0bee159d41968d627ca3b47121c6c1d7_tn.jpg', 'https://rev-static.yogiyo.co.kr/f81ff251638d7225c1dbcfc28b12814c_tn.jpg']"
39,5,"['쉬림프크림리조또', '해산물로제리조또', '콜라 355mL', '자몽에이드']",몇번을시키는지^-^♡♡,[]
40,5,"['쉬림프크림리조또', '베이컨토마토리조또', '양념감자튀김', '모닝빵（1개）', '콜라 355mL']",제입맛엔최고입니다^^,[]
41,5,"['베이컨크림파스타', '치즈스틱 3개']",너무너무 맛있어요 돈 아깝지않음,[]
42,5,"['상하이크림파스타', '베이컨로제리조또']",개꿀맛최고 바빠서인지 배달이조금 느린편인거말고는 맛도좋고 너무너무따뜻하게 배달와서 기분이 다 좋아질정도,[]
43,5,"['쉬림프크림리조또', '콜라 355mL']",최고최고!!나는넘나좋다요ㅎ,[]
44,5,"['쉬림프크림리조또', '모닝빵（1개）', '콜라 355mL']",비오는날에도공씨네!!ㅋㅋ5번째시키는건가..맛나요♡♡♡♡♡,"['https://rev-static.yogiyo.co.kr/08871c7504d1e60477ff38f866f8ea1c_tn.jpg', 'https://rev-static.yogiyo.co.kr/31cd173d79f4c12721e4d160cf6d3996_tn.jpg', 'https://rev-static.yogiyo.co.kr/1fceb1a3a969a3dcf5eea26e4aaaee95_tn.jpg']"
45,5,['해산물크림리조또'],👍👍👍👍👍,[]
46,5,"['쉬림프로제리조또', '버팔로윙 3개']",맛나용파스타도 배달 되는지 몰랐어용♡,[]
47,5,"['쉬림프알리오올리오', '베이컨크림리조또', '사이다 355mL']",파스타 좋아해서 시켜봤는데 진짜 너무맛있어여ㅜㅜㅠ 따끈따끈하구 리조또도 너무 맛있구ㅠㅜ 앞으로 자주 시켜먹을려구요!!!!!!,"['https://rev-static.yogiyo.co.kr/b38a05e62e7e04959ba46d6ea293054e_tn.jpg', 'https://rev-static.yogiyo.co.kr/a75053bcd32e5849a4a1fae373f17af5_tn.jpg']"
48,5,"['베이컨토마토파스타', '쉬림프크림리조또', '베이컨토마토리조또', '양념감자튀김', '콜라 355mL', '사이다 355mL']",항상맛나요!!매운맛선택했는데그냥와서아쉽긴한데그래도맛나요^^,[]
49,5,"['쉬림프크림리조또', '양념감자튀김', '콜라 355mL']",역시언제먹어도맛있는♡♡♡항상생각이나요!!,[]
50,5,['해산물크림파스타'],아직 안드신분들 고민하지말고 시키세요 ㅋㅋ진짜 전메뉴 다 맛있음..! 고민하는 시간이 사치임<<,[]
51,5,"['베이컨로제리조또', '치즈스틱 3개']",리뷰믿고 주문했는데 진짜 맛있어요!양도 많고 맛있게 잘먹겠습니다,"['https://rev-static.yogiyo.co.kr/e946d0b063b8928a2c5912fbddbfe8f2_tn.jpg', 'https://rev-static.yogiyo.co.kr/65473aa1c06a5c12b6487c95cf44d30d_tn.jpg']"
52,4,"['쉬림프로제파스타', '베이컨크림리조또']",배달파스타치고는 괜찮네요. 저랑 같은성인데..  종친할인도 있나요? ㅎㅎ,[]
53,5,"['알리오올리오', '양념감자튀김', '버팔로윙 3개']",맛잇어요 ....!!!!!,[]
54,5,"['쉬림프토마토파스타', '치즈스틱 3개']",리뷰보고 처음 시켜봤는데 너무너무 맛있었어요 ^^ 소스도 남김없이 긁어서 먹었습니다!!~!  모닝빵에 소스찍어먹으면 대박ㅠㅠㅠ♡ 잘먹었습니다^^,"['https://rev-static.yogiyo.co.kr/6c03e7c2f44f93b7de50eb6b76bb6d91_tn.jpg', 'https://rev-static.yogiyo.co.kr/f290a8ea6a0b17024e35a1457f4eee84_tn.jpg']"
55,5,"['해산물크림리조또', '치즈스틱 3개']",항상 파스타나 리조또 생각나면 여기서 시켜먹어요ㅎㅎ 모든 메뉴 다 먹어보고 싶을정도로 맛있네용,['https://rev-static.yogiyo.co.kr/29ebcf9fd1b2564743dad7eef8a68190_tn.jpg']
56,4,"['베이컨토마토파스타', '치즈스틱 3개']",따듯하게 잘 왔고 맛 괜찮습니다. 치즈스틱도 따닷하게 맛나게 먹었습니다. 치아교정중이라 기본 파스타 먹었는데 나중에 기회되면 다른 파스타도 시켜먹을게요.,[]
57,4,"['쉬림프토마토파스타', '치즈스틱 3개']",배달 빨리 해주셨고 요청사항도 너무 잘 들어주셔서 감사해요 또 시켜먹을게요~,[]
58,5,"['쉬림프토마토파스타', '베이컨크림리조또']",배달도빠르고 음식도 따끈따끈 맛나요 ㅎㅎ 양도 어마무시하네요실제로 보는거랑 사진으로보는거랑 틀려요~~ 사진보다 실제로보는게 더 맛있어보입니다 ㅋㅋ,['https://rev-static.yogiyo.co.kr/358249c329de66e8311fd827b3908a8c_tn.jpg']
59,5,"['쉬림프크림리조또', '치즈스틱 3개', '콜라 355mL']",진짜 리조또 너~~~~~~~~~~무 맛잇고 양도 진짜 많고 정말 짱입니다!!!!,[]
60,3,"['해산물토마토파스타', '모닝빵（1개）', '사이다 355mL']",배달시간이 오래 걸리긴 했지만 맛있게 잘 먹었어요또 시킬게요~!,[]
61,3,"['알리오올리오', '쉬림프로제파스타']",가격대비 양이나맛이 만족스럽진않네요.,[]
62,5,"['쉬림프토마토파스타', '치즈스틱 3개', '사이다 355mL']",배달원분도 너무 친절하시고 양도 많고 맛도 최고에요 ㅜㅜ 저는 파스타 먹고싶을때마다 여기서 시켜먹어요 3번째 시켜먹은건데 리뷰는 이제야 쓰네요 정말 맛있어요!!!!!!!,[]
63,4,"['쉬림프로제파스타', '콜라 355mL', '사이다 355mL']",생각보다 배달이 빠르네요,[]
64,5,"['베이컨로제리조또', '버팔로윙 3개']",언제 먹어도 짱이에요!!!!,[]
65,5,"['쉬림프알리오올리오', '쉬림프토마토파스타', '쉬림프로제파스타', '사이다 355mL']",전 파스타 먹고싶을때 무조건 공씨네 파스타에요 너무 맛있어요ㅜㅜㅜ,[]
66,5,"['베이컨로제파스타', '버팔로윙 3개']",맛도 좋고 양도 많아서 항상 잘 먹고 있습니다!!,[]
67,3,"['쉬림프알리오올리오', '치즈스틱 3개', '콜라 355mL', '사이다 355mL']",알리오올리오가 간이 안맞는거같아요 싱거워용 ㅠ,[]
68,5,"['쉬림프토마토파스타', '치즈스틱 3개', '버팔로윙 3개']",파스타 맛있어요 ^^ 양도 많고요. 치즈스틱은 평범했지만 파스타면과 소스는 정말 좋았어요.,[]
69,3,"['알리오올리오', '베이컨크림리조또', '해산물로제리조또']",서비스로 보내주신것들은 좋은데맛이.. 가격대비 또 시켜먹겠다 싶진 않네요😭,[]
70,4,"['알리오올리오', '베이컨크림리조또', '버팔로윙 3개']",맛은 괜찮아요 평들 보고 아주 기대했지만 배달로 먹는 파스타로는 좋지만 최고다!! 이 정도는 아님.기대치를 조금만 낮추고 시킬께요.,[]
71,3,"['해산물크림파스타', '치즈스틱 3개']",그저 그럼 가성비는 별루,"['https://rev-static.yogiyo.co.kr/bf476578a9966db02c27933e8de4aaa2_tn.jpg', 'https://rev-static.yogiyo.co.kr/f331113351f9531df18fc5abe1a847b1_tn.jpg']"
72,5,"['해산물알리오올리오', '양념감자튀김']",파스타  맛있어요^^,[]
73,5,"['쉬림프로제리조또', '버팔로윙 3개']",항상 만족하면서 먹어요,[]
74,1,[],맛은 너무 평범하고 너무 비싸요매장에서 먹는값이면 이해하겠는데걍 포장그릇에 보내는 파스타를 만삼천원 주고 먹을까요?,[]
75,5,"['베이컨토마토파스타', '양념감자튀김', '치즈스틱 3개']",배달이 2시간 걸렸지만 맛이나 양은 굿굿이었어용!!!!,[]
76,5,"['해산물크림리조또', '양념감자튀김']",파스타 잘하는집. 왠만한 레스토랑가서 사먹는 파스타보다 낫다,[]
77,5,"['베이컨크림파스타', '베이컨로제파스타', '양념감자튀김']",맛있고요 양도 넉넉하고 배달도 빠르고 좋아요,[]
78,5,"['쉬림프토마토파스타', '해산물토마토파스타', '사이다 355mL']",파스타 먹고싶음 맨날 시켜먹어요 또 시켜 먹었습니당 양도 많고 항상 만족해요 감사합니당~!,[]
79,5,"['쉬림프알리오올리오', '베이컨로제파스타', '치즈스틱 3개']",나가서먹는파스타보다훨씬맛있어요!!!!,[]
80,4,"['베이컨크림파스타', '베이컨토마토리조또', '모닝빵（1개）', '치즈스틱 3개']","첫 주문인데 배달은 좀 늦지만 맛 무난하고 양도 많아요. 특별한 날, 외식 대신 간단하고 편하게 기분 낼 때 좋을것 같아요~",[]
81,5,"['베이컨크림리조또', '치즈스틱 3개', '버팔로윙 3개']",꿀맛! 가끔시켜먹는데 언제나 맛있네요,[]
82,4,"['쉬림프알리오올리오', '모닝빵（1개）', '치즈스틱 3개', '버팔로윙 3개']",다소 비싼감은 있지만 적당히 먹을만합니다,[]
83,5,"['베이컨토마토파스타', '베이컨크림리조또']",배달하시는 분 넘 친절하셨구 예상 시간 안에 도착했고 맛도 있는데... 리조또를 주문했는데 스파게티가 왔네요 ㅜㅜ 다음엔 신경을 좀 더 써주시길 바랄게요 ㅠㅠㅠ,"['https://rev-static.yogiyo.co.kr/6931622d9549e83c9cf449deaa7896d5_tn.jpg', 'https://rev-static.yogiyo.co.kr/e85857084dfd175b0d838321b4a04f05_tn.jpg']"
84,5,"['상하이크림파스타', '베이컨크림리조또']",양도 꽤 많고 맛있어요,[]
85,5,"['베이컨로제파스타', '베이컨크림리조또']",맛나네염ㅎㅎ양도 생각보다 엄청많았어요호,['https://rev-static.yogiyo.co.kr/8c674c386a418c82dbfd4d32fa019cd9_tn.jpg']
86,5,"['해산물알리오올리오', '쉬림프로제파스타', '베이컨크림리조또', '양념감자튀김']","어제도 시켜먹었는데 맛있어서 오늘 또 시켜먹었어요~^^로제랑 알리오는 매콤하게 시켰는데 엄마는 로제가, 제입맛엔 알리오가 맛있네요~!아이들은 베이컨크림리조또 잘먹었어요~~양도 많아서 어제 신랑이랑 두개시킨것도 남겼는데,오늘도 어른3, 아이2 먹고 남겼네요~~잘 먹었습니다^^",['https://rev-static.yogiyo.co.kr/b52de8464b2966b1d163c53080433d5b_tn.jpg']
87,5,"['쉬림프로제파스타', '베이컨크림리조또', '양념감자튀김']",양이 진짜 많아요~~음식도 맛있구요~! 배불러서 빵은 손도 못 댔어요 ㅠ감자튀김도 생각보다 양이 꽤 많았어요~~~!,[]
88,4,"['베이컨크림파스타', '쉬림프토마토리조또']",잘 먹었어요. 배달로 파스타도 먹다니 ㅎㅎ   편하고 좋으네여,[]
89,3,"['해산물알리오올리오', '해산물토마토파스타', '양념감자튀김']",파스타면이  쫄깃하지가안아요  해물양이  조금만더  드러가씀,[]
90,5,"['베이컨로제파스타', '베이컨크림리조또', '콜라 355mL']",리조또가 정말맛있어요~!!,['https://rev-static.yogiyo.co.kr/650b6202cb2164ce3448d7735abf7a97_tn.jpg']
91,5,"['쉬림프알리오올리오', '베이컨크림리조또', '양념감자튀김']",알리오올리오 소스가 너무 없어용..ㅜ 양은 정말 많았습니다ㅋ,[]
92,5,"['베이컨크림파스타', '알리오올리오']",집에서 파스타를 주문 해 먹을 수 있는 것도 놀라웠는데 ^^ 맛도 있었어요~ 용기 사이즈가 커서 양이 적어 보였는데 막상 먹어보니 배가 부르더라구요~ 잘 먹었습니다.,[]
93,3,"['베이컨크림파스타', '모닝빵（1개）', '버팔로윙 3개', '사이다 355mL']",지하철 한정거장 거리 오는데 왜 추가배달요금이 생기는지 이해가 잘 안되네요 맛은 그럭저럭,[]
94,5,"['알리오올리오', '베이컨로제파스타', '베이컨크림리조또']",맛있고 양도 많아서 좋아요 배달 오래걸리는거 빼면요,[]
95,5,"['쉬림프알리오올리오', '양념감자튀김', '버팔로윙 3개', '사이다 355mL']",쉬림프알리오올리오짱맛있어요!!!,[]
96,5,"['베이컨크림파스타', '베이컨로제리조또']",진짜 넘 맛있습니다!! 집에서 편하게 이리 맛있는 파스타를 먹을 수 있다니 좋네요!! 식전 빵도 따듯하니 넘 맛나용!! 음료수도 넣어주시고 감사합니다!!,[]
97,5,"['쉬림프알리오올리오', '베이컨크림리조또']",가까운 곳이라면 주저않고 추천합니다~ 정말 맛있어요!,[]
98,5,"['베이컨로제파스타', '쉬림프크림리조또', '버팔로윙 3개', '콜라 355mL', '사이다 355mL']",항상 맛있게 먹고 있어요 뭐니뭐니해도 로제소스가 진짜 최고 넘 조아 헠 어떡하지 리뷰 쓰다가 또 먹고 싶어짐;;;,[]
99,4,"['쉬림프토마토파스타', '치즈스틱 3개', '사이다 355mL']",처음으로시켜먹어봣는데맛은잇엇어요 ~단지 조금 싱거웟고 면이랑 소스가따로노는 느낌이엿어요ㅠㅠ,[]
100,1,"['해산물토마토파스타', '치즈스틱 3개']",솔직한 리뷰는 별입니다죄송하지만 진짜 별로였습니다죄송합니다,[]
101,4,['알리오올리오'],맛있고 양도 적당하고 다 좋은데 배달이 좀 늦어서 아쉬워요,[]
102,4,"['베이컨크림파스타', '쉬림프알리오올리오', '쉬림프크림리조또']",배고플때 시키면 안되고 여유있게 시키면 될 것 같아요 믓은 평타 이상이에요,[]
103,5,"['베이컨크림파스타', '치즈스틱 3개', '버팔로윙 3개']",이것은 내가 즐겨 찾는 맛이 아주 좋고 음식점에 배달 속도도 빠르다.,[]
104,5,"['베이컨크림파스타', '치즈스틱 3개', '버팔로윙 3개']",이것은 내가 즐겨 찾는 맛이 아주 좋고 음식점에 배달 속도도 빠르다.,[]
105,5,"['베이컨크림파스타', '치즈스틱 3개', '버팔로윙 3개']",이것은 내가 즐겨 찾는 맛이 아주 좋고 음식점에 배달 속도도 빠르다.,[]
106,5,"['쉬림프크림파스타', '양념감자튀김']",❤️❤️❤️❤️❤️❤️❤️❤️❤️❤️,[]
107,5,"['베이컨크림파스타', '치즈스틱 3개', '버팔로윙 3개']",맛잇ㄱ 잘먹엇습니당!,[]
108,5,"['베이컨크림리조또', '모닝빵（1개）', '버팔로윙 3개', '콜라 355mL']",맛있었어용! 잘먹었습니당,[]
109,5,"['쉬림프크림리조또', '버팔로윙 3개']",맛이ㅛ어욤ㅇㅇㅇㅇㅇㅇ,[]
110,5,"['해산물크림리조또', '치즈스틱 3개']",리뷰한번도 안써봤는데 요기요에서 시켜먹은것중에 제일 괜찮았어요 추천해요,['https://rev-static.yogiyo.co.kr/2043beec26be3b196b31de7560b0012d_tn.jpg']
111,5,"['베이컨크림파스타', '양념감자튀김', '모닝빵（1개）']",처음 시켰는데 넘 맛있어요!! 양도 엄청 많고... 배달이 느리다는 리뷰봐서 집에 가는길에 시켰는데 20분도 안되어 음식이 먼저 왔어요. 자주 시켜먹을게요~,[]
112,3,"['베이컨크림파스타', '치즈스틱 3개', '버팔로윙 3개']",비쥬얼은 그럭저럭  파스타 맛은 그럭저럭 했구요..  치즈스틱은 냉동맛이 났어요..  바로 먹었는데..  그래도 배는 잘 채웠어요~~,['https://rev-static.yogiyo.co.kr/b3af3dd70d6956bf60bdf91f2e236d65_tn.jpg']
113,4,"['베이컨토마토파스타', '양념감자튀김', '콜라 355mL']",좀 많이 짜네요ㅠㅠ 그래도 양은 무난하고 가격대비 좋아요!!,[]
