,별점,주문메뉴,리뷰,사진
114,5,"['상하이스파이시파스타', '치즈스틱 3개']",음식은 만족. 배달은 보통입니다!,[]
115,5,"['알리오올리오', '쉬림프토마토리조또']",정말 맛잇게 잘먹었습니다ㅎㅎ,"['https://rev-static.yogiyo.co.kr/f81c00dbd709610ebe70f45e1c8f5031_tn.jpg', 'https://rev-static.yogiyo.co.kr/eb476da2c21f7b5e700a114aa20491f6_tn.jpg', 'https://rev-static.yogiyo.co.kr/6b72167de1e9c79e0e72fcc9d4cfb0b8_tn.jpg']"
116,5,"['쉬림프알리오올리오', '치즈스틱 3개', '버팔로윙 3개']",알리오 올리오는 맛있네요 메뉴마다 맛 클래스 편차가 약간 있네요앞으로 자주 이용할거 같습니다,[]
117,4,"['베이컨크림파스타', '베이컨로제리조또']",크림파스타 소스 좀 부족했지만~ 잘먹었어요 ㅎㅎ,['https://rev-static.yogiyo.co.kr/3b5913de86390ab1e50d31fff557bd5e_tn.jpg']
118,5,"['쉬림프알리오올리오', '모닝빵（1개）', '치즈스틱 3개']",매운맛으로 시켰었는데 안매웠던거 빼면 굳,[]
119,3,"['베이컨로제파스타', '버팔로윙 3개', '콜라 355mL']",맛은 다 괜찮은데 버팔로윙 3개 3000원 이건.... 한개에 700원 정도 할거같은 비쥬얼이네여.....,['https://rev-static.yogiyo.co.kr/57c21d14f77eea2876e9e92f4f896e9e_tn.jpg']
120,5,"['알리오올리오', '베이컨로제파스타', '치즈스틱 3개']",맛있었어요! 서비스로 넣어주신 모닝빵도 너무 좋았고 ㅠㅠ 치즈스틱은 안에 치즈가 꽉차있었습니다! 저희동네가 먼데도 따뜻한건 따뜻하게 찬건 차게 잘 도착했어요^0^!,"['https://rev-static.yogiyo.co.kr/0b335a781264bfb0338b4fffc04a0227_tn.jpg', 'https://rev-static.yogiyo.co.kr/ac57e0e5b8e01aaaf5da3bf9e5f80f47_tn.jpg', 'https://rev-static.yogiyo.co.kr/87fd47a5205478076c04061b1978a58a_tn.jpg']"
121,5,"['베이컨크림파스타', '알리오올리오']",배달인데따뜻하고맛있었어요,[]
122,5,"['해산물크림리조또', '쉬림프토마토리조또']",직접가서 먹는것처럼 맛있고 양도 많네요~포장이 이뻐서 이렇게 포장위주 사진 올려봅니다 ㅎ다음에도 맛있게 부탁드려요!!,"['https://rev-static.yogiyo.co.kr/89182e700988e51e01e9bef5ee3bb0d8_tn.jpg', 'https://rev-static.yogiyo.co.kr/0e2d6085fe83c1762cfd1499b9fef842_tn.jpg']"
123,5,"['쉬림프크림파스타', '알리오올리오']",따뜻하게 맛있는 음식 잘먹었습니당😊😊,[]
124,4,"['해산물토마토파스타', '베이컨크림리조또']",잘먹었습니다 ㅎㅎㅎ,[]
125,5,"['베이컨크림파스타', '버팔로윙 3개', '콜라 355mL']",두번째 먹는건데 넘 맛있숴여~~ 파스타처돌이는 이제 여기서만 시켜먹을랍니더,[]
126,5,"['쉬림프크림파스타', '알리오올리오']",기대보다 더 맛있네요배달파스타라큰기대없었는데두번이나시켜먹고또들어왔네요ㅋㅋ개인적으로 크림추천 오일은..좀 비추해요,[]
127,5,"['베이컨크림파스타', '버팔로윙 3개', '사이다 355mL']",매운거 잘 못먹는데 매콤한 맛 시키고 걱정했는데 딱 매콤 정도여서 좋았어요 양도 많고요!! 다음에 또 시켜먹을게용,['https://rev-static.yogiyo.co.kr/bd66d3f1beb39a2d5feb58e6f90372e2_tn.jpg']
128,3,"['상하이크림파스타', '모닝빵（1개）', '사이다 355mL']","다른가게상하이크림파스타를 진짜 엄청나게좋아하는데 , 친구없어못먹을때 여기서 대체로 배달시켜먹을수있을듯요.파스타안불어서와서 괜찮았고.맛은 보통이었어요.좀매워요여러분",[]
