,별점,주문메뉴,리뷰,사진
0,5,['속초 오징순대＋명태회무침'],오징어 순대 와 명태 무침 소주 한잔하기 딱이네요,[]
1,5,['자연산 서해 통골뱅이 찜탕 '],"국물이 엄청얼큰합니다. 적당히 알싸하고 시원하네요. 주먹만한 통골뱅이로 약 13개 정도 들어있는것 같아요. 골뱅이 내장도 안비리고 신선한걸 쓰시는 느낌이납니다. 사이드로는 사리해먹으라는 칼국수면과 부찬을 주시는데.. 국물이 너무 얼큰해서 먹다보니 칼국수는 못먹을것같습니다ㅠ 좀더 허접해도 작은쭙쭙이소라같은거엿음 더 실용적이었을것같아요. 부찬에 깻잎은 생각보다 잘어울려서 다음엔 더 부탁드릴려구요. 맛있게 잘먹었습니다.포스트잇에 직접 써주신 ""맛있게 드세용"" 보고 열심히 준비해주신것같아 리뷰 남깁니다.",[]
2,5,"['자연산 동해 백골뱅이 찜탕 ', '강릉 꼬막 비빔밥 1人']",맛있어서 사진 찍는걸 잊었어요추운 날 소주 한잔이랑 진짜 잘어울려요골뱅이탕 꼬막 다 맛있어요양도 많인서 둘먹기에 많아요,[]
3,3,['자연산 서해 통골뱅이 찜탕 '],자연산골뱅이는처음먹어보는데정말맛있었어요ㅡ최고예요ㅡ애들도너무맛있어하더라고요ㅡ그런데국물이ㅜㅜ그냥어묵탕같았어요ㅡ저는맑은탕인줄알았는 데어묵탕에골뱅이넣은듯해서너무아쉬웠어요ㅡ재료가너무좋은데국물이너무아쉬웠네요,[]
4,5,['자연산 서해 통골뱅이 찜탕 '],너무너무너무어무어무너무너무너무머무머누너너누너무,[]
5,5,"['강릉 꼬막 비빔밥 1人', '속초 오징순대＋명태회무침']",양도푸짐하고 완전맛있어요!,[]
6,5,"['서해 통골뱅이 찜탕（600g）', '꼬막비빔밥', '소주']",너무너무 맛있어요내일 또 먹고싶을만큼요골뱅이 쫀득쫀득 맛나구요 재료가 신선해서 내장까지 버터맛 바다향기 좋았어요꼬막비빔밥은 무조건 먹어야해요근데 한가지 좀 궁금한건 중자와 대자의 차이가 무엇인지...다른 리뷰에 중자 17~18이라고 해서 대자 시켰는데 골뱅이 17개예요...그냥 중자시킬걸 그랬나요? ㅎㅎㅎ,"['https://rev-static.yogiyo.co.kr/c6dae995bd5f667cb7efe7af721115ed_tn.jpg', 'https://rev-static.yogiyo.co.kr/505cc4606f0e719a1241639edc8a6aaa_tn.jpg', 'https://rev-static.yogiyo.co.kr/32cf2e4745130c3bee172f7c813bd7c3_tn.jpg']"
7,5,['서해 통골뱅이 찜탕（600g）'],지속적으로 시켜먹는 곳인데 항상 좋아요,[]
8,3,['꼬막무침＋비빔밥'],푸잠하고 맛있어요~,[]
9,5,"['동해 서해 반반 통골뱅이 찜탕（350g＋350g）', '꼬막비빔밥']",너무 맛있게먹어서 사진을 못찍었어요~~ 골뱅이 좋아해서 산지직송으로도 많이 시켜먹어요~~근데 1-2일전에 주문해야되서 급 먹고싶을때 급한대로 여기서 주문해서 먹어요~~ 두번째 주문인데 골뱅이도크고 국물양도 많고 국물이 진짜 맛있어요~~ 소주에 먹으면 진짜 피로가 싹~~골뱅이 양이 조금 아쉽지만 .. 그래도 다른집에비해 가성비 좋은편이예요~ 술안주로는 양이 딱좋고 저녁대용으로는 꼬막비빔밥 같이 주문하면 좋아요~~ 꼬막비빔밥도 진짜 맛나요~ 친구들놀러오면 국물땜에 주문할것같아요~~ 또 주문할께요~많이파세요!!,[]
10,5,['세트B（통골뱅이600g＋꼬막무침앤비빔밥150g）'],골뱅이가 쫄깃쫄깃 맛있었어요~~꼬막비빔밥은 그냥 저냥 괜찮음골뱅이 하나에 모래가 엄청 씹혔어요 ㅠㅠ우동은 골뱅이탕에 넣어먹는건가요??,[]
11,5,"['동해 백골뱅이 찜탕（600g） ', '꼬막비빔밥', '참이슬']",맛있네요 또. 주문할께요,[]
12,5,"['동해 서해 반반 통골뱅이 찜탕（350g＋350g）', '꼬막비빔밥']",진짜맛있네요가격이 조금. 쌔지만 맛있음,[]
13,5,"['속초오징어순대＋명태회무침', '꼬막비빔밥']",맛있어요!! 오징어순대 jmt 근데 담에 배달 오실땐 요청사항 확인해주셨으면 좋겠어요~,"['https://rev-static.yogiyo.co.kr/7f6c9430ba31205483ea9b493f00cfa5_tn.jpg', 'https://rev-static.yogiyo.co.kr/5e029716b5f33c5f6800d51856a7c87b_tn.jpg']"
14,4,['속초오징어순대＋명태회무침'],맛있어요 술안주로좋넹ㅅ,['https://rev-static.yogiyo.co.kr/7a49b3a415433b5fd0d12e65e4a48ed1_tn.jpg']
15,5,"['동해 서해 반반 통골뱅이 찜탕（350g＋350g）', '속초오징어순대＋명태회무침', '공기밥']",맛있습니다ㆍ추천이요~~~,"['https://rev-static.yogiyo.co.kr/a45bd6a3cd06cfd460d3e5a575395e2f_tn.jpg', 'https://rev-static.yogiyo.co.kr/ed21f4894a2b6e8d31a71fedabefc718_tn.jpg']"
16,3,"['꼬막비빔밥', '게내장비빔밥']",너무 싱거워영.. 간장을 따로주시는거 생각해보셨음해요.. 너무 밍밍하게 먹었네요..맛은 있어요 꼬막도 탱글탱글하구,[]
17,5,['속초오징어순대＋명태회무침'],맛있어요.양이 적을줄 알았는데둘이 배불리 먹었습니다.,"['https://rev-static.yogiyo.co.kr/ed349b4acfb0dce342e0792b387037bf_tn.jpg', 'https://rev-static.yogiyo.co.kr/688f78f884d40948d0220ee61bf7a4f8_tn.jpg']"
18,3,['속초오징어순대＋명태회무침'],그냥 그래요........,[]
19,5,['속초오징어순대＋명태회무침'],배달도 빠르고 음식도 뜨끈뜨끈~~맛있어요. 다음에는 다른메뉴 주문해볼게요. 담에도 잘부탁드려요^^,['https://rev-static.yogiyo.co.kr/9b8887bd824ec360ab8509b34a8302a4_tn.jpg']
20,4,"['꼬막무침＋비빔밥', '콜라 1.25L']",다른 꼬막밥과 비교해서 안매움쪼꼼 매콤해도 좋을듯,[]
21,4,"['꼬막비빔밥', '게내장비빔밥']",저번에 맛있게 먹어서 다른메뉴로 재주문했는데 리뷰작성한다고 했는데 계란찜이 안와서 맘 상했어요 ㅠㅠ 일회용수저도 필요없다고 했는데 요청사항 안보신듯요. 이상하게 재주문해서 만족스러운경우는 힘든가봐요.,['https://rev-static.yogiyo.co.kr/72876bf21c8622c425c115196d543ee6_tn.jpg']
22,5,['속초오징어순대＋명태회무침'],속초 오징어 순대랑 맛 똑같고 맛있습니다 맛 양 완벽했습니다 잘먹었어요 재주문 할듯합니다,[]
23,2,"['꼬막무침＋비빔밥', '속초오징어순대＋명태회무침']",간이 약해요~ 확 끌리는맛은 아닌것 같아요 ㅠ저는 약간 비려서 못먹었는데 신랑은 잘 먹었습니다.,[]
24,1,['꼬막비빔밥'],사장님음식 장사 이렇게 하지 마세요2만원  적은 돈  아닙니다.2만원 어치의 음식 이라고  생각 하십니까미역국  맞읍니까.어이 없읍니다. 최악 입니다.,[]
25,5,"['속초오징어순대＋명태회무침', '카스']",오징어순대랑 명태회무침은 좋은 안주인것 같습니다. 소맥 생각나면 또 시키겠습니다.ㅎ,[]
26,4,['속초오징어순대＋명태회무침'],맛은 쏘쏘합니다~^^;;따뜻할때 먹으면 더 맛있을것같네요식어서 배달되서 아쉽ㅠㅠ,[]
27,3,['세트B（통골뱅이600g＋꼬막무침앤비빔밥150g）'],골뱅이에 어묵은 조화롭지 않은듯하옵니다...꼬막도 많지만 미나리가 더 많은듯 하옵니다...,['https://rev-static.yogiyo.co.kr/68e23cb36d35605a8087aa02bf616293_tn.jpg']
28,3,"['꼬막비빔밥', '게내장비빔밥']",꼬막비빔밥은 먹을만했고요~ 게내장비빔밥은 쪼금 비렸어요 양은푸짐하고 반찬이랑 미역국 주셔서 그건 만족합니다,['https://rev-static.yogiyo.co.kr/0bd11464d0c733864b601fa022fefa16_tn.jpg']
29,2,"['속초오징어순대＋명태회무침', '꼬막비빔밥']",전에시켰을때는 맛있었는데오늘은  완전실망이네요ㅠ 오징어순대가 쉰건지 신맛이나고 모양도 엉망이고  다들먹다 젓가락 내려놓았답니다ㅡㅡ,['https://rev-static.yogiyo.co.kr/1d4ed4f75e0b5c40927c706c8fb23eaa_tn.jpg']
30,4,"['속초오징어순대＋명태회무침', '게내장비빔밥', '참이슬']",배달정말빨리왔구요~ 게내장비빔밥완전맛있어요!!오징어순대는 조금 비린내가 나서;; 에어프라이어돌려먹으니 좀나아요~^^계란찜양도많고좋은데 미역국은 뭐시키면주시나요? 리뷰보고 같이주시는줄알았는데...ㅜㅜ,"['https://rev-static.yogiyo.co.kr/50d198c9bbb4285d68d32eadde1d2d63_tn.jpg', 'https://rev-static.yogiyo.co.kr/8468336d9febd506896c72b49ec4252e_tn.jpg']"
31,5,"['속초오징어순대＋명태회무침', '꼬막비빔밥']",담백하니 맛있어요. 꼬막좋아하는데 여기서 자주 시켜먹어야겠어요,['https://rev-static.yogiyo.co.kr/480fbcec40483bb9fa74f6643cb3f31c_tn.jpg']
32,5,['세트B（통골뱅이600g＋꼬막무침앤비빔밥150g）'],배달은 엄청 빠름. 근데 골뱅이에 약간의 찌걱거림(이물)이 있어 와이프가 잘 안먹어 혼자 다 먹었네요.,[]
33,5,['꼬막무침＋비빔밥'],꼬막이 너무 짜서 아쉽네요,['https://rev-static.yogiyo.co.kr/d1798134bff88c4854e32c897df14328_tn.jpg']
34,5,['동해 서해 반반 통골뱅이 찜탕（350g＋350g）'],항상 건강하고 맛있는 음식을 만들어 주세요,['https://rev-static.yogiyo.co.kr/005ebe08716eaa4f5323e228323d0538_tn.jpg']
