,별점,주문메뉴,리뷰,사진
1492,5,"['족발', '음료 사이즈 변경(변경 안함)']",족발이 야들야들 너무 맛있게 먹었어요~^^서비스로 주신 막국수 맛도 굿이었어요~👍,['https://rev-static.yogiyo.co.kr/3dc820b7f181362e9ce2ec283a13747d_tn.jpg']
1493,5,"['족발', '음료 사이즈 변경(변경 안함)', '마약계란말이']",금요일 퇴근 후 힐링은 족발과 함께 ㅎㅎ 잘먹겠습니당,['https://rev-static.yogiyo.co.kr/0a4fd7680c98de1c7c59a8634e50aae7_tn.jpg']
1494,5,"['마늘족발', '음료 사이즈 변경(변경 안함)']",맛있게 잘 먹었습니다배달만 조금 빨랐으면..^^,['https://rev-static.yogiyo.co.kr/3cc42cde99072b7805e96997139cc098_tn.jpg']
1495,5,"['마늘족발', '음료 사이즈 변경(변경 안함)', '쟁반막국수']",늘 맛있게 잘 먹고 있습니다~,[]
1496,5,"['족발', '음료 사이즈 변경(변경 안함)']","두번만에 리뷰쓰네요. 완전 최곱니다. 족발 부드럽고, 막국수는 안퍼지고 좋아요","['https://rev-static.yogiyo.co.kr/941bc553776bfdf5bdcc10c7257488eb_tn.jpg', 'https://rev-static.yogiyo.co.kr/58b2ed75aaef239c85026254383fcabd_tn.jpg']"
1497,5,['반반세트（마늘보쌈＋족발）中'],"마늘족발, 직화족발 너무 맛있어요~",['https://rev-static.yogiyo.co.kr/46abbc311878ed61cfcca56ba0dc37ef_tn.jpg']
1498,5,"['족발', '음료 사이즈 변경(변경 안함', '추가 메뉴(주먹밥)']",오랫만에 시켜먹네요ㅎㅎ 추가 주먹밥이랑 서비스 주먹밥 포함해 아이랑 셋이서 먹었는데 '소'자가 딱 맞아요. 찬도 남는거 없이 싹싹 잘먹었어요^^,['https://rev-static.yogiyo.co.kr/96dba1b10c298f42ab9a7eedfc956bad_tn.jpg']
1499,5,"['족발', '음료 사이즈 변경(변경 안함)']",자주 시켜먹는데 맛있습니자,[]
1500,5,"['마늘족발', '음료 사이즈 변경(콜라 1.25L 로 변경)']",맛있었어요애기들도너무잘먹어요,['https://rev-static.yogiyo.co.kr/e7d8c4c2fefb2d8d675395ba288de60d_tn.jpg']
1501,5,"['족발', '음료 사이즈 변경(변경 안함)']",6살 아들이 족발이 먹고싶다고해서 시켰는데 너무 맛있게  잘먹었네요^^내일 아침에  또 먹고싶다고하네요^^,['https://rev-static.yogiyo.co.kr/c23c6e4c3c9577ca50e8e248be9f6e4c_tn.jpg']
1502,4,"['족발', '음료 사이즈 변경(변경 안함)']",전반적으로 맛이 담백한 느낌이에여양은 보기보다 많고 배달도 빨랐습니다,['https://rev-static.yogiyo.co.kr/40f10817b1bb6f5ea0540f9c63c23f29_tn.jpg']
1503,5,"['마늘족발', '음료 사이즈 변경(콜라 1.25L 로 변경', '추가 메뉴(주먹밥)', '참이슬']",언제먹어두 맛나요! 서비스로 주신 막국수에 족발 같이 쌈싸먹으면 끝!,['https://rev-static.yogiyo.co.kr/6960fe8e9140bc5005abdabadc2786bf_tn.jpg']
1504,5,"['족발', '음료 사이즈 변경(콜라 1.25L 로 변경)', '마늘보쌈', '음료 사이즈 변경(콜라 1.25L 로 변경)']",맛있네요ㅋㅋㅋㅋㅋㅋ,[]
1505,5,"['족발', '음료 사이즈 변경(변경 안함)']",족발 맛있어요 같이 오는 무말랭이? 도 맛있어요,[]
1506,5,"['족발', '음료 사이즈 변경(변경 안함)']",사진 먼저 찍고 항상 맛있게 먹고있어요 ~,['https://rev-static.yogiyo.co.kr/6fe4a4764fc7b867ae8153ce6bf04e6d_tn.jpg']
1507,5,"['족발', '음료 사이즈 변경(변경 안함)']",맛있게 잘 먹었습니다 최고~~!!,"['https://rev-static.yogiyo.co.kr/92b742ff45e8f9ac4b547398be300c79_tn.jpg', 'https://rev-static.yogiyo.co.kr/669d90da2405471ffb3aba938639dafb_tn.jpg', 'https://rev-static.yogiyo.co.kr/012c64f039b7433d2040a75562d065be_tn.jpg']"
1508,4,"['직화족발', '음료 사이즈 변경(변경 안함', '추가 메뉴(쟁반 막국수)']",직화족발시켰는데 맛있었어요ㅋㅋ양은 가격에 비해 많지는 않고면도 불어서 온게 아쉽네요ㅠ,[]
1509,4,[],이주변에서 처음 시켜먹는건데 괜찮은거같아요 ㅎ,['https://rev-static.yogiyo.co.kr/c17fba7f3c9dd54d60baf80857a833ea_tn.jpg']
1510,4,[],마늘족발 맛있어요.,[]
1511,5,"['마늘보쌈', '음료 사이즈 변경(변경 안함)']",맛있게 잘 먹었습니다~ 양도 푸짐하니 좋네요~~,['https://rev-static.yogiyo.co.kr/2d09ceb770dbf3acb40b7a0fa7d35498_tn.jpg']
1512,4,"['불족발', '매운맛 선택(1단계 （기본매운맛）', '음료 사이즈 변경(변경 안함)']",밤에 매운게 땡기길래 불족발 고고함께주신 막국수도 거의 메인급이요~너무 잘 먹었어요~,['https://rev-static.yogiyo.co.kr/df5626c133ee12bcca3106f845bc60cb_tn.jpg']
1513,5,"['마늘보쌈', '음료 사이즈 변경(변경 안함)']",30분만에 배달와서 놀랬어요보쌈 맛있고 서비스로 주신 막국수도 맛있었어요(0673),['https://rev-static.yogiyo.co.kr/11a9ae6c6b41a008d342df0f6a748860_tn.jpg']
1514,4,"['마늘족발', '음료 사이즈 변경(변경 안함', '추가 메뉴(주먹', '쟁반 막국수)']",매우 맛있습니다 많이 시켜 드세요,[]
1515,5,"['족발', '음료 사이즈 변경(콜라 1.25L 로 변경)']",리뷰가 늦었네요. 맛있고 쫄깃해서 좋았어요,"['https://rev-static.yogiyo.co.kr/b3b395c8af8281e95e602b80168af146_tn.jpg', 'https://rev-static.yogiyo.co.kr/2acaced0c3027c0f3bdf064f350e2d79_tn.jpg', 'https://rev-static.yogiyo.co.kr/36e2687757fb79630771b3975796b2bf_tn.jpg']"
1516,5,"['족발', '음료 사이즈 변경(콜라 1.25L 로 변경', '추가 메뉴(주먹', '쟁반 막국수)']",맛~~~~~~~~~있어요,[]
1517,5,"['족발', '음료 사이즈 변경(변경 안함)', '보쌈김치추가', '쌈야채추가']",늘 맛있게먹고있습니다~,[]
1518,5,"['족발', '음료 사이즈 변경(콜라 1.25L 로 변경)']",사진 찍었는데 삭제해서요 ㅡㅜ너무아쉽네요.족발 너무 쫀쫀하고 맛있었어요.사실 족발은 그리 좋아하지않는데 너무맛있어서 제가많이먹었네요.강추입니다,[]
1519,5,"['족발', '음료 사이즈 변경(변경 안함)']",항상 맛있게 잘먹고있어요~^^,['https://rev-static.yogiyo.co.kr/31d74b9c0b3f9198110b91e1a6ae2bd9_tn.jpg']
1520,5,"['족발', '음료 사이즈 변경(변경 안함)']",넘 마싰어용 ㅎㅎㅎㅎ서비스도 좋아용,['https://rev-static.yogiyo.co.kr/43314e8010ecaac3d0d1f5cd3386031b_tn.jpg']
1521,5,"['족발', '음료 사이즈 변경(변경 안함)']",맛있어서 정말 순삭했어요ㅎㅎㅎ또 시켜 먹을께요!! 서비스로 주신 쟁반국수도 정말 맛있네요!!,['https://rev-static.yogiyo.co.kr/8c1022a414215dbf1c07b0300d340dbf_tn.jpg']
1522,5,"['마늘족발', '음료 사이즈 변경(변경 안함)', '참이슬']",언제나 여기서만 시켜먹는데 항상 맛있어요^^~,['https://rev-static.yogiyo.co.kr/6a22cb57b070100ef64bcb295ef3a3df_tn.jpg']
1523,5,"['족발', '음료 사이즈 변경(변경 안함)']",맛있어요.  트럼프보고 김정은보고 즐겁게 한잔 즐겼네요. 메밀막국수도 굿,"['https://rev-static.yogiyo.co.kr/b51815ac6053f101e74ef29b0caeb0ec_tn.jpg', 'https://rev-static.yogiyo.co.kr/be03b53ab9c50c45b6680b147d05cf95_tn.jpg', 'https://rev-static.yogiyo.co.kr/c8f9abe9d9ed647eb9197391844027f6_tn.jpg']"
1524,5,"['족발', '음료 사이즈 변경(변경 안함)']",이동네 몇군데 시켜 먹어봤는데 마약보쌈족발 최고 맛있어서 오늘도 시켜서 먹어요~^^,['https://rev-static.yogiyo.co.kr/960a79e95e335c2f2413894fcb4751b5_tn.jpg']
1525,3,"['족발', '음료 사이즈 변경(콜라 1.25L 로 변경)']",리뷰가 많아서 기대했는데 개인적으로는 너무 평범 했어요,[]
1526,4,"['마늘보쌈', '음료 사이즈 변경(변경 안함)']",마늘보쌈 냄새안나고 맛있게 먹었어요마늘양념에 쉰내가 나던데 이건 과일 양념인거 같아요 쉰내같은데 계속 맡아보면 과일양념인거 같아서 맛있게먹었구요김치 무는 양이 너무 적어서 실망했구요 김치랑 무는 맛이그닥이예용ㅋㅋㅋ서비스로 주신 막국수 정말 맛있개 먹었습니다 양념을 더 넣어주시면 좀더 촉촉하게 먹을 수 있을꺼같아요재주문의사 있어요~,['https://rev-static.yogiyo.co.kr/d33e54459e5d1aa21d7fa000b2aca808_tn.jpg']
1527,4,"['족발반반', '족발 선택 2(불족발2단계（매운맛）', '서비스선택(막국수', '음료 사이즈 변경(콜라 1.25L 로 변경)']",아주 맛있고 양도 많았습니다 족발도 보드럽고요,['https://rev-static.yogiyo.co.kr/8faf231c421f4cb499fbe479ac6cce20_tn.jpg']
1528,5,"['족발', '음료 사이즈 변경(변경 안함)']",불타는 금요일~ 혼술을 위해~ 맛있는 족발을 주문햇습니다.여긴 상호명을 참 잘지으신거 같아요~ 한번 빠지면 헤어나올수가 없음 ㅠ^ㅠ오늘도 잘 먹을개용,"['https://rev-static.yogiyo.co.kr/6d888dbd8e3f68afd0eb4719fc73cf2f_tn.jpg', 'https://rev-static.yogiyo.co.kr/28927194f4196b21be5107876ee55ad5_tn.jpg', 'https://rev-static.yogiyo.co.kr/202d0a65e7c1e0a69e39606733c3b19d_tn.jpg']"
1529,5,"['직화족발', '음료 사이즈 변경(변경 안함)']",항상 맛있게 먹고있습니다. 족발에서 불맛이 나는곳은 여기뿐이라 족발하면 마약보쌈족발의 직화족발만 생각나더라고요. 제가 보통 막국수는 잘 안먹는데 서비스로 온 막국수가 맛있어서 잘 먹었구 같이 온 5개 정도 들어있는게 명이나물(?)로 쌈해먹을때도 정말 좋았습니다.,['https://rev-static.yogiyo.co.kr/8e6a0bbc559a5d02f87cfd8f240f2ffe_tn.jpg']
1530,5,"['족발', '음료 사이즈 변경(변경 안함)']",맛있었어요 ㅎㅎㅎㅎ,['https://rev-static.yogiyo.co.kr/21a1007e458023a41319693941888a06_tn.jpg']
1531,4,"['족발반반', '족발 선택 2(마늘족발', '서비스선택(막국수', '음료 사이즈 변경(변경 안함)']",족발 시킬때는 여기만 시켜요~! 매번 맛있게 잘 먹고있습니다:),['https://rev-static.yogiyo.co.kr/73d82db95264cb9347e10ca67d786f5f_tn.jpg']
1532,5,"['마늘족발', '음료 사이즈 변경(변경 안함)']",진짜진짜 맛있어요..족발 야들야들하고 막국수도 맛있고..소자 시켰는데 양도 둘이서 먹기에 딱 좋네요잘먹었습니다~~,"['https://rev-static.yogiyo.co.kr/feb473137646fcd542dbc301f15aa06c_tn.jpg', 'https://rev-static.yogiyo.co.kr/78a44f9a611256b4117f92f3b50f7411_tn.jpg']"
1533,5,"['마늘보쌈', '음료 사이즈 변경(변경 안함)']",아이들도 맛있게 잘먹으니 뿌듯하네요,[]
1534,5,"['마늘족발', '음료 사이즈 변경(변경 안함)']",생마늘을 적절히 양념해서 같이 먹으니 넘 맛나네요~~^^ 또 시켜 먹을 듯~ 7월 이벤트 막국수는 정말 싸구려 음식점들과 달리 맛나네요 ㅋㅋㅋ 면이 쫄깃 쫄깃 부드러움,['https://rev-static.yogiyo.co.kr/ec1266e15434b608b87230e05976aefc_tn.jpg']
1535,5,"['족발', '음료 사이즈 변경(변경 안함)']",맛있게 잘 먹었습니다. 수유 중인 와이프도  잘 먹었습니다.,['https://rev-static.yogiyo.co.kr/ed0016c85ebb5b7fa63952b9c4295890_tn.jpg']
1536,4,"['마늘족발', '음료 사이즈 변경(변경 안함)']",오늘도 맛있게 잘먹었습니다~서비스 비빔국수도 맛있었어요,['https://rev-static.yogiyo.co.kr/f734650dbd53abbbf1001b242e16101d_tn.jpg']
1537,5,"['반반세트（보쌈＋족발）小', '음료 사이즈 변경(변경 안함)']",양도 넉넉하고 정말 맛있어요 남은 족발보쌈 담날 에어프라이어에 데워먹었는데 잡내도 없고 좋았습니다,[]
1538,5,"['족발반반', '족발 선택 2(불족발1단계 （기본매운맛）', '서비스선택(막국수', '음료 사이즈 변경(변경 안함)']",배달의왕 20분만에 배달오는거 처음이였음.. 맛도맛잇구 양도 둘이서 먹는데 배터지는줄,[]
1539,4,"['반반세트（보쌈＋족발）小', '음료 사이즈 변경(변경 안함)']",맛있게 잘먹었어요~,[]
1540,5,"['족발', '음료 사이즈 변경(변경 안함)', '공기밥']",너무맛있고 배달도빨라요,[]
1541,5,"['마늘족발', '음료 사이즈 변경(변경 안함)']",맛있었어요~~ 자주시켜먹을거 같아요,[]
1542,5,"['반반세트（보쌈＋족발）小', '음료 사이즈 변경(변경 안함)']",배달 좋고 좋습니다~^^,[]
1543,5,"['마늘보쌈', '음료 사이즈 변경(변경 안함)']",오늘도 맛있게 잘 먹었습니다서비스로 주신 막국수도 맛있고 양도 많았고보쌈은 언제나 그렇듯 최고네요 ㅎㅎ,"['https://rev-static.yogiyo.co.kr/da0a23fd3bfd0be347e817450037e0f9_tn.jpg', 'https://rev-static.yogiyo.co.kr/e6e2279d051d8c38c03ce796066111bd_tn.jpg', 'https://rev-static.yogiyo.co.kr/6bc6fd415e10a093a5bd166b6301450f_tn.jpg']"
1544,5,"['마늘보쌈', '음료 사이즈 변경(변경 안함)']",배달도 빠르고 양도 넉넉하네여 감사합니다,['https://rev-static.yogiyo.co.kr/aefbc811c2c124d9565512e7ac18fd8c_tn.jpg']
1545,5,"['족발', '음료 사이즈 변경(콜라 1.25L 로 변경', '추가 메뉴(쟁반 막국수)']",빠른 배송. 맛 품질 만족합니다,"['https://rev-static.yogiyo.co.kr/22138009e7043ab9176f3ff1522a8d1c_tn.jpg', 'https://rev-static.yogiyo.co.kr/e76918f8ea92724d00ab6d576d9f7c62_tn.jpg', 'https://rev-static.yogiyo.co.kr/a2dd2394df1527e32bb6ff231ca179db_tn.jpg']"
1546,4,"['마늘보쌈', '음료 사이즈 변경(변경 안함)', '쟁반막국수']",보쌈 원래 좋아해서 만들어도먹고 여기저기 시켜먹는데  여기 먹고 여기서만 주문해요.처음먹었을땐 진짜 감동이였은데 한달에 한번씩은 먹다보니 이제 좀 질리긴하네요거같고 밑에 호일을 작은걸 깔아서 마늘이 무너져서 비닐봉지쪽 밑으로 많이 떨어져 있었어요 ㅠㅠ보쌈에 비해 쟁반국수는 별로지만 (좀더 매콤새콤달콤 했음좋겠어요.)보쌈먹을때 안먹을수 없으니 그냥주문합니다. 서비스 주먹밥도 별거 안들었는데 넘나 맛있었어요.,['https://rev-static.yogiyo.co.kr/eeac291922d30fc93c511af9efc1bf77_tn.jpg']
1547,4,"['족발반반', '족발 선택 2(불족발1단계 （기본매운맛）', '서비스선택(막국수', '음료 사이즈 변경(콜라 1.25L 로 변경)']",처음 시켜먹었는데 나름 괜찮았어요,[]
1548,5,"['족발', '음료 사이즈 변경(콜라 1.25L 로 변경)']",맛있내요 배달도 매우빨라서 놀랬습니다족발도 맛있는데 막국수가 완전 제스타일이내요,['https://rev-static.yogiyo.co.kr/0d4b9039cf1a5e90615f54b2e3759635_tn.jpg']
1549,5,"['족발반반', '족발 선택 2(불족발1단계 （기본매운맛）', '서비스선택(막국수', '음료 사이즈 변경(변경 안함)', '주먹밥']",맛있어요. 불족발 맘에 들어요,[]
1550,5,"['불족발', '매운맛 선택(3단계 （눈물콧물찔끔 단계）', '음료 사이즈 변경(변경 안함', '추가 메뉴(주먹밥', '추가 소스(마약 크림소스（30g）)']",매콤한 세기도 딱 선택한 정도로 알맞게 보내주셔서 너무 맛있었습니다,['https://rev-static.yogiyo.co.kr/d243dd0e9bb4be84d5f657402fcce6be_tn.jpg']
1551,5,"['족발', '음료 사이즈 변경(변경 안함)']",입맛없을때 생각나는 족발 정말 맛있어요~^^,['https://rev-static.yogiyo.co.kr/ea57c5a20d6fb05747270deb99f4b7c4_tn.jpg']
1552,5,"['반반세트（보쌈＋족발）小', '음료 사이즈 변경(변경 안함)']",맛나요 항상 잘먹고있습니다,[]
1553,5,"['족발', '음료 사이즈 변경(변경 안함)']",사진을 못찍었네요오랜만에 시켰는데 역시 맛있습니다,['https://rev-static.yogiyo.co.kr/5cf95e0a0fc012e8ea1f8c960d016f88_tn.jpg']
1554,4,"['마늘족발', '음료 사이즈 변경(콜라 1.25L 로 변경', '추가 메뉴(쟁반 막국수)']",으으우누어춫턴넘누뉴옻,[]
1555,5,['반반세트（마늘보쌈＋족발）中'],너무 맛있게 잘 먹었습니다. 또 주문할께요~,[]
1556,5,"['족발', '음료 사이즈 변경(변경 안함)']",임신하고 족발먹고 싶어서 시켰는데 양도 많고 아주 맛있게 먹었어요서비스로 주신 음료수도 감사합니다 마늘소스?? 도 특이하네요 찍어먹으니 완전 다른맛이예요~쫄깃하고 부드럽고 다음에 또 먹을래요 ㅎㅎ,"['https://rev-static.yogiyo.co.kr/1019b2964c705c82b0f072a230bbb73d_tn.jpg', 'https://rev-static.yogiyo.co.kr/35e7035103a041a79ebb9f91ed2601a7_tn.jpg']"
1557,5,"['마늘족발', '음료 사이즈 변경(콜라 1.25L 로 변경)']",마늘 족발 쫀득하니 마싯어용^ㅁ^다음에두 또 시켜먹을께요~~~,[]
1558,5,"['족발', '음료 사이즈 변경(변경 안함)']",매번시켜먹지만 정말 맛있습니다.,['https://rev-static.yogiyo.co.kr/ee0b39e9e5a0b63614a0992a71f10a44_tn.jpg']
1559,5,"['반반세트（마늘보쌈＋족발）小', '음료 사이즈 변경(콜라 1.25L 로 변경)']",언제나 맛있어요 많이 파세요,['https://rev-static.yogiyo.co.kr/797673412e530aa73fbff386aa360bb0_tn.jpg']
1560,4,"['마늘족발', '음료 사이즈 변경(변경 안함)']",첫주문인데 족발 쫀득쫀득 너무 맛있어요 ~~막국수도 새콤달콤해요ㅎㅎㅎ다음에 또 시켜먹을게요 !,['https://rev-static.yogiyo.co.kr/61368938be88b7d31131a73f1ba18120_tn.jpg']
1561,5,"['마늘족발', '음료 사이즈 변경(변경 안함)']",빠르게 배달왔어요. 항상 여기서 시켜먹습니다. 제 입맛에 잘 맞아요.,['https://rev-static.yogiyo.co.kr/f73ca29d8c995b187be9d5e405ab63f0_tn.jpg']
1562,5,"['마늘족발', '음료 사이즈 변경(변경 안함)']",맛이 정말 끝내줍니다 ㅋㅋㅋㅋ 서비스도 진짜 대박😆❤️,['https://rev-static.yogiyo.co.kr/14c5ee1bbcd7d4e0bb9d1fd72be19189_tn.jpg']
1563,4,"['족발반반', '족발 선택 2(불족발2단계（매운맛）', '서비스선택(주먹밥', '음료 사이즈 변경(변경 안함)']",오랜만에 주문해서 먹었는데 역시 맛있네요~^^,['https://rev-static.yogiyo.co.kr/3935ff90b15bf07e59fe5ce72ea4e937_tn.jpg']
1564,5,"['불족발', '매운맛 선택(3단계 （눈물콧물찔끔 단계）', '음료 사이즈 변경(변경 안함)']",불족먹은곳중에젤매운맛이였습니다.다음에또주문하겠습니다,[]
1565,5,"['보쌈', '음료 사이즈 변경(변경 안함)']",서비스 감사합니다. 식지말라고 배려까지 ㅎ 맛있어요. 7858 입니다,['https://rev-static.yogiyo.co.kr/399c39826137f2ea61a5da894c145062_tn.jpg']
1566,3,"['마늘보쌈', '음료 사이즈 변경(변경 안함)']","3년간 최소 한달에 2번은 배달 혹은 매장방문하여 먹고있는데요. (요기요로는 첫주문)지금까지는 매우 만족을 넘어 추천하면서 다니는데, 오늘은 위생 상태가 너무 안좋습니다.보쌈에선 알수 없는 줄, 깻잎에선 작은 벌레가 나왔습니다.","['https://rev-static.yogiyo.co.kr/919010f9bc77f180357b00252e37443c_tn.jpg', 'https://rev-static.yogiyo.co.kr/102a8eda1c7e8af29688f7bcd87b3b03_tn.jpg']"
1567,5,"['반반세트（마늘보쌈＋족발）中', '주먹밥', '마약 크림소스（30g）']",진짜 맛있어요!!다음에 또 시켜먹을게용,[]
1568,5,"['불족발', '매운맛 선택(2단계 （맛있게매운맛）', '음료 사이즈 변경(변경 안함', '추가 소스(마약 크림소스（30g）)']",간만에 먹은 불족발역시 맛있었어요~~4384,['https://rev-static.yogiyo.co.kr/6d5089644283dc4147beb615baa962e0_tn.jpg']
1569,5,"['마늘족발', '음료 사이즈 변경(변경 안함)']",마늘 족발 진짜 맛있어요! 잡내 전혀없고 마늘덕분에 달달하기까지 합니다. 항상 족발은 여기만 시키게 되네요.,"['https://rev-static.yogiyo.co.kr/3b3e18c26f2756869b1610be62c76eb4_tn.jpg', 'https://rev-static.yogiyo.co.kr/9894fda5457140cedf255c3020da72a4_tn.jpg', 'https://rev-static.yogiyo.co.kr/c1fc8acab2989cc98b2e4153aea7c11e_tn.jpg']"
1570,4,"['족발', '음료 사이즈 변경(변경 안함', '추가 메뉴(쟁반 막국수)']",먹게되면 여기꺼만 주문하는것 같아요맛나요..,[]
1571,4,['반반세트（마늘보쌈＋족발）中'],맛있게 잘먹었습니다! 마늘이 족발이랑 보쌈이랑 어디에든 참 잘 어울리네요! 양이 살짝 더 많았으면 좋겠어요! 그리고 막국수 참 면도 맛있고 양념도 맛있고 좋았습니다!,"['https://rev-static.yogiyo.co.kr/47584f5d0e7fdb409fb6d02c00bf478b_tn.jpg', 'https://rev-static.yogiyo.co.kr/1df063c47599618439d7ed46ba552dca_tn.jpg', 'https://rev-static.yogiyo.co.kr/02821b68cbeef2078d8849ca5af388ce_tn.jpg']"
1572,4,"['족발', '음료 사이즈 변경(콜라 1.25L 로 변경', '추가 메뉴(쟁반 막국수)']","족발 생각보다 맛이 좋았습니다.아쉽다면 부재료(상추,마늘,쌈장...)좀 많이 빈약했습니다.",[]
1573,5,"['직화족발', '음료 사이즈 변경(변경 안함)']",포장 깔끔하고 맛도 좋아요~~,['https://rev-static.yogiyo.co.kr/5a702330e2e4a869381b8f616f1a000d_tn.jpg']
1574,5,"['족발', '음료 사이즈 변경(변경 안함)']",족발 냄새없이 쫄깃해서 너무 맛있어요!항상 여기서 시켜먹어요~^^소스도 맛있고 무짱아찌?너무 입맛댕겨서  밥에. 쓱 올려먹어도 참 맛나요~야채도 깔끔하게 포장되어 신선해요~굿굿!~,['https://rev-static.yogiyo.co.kr/441a3a143a1b7c9ade785a9dd737478f_tn.jpg']
1575,5,"['불족발', '매운맛 선택(2단계 （맛있게매운맛）', '음료 사이즈 변경(변경 안함)']",항상 깔끔하게 배달되어 좋네요역시 맛있어요 ^^ 잘 먹겠습니당,['https://rev-static.yogiyo.co.kr/87ea97ccd5669091cbad81223083d9a1_tn.jpg']
1576,5,"['보쌈', '음료 사이즈 변경(변경 안함)']",보쌈집 알바했던 친구가 극찬을 하네요장사좀 할 줄 아는 집이라며..잘 먹었습니다,['https://rev-static.yogiyo.co.kr/21387f5d65c173d8cb13b5aba918e14f_tn.jpg']
1577,5,"['족발', '음료 사이즈 변경(변경 안함)']",족발 원픽집을 찾았습니다. 족발도 야들야들 막국수도 새콤 맛있고 밑반찬도 맛있어요.다만 아쉬운게 묵사발이라고 하나요? 더운 날씨에 살짝 맛이 간 것 같았어요. 저는 이상했고 남편은 괜찮다고 했는데 한번 확인 부탁드려요~,['https://rev-static.yogiyo.co.kr/fe0133d1000d348ad328ed72543bb08f_tn.jpg']
1578,5,"['마늘족발', '음료 사이즈 변경(변경 안함)']","족발,주먹밥 푸짐해서 맛있고 배부르게 잘먹었습니다.무말랭이랑 명이나물도 맛있네요^^",['https://rev-static.yogiyo.co.kr/4c2773e59738156a201473bdb0051e3a_tn.jpg']
1579,4,"['반반세트（보쌈＋족발）小', '음료 사이즈 변경(변경 안함)']",항상 맛있게 먹고 있습니다.근데 오늘은 보쌈 아래 비닐 물주머니가 터져서 보쌈이 물에 잠겨서 왔네요ㅜㅜ,"['https://rev-static.yogiyo.co.kr/98445137083c62cf7b9c5ff3e9bf94eb_tn.jpg', 'https://rev-static.yogiyo.co.kr/72c89b6f9f5848f994bba416590464a8_tn.jpg']"
1580,5,"['직화족발', '음료 사이즈 변경(변경 안함)']",항상 시키면서 느끼지만 맛의 퀄리티가 다른곳과는 비교가 안되는게 단순히 메인인 족발뿐아니라 같이오는 쌈과 안에들어갈 재료부터 명이나물 막국수가 굉장히 맛있어요 다음에는 명이나물 좀만 더 달라고 할까봐요!,['https://rev-static.yogiyo.co.kr/f05b00703328d29c5f2a0a943f72cdda_tn.jpg']
1581,3,"['족발', '음료 사이즈 변경(변경 안함)', '무뼈닭발']",족발은 기름기가 좀 있긴하지만 냄새 안나고 맛있어요.닭발은 역시 맛있어요~~,[]
1582,5,"['마늘족발', '음료 사이즈 변경(변경 안함)']",항상 잘 먹고 있어요. 작은 문제가 있었는데 최선을 다해서 응대하시는 모습에 고마움을 느꼈습니다. 또 주문할게요.,"['https://rev-static.yogiyo.co.kr/fb8a814f296f1c26f3bb3c287d40c18f_tn.jpg', 'https://rev-static.yogiyo.co.kr/8f9063a41316f29204e3e18ddc2e56da_tn.jpg']"
1583,5,"['족발', '음료 사이즈 변경(변경 안함)']",족발은 여기서만 시켜요,[]
1584,5,"['불족발', '매운맛 선택(2단계 （맛있게매운맛）', '음료 사이즈 변경(콜라 1.25L 로 변경', '추가 메뉴(쟁반 막국수)']",배달도 시간 맞춰 왔구 양도 넉넉해요,['https://rev-static.yogiyo.co.kr/5ff907b991cd0cfce6d92bc6371b47ba_tn.jpg']
1585,4,"['마늘보쌈', '음료 사이즈 변경(변경 안함)']",너무 맛있습니다 마늘족발,[]
1586,5,"['족발', '음료 사이즈 변경(변경 안함)']",허겁지겁먹다 찍었네요 ㅎ윤기가 자르르~  늘 맛있는데 오늘따라 더 맛있다하네요♡,['https://rev-static.yogiyo.co.kr/9ba86b569ebaf3b7e9d8cb0af6cc0467_tn.jpg']
1587,5,"['족발', '음료 사이즈 변경(콜라 1.25L 로 변경', '추가 메뉴(주먹', '쟁반 막국수)']",항상 잘 먹고 있어요,[]
1588,5,"['보쌈', '음료 사이즈 변경(변경 안함)']",마늘만 먹다가 그냥 보쌈 시켜봐ㅛ는데존맛이네요 ㅋㅋ 막국수도 맛남 ㅋㅋ,['https://rev-static.yogiyo.co.kr/7f408d32c2cdf38e5787497a2df72a4f_tn.jpg']
1589,5,"['마늘보쌈', '음료 사이즈 변경(콜라 1.25L 로 변경)']",처음먹어봤는데 정말 맛있네요,"['https://rev-static.yogiyo.co.kr/d42b33807021af2cd8499f417199bae8_tn.jpg', 'https://rev-static.yogiyo.co.kr/e961c2e1ece99532a3f8493207d50150_tn.jpg']"
1590,5,"['족발', '음료 사이즈 변경(콜라 1.25L 로 변경)']",맛있게잘먹었습니다~~~^^,[]
1591,5,"['불족발', '매운맛 선택(1단계 （기본매운맛）', '음료 사이즈 변경(콜라 1.25L 로 변경', '추가 메뉴(쟁반 막국수)']",족발 부드럽고 1단계가 맵기도 적당하구 좋아요!!배달도 빠르고 너무너무 맛있어요!!근데 불족발에 피클말고도 덜매운 반찬 같이있음 좋을것같아요!,['https://rev-static.yogiyo.co.kr/13eb8cec367520ee3ff1a9effedee7d2_tn.jpg']
