,별점,주문메뉴,리뷰,사진
0,5,"['꿀마늘보쌈도시락 ', '모듬쌈야채 ', '5찬', '막국수 小', '김치찌개 ']","배달은 그리 빨리 오진 않았지만 보통이었던거 같아요. 저는 꿀마늘보쌈 도시락이랑 막국수 소, 김치찌개, 사이드 조금 해서 시켰는데 양도 많고 고기도 싱싱해서 좋았어요. 새로 오픈하신거 같은데 자주 이용하겠습니다!! 담에도 잘 부탁드려요!! 번창하세요!!",['https://rev-static.yogiyo.co.kr/8a1d1556f747bb30a3887ca6b6762871_tn.jpg']
1,3,['꿀마늘보쌈도시락 '],총체적 난국입니다쏘스만 않샜어도...정성이 묻어나는 포장과 아이디어도 좋았는데...조그만 실수가...,"['https://rev-static.yogiyo.co.kr/0a775d4f6a1b665676e7037ed52bb075_tn.jpg', 'https://rev-static.yogiyo.co.kr/53e7ad5e662963611f6ff3f4d47332cf_tn.jpg', 'https://rev-static.yogiyo.co.kr/71567dd4e580171a3645c3f7343656dc_tn.jpg']"
2,4,"['꿀마늘족발도시락 ', '막국수 小']",가격대비 양 많고 맛도 좋음불가한 희망사항이 있다면 않뿔는 잔치국수였으면...,"['https://rev-static.yogiyo.co.kr/954c5f5ca083d6468ddcf3c0f4c7de42_tn.jpg', 'https://rev-static.yogiyo.co.kr/eb2a62d926d04510ebe189e0e3d6d7c5_tn.jpg']"
3,4,"['꿀마늘보쌈도시락 ', '공기밥 ', '5찬', '막국수 小', '김치찌개 ']",국수가 퍽퍽 ㅠㅠ 약간의 육수가 있어도 좋겠어요 ㅠㅠ,[]
4,5,"['꿀마늘보쌈도시락 ', '막국수 小']",양 핵많아서 남겼어요! 푸짐합니다ㅎㅎ근데 막국수 소스가 약간 부족해요ㅠㅠ,[]
5,5,"['꿀마늘보쌈 ', '막국수 小']",배달 넘 깔끔하고 좋았어요근데 마늘보쌈이 먹다보니까 물리더라고요ㅠㅠ 담엔 그냥 보쌈 먹을래요!!!고기는 냄새도 안나고 최고에여그리거 막국수 시켰는데 서비스로 또 막국수 주셔가지고 못먹고 버렸어여ㅠㅠㅠ흑흑 박스는 고양이가 조아하네요,"['https://rev-static.yogiyo.co.kr/86cadfe13e3e1fbbccf35f7b5cae7712_tn.jpg', 'https://rev-static.yogiyo.co.kr/5b70422a560ed208e33153884be95db8_tn.jpg', 'https://rev-static.yogiyo.co.kr/959169837307d93fbbb8cdb41ef0c356_tn.jpg']"
6,5,['데리야끼보쌈도시락 '],매우 맛있었어요 서비스도 받았고요!,['https://rev-static.yogiyo.co.kr/d4c66cf81a87e84e68ea10de070d80c4_tn.jpg']
7,5,['보쌈 도시락 '],족발 여기저기 자주 시켜먹는데 영통에서는여기 배사장 고기가 제일 나음쟁반국수도 우리가 상상하는 대부분 좋아하는 맛으로 양념되서호불호없이 그냥 호포장은 요즘 다른 곳도 깔끔해서 패스배송 빠름 20분만에 옴,[]
8,5,['보쌈 도시락 '],배달이 생각보다 빨랐어요 고기가 약간? 느끼한 것 같지만 양이 푸딤하고 먹기 좋았어요,[]
9,5,"['미니족＋보쌈', '보쌈 선택(갈릭보쌈)']",너무 맛있었어요!미니족 수율이 약간 낮긴 했지만 전체적으로는 만족입니다!,[]
10,5,['보쌈 도시락 '],"배달도 진짜 빠르고 생각보다 양도 진짜 많고 맛있어서 놀랬어요!! 여기 완전 좋아요ㅠㅠㅠㅠ앞으로 보쌈, 족발은 여기서 시켜먹을거에용!!감사합니다!!","['https://rev-static.yogiyo.co.kr/a71ac9c6dbb727840caf4c72a64b2beb_tn.jpg', 'https://rev-static.yogiyo.co.kr/45267ad94e4ecdfd6b5c1a46351145d0_tn.jpg', 'https://rev-static.yogiyo.co.kr/a12af0586b9f8505366723b8616b561c_tn.jpg']"
11,4,['직화족발도시락 '],당골입니다만족합니다 리뷰 않써도될만큼 잘 먹고 있습니다,[]
12,5,['보쌈 도시락 '],푸짐하고 고기 맛나요~~~~또시킬께요,"['https://rev-static.yogiyo.co.kr/07d517792c40800aeda0abe5e42db870_tn.jpg', 'https://rev-static.yogiyo.co.kr/69b0a698eb4550c8ec9f365a50bbf962_tn.jpg', 'https://rev-static.yogiyo.co.kr/a868712898e5a77402a781386c7f996e_tn.jpg']"
13,4,"['족발＋족발', '메뉴 선택(불족', '족발)']",막국수 맛있어요 족발은 냄새 안나고 괜찮아요,['https://rev-static.yogiyo.co.kr/bd7863af27147801bd3cbc5cf8f6b647_tn.jpg']
14,5,"['족발＋보쌈', '족발 선택(직화족발', '보쌈 선택(꿀마늘보쌈)']",꿀마늘보쌈 처음이었는데 맛있었어요~ 직화족발도 맛나구요~ 낮엔 배사장의시켜족보쌈족발에서  ~고고,[]
15,5,"['꿀마늘보쌈도시락 ', '펩시  500mL ']",매번 먹을때마다 맛에놀라고~양에 놀랍니다!!,[]
16,5,['꿀마늘보쌈도시락 '],맛나게 잘먹었습니다~~^^,"['https://rev-static.yogiyo.co.kr/ab9ed32fbbf0ec4288b9d0f91c636c97_tn.jpg', 'https://rev-static.yogiyo.co.kr/5503d1c8dff419c55acb6c789b48b75e_tn.jpg', 'https://rev-static.yogiyo.co.kr/475223e708cb96f8703d067f462d3ab5_tn.jpg']"
17,4,['꿀마늘보쌈도시락 '],이름부터 꿀마늘보쌈이긴한데 그래도 그렇다고해도 너무 달아요. 맛있는데도 배 차기 전에 질립니다. 달아서 그런지 좀 느끼한 거 같기도 하네요. 다음에는 그냥 보쌈을 먹어보고 싶어요,[]
18,5,"['족발＋보쌈', '족발 선택(족발', '보쌈 선택(보쌈)']",오랜만에 족발 보쌈이 먹고싶어서리뷰 믿고 주문해 봤습니다😎전날부터 요기요 켜놓고 검색해놨었거든요 ㅋㅋ후기대로 빠른 배달과 센스있는 포장에 1차로 기분좋았구요보쌈도 족발도 굿굿!! 최고 맛있었어요 >.<소자 시켰는데도 양이 많아서 여자둘이 먹었더니 꽤 남아서저녁에 또 먹으려구요ㅋㅋㅋ막국수는 보내주신 야채랑 양푼이에 넣고 비볐더니푸짐한 양!! 매콤 새콤 달콤 넘 좋아요 별미❤️정말 맛있게 잘 먹었습니다 (｡˃ ᵕ ˂ )ƅ다음번엔 시켜락! 도시락류도 주문해 봐야겠어요:),"['https://rev-static.yogiyo.co.kr/41b064ac58bb428eb283a1e25b9e30d2_tn.jpg', 'https://rev-static.yogiyo.co.kr/b590c76bacf0a18732086becdbc29b5a_tn.jpg', 'https://rev-static.yogiyo.co.kr/60b6f2aeb9f55ca28a20b4a676027b4b_tn.jpg']"
19,4,"['보쌈 도시락 ', '부추전 ']",가격대비 양도많고 맛있었어요ㅎ 주문할때보니 막국수서비스라고 써있길래 따로주문안했는데 아니였나보네요ㅎㅎ;걍시킬걸ㅋ; 배달도빠르고 만족합니다~담에또시켜먹을께요^^,['https://rev-static.yogiyo.co.kr/bbf0c39b25d8b5ffb2ad422dd5e69680_tn.jpg']
20,4,"['보쌈 도시락 ', '막국수 小']",양이 대박~~~ 맛도 있네요. 감사합니다.감동주는 패키지 긋~~~,"['https://rev-static.yogiyo.co.kr/08180e925a2ae1c3f4a6c5326463f85e_tn.jpg', 'https://rev-static.yogiyo.co.kr/94dc1a62923e9bbd8c4bef71f4a2fa75_tn.jpg', 'https://rev-static.yogiyo.co.kr/07ce54f122e7167b3d121317afe64e61_tn.jpg']"
21,5,"['족발＋보쌈', '족발 선택(직화족발', '보쌈 선택(보쌈)']",가격 대비 양이 진짜 맛아요 맛도 괜찮구요 포장 박스도 마음에 듭니다,[]
22,5,"['족발＋보쌈', '족발 선택(직화족발', '보쌈 선택(바베큐보쌈)']",맛있어요~~바베큐양념맛있네요 족발직화도 짱!,['https://rev-static.yogiyo.co.kr/a5a8a776cd1440205c7babf69e9ae50d_tn.jpg']
23,5,"['보쌈 도시락 ', '막국수 小']",밥에 간이되어있어서 쪼금짰어요도시락인데 크기와 양에 감동🙀😆다음에 또 시켜먹을께요~,"['https://rev-static.yogiyo.co.kr/56c522ebbae2d63f889b3835df2f23c4_tn.jpg', 'https://rev-static.yogiyo.co.kr/9b97fde61e50355bcd602a28badc64f0_tn.jpg']"
24,4,['꿀마늘족발'],바쁘지 않은 시간대에 주문해서 빨리오긴했는데 정말 너무 빨라서 놀랐어요 ㅎㅎ음식도 리뷰보고 혹시나하는 마음에 시켰는데 다행히 실망시키지않았어요 ㅋㅋ음식마다 붙어있는 스티커 읽는재미가 쏠쏠 했습니다^^,"['https://rev-static.yogiyo.co.kr/4844ff656ede1c6e12577c69c8f1e9db_tn.jpg', 'https://rev-static.yogiyo.co.kr/c78da87e951293082dd60dab60b68a9d_tn.jpg']"
25,3,['족발 '],포장이나 비쥬얼이 너무 이쁘고 맛도 있는데 양이 너무 적어서 아쉬웠어요.,[]
26,3,['보쌈 도시락 '],개인 적으로 무말랭이 별로인듯,[]
27,5,['족발 '],실망하지않는 맛~! 정말 맛있어요~,[]
28,5,['보쌈 도시락 '],"깔끔하고 꼼꼼한 포장부터 기분 좋았고 특히 국, 새우젓은 배달중 새지않게 비닐포장 한번 더 한 세심함이 좋았어요. 고기 잡내도 없고 양도 많고 맛있게 잘 먹었네요.","['https://rev-static.yogiyo.co.kr/78938e96452e01a50a9b1b74df2e53af_tn.jpg', 'https://rev-static.yogiyo.co.kr/8f7bb4324922e7fed98aafd198c297d3_tn.jpg']"
29,5,['보쌈 도시락 '],가격대비 양도 정말많고 배달도 빨라서 넘좋아여 ㅎㅎ 보쌈이나 족발같은건 혼자서 먹기 가격이 좀부담돼는데 이제 부담없이 보쌈이나 족발먹고싶을때 여기서 시켜먹으면되겠내여 ㅎㅎ,[]
30,5,['불족발 도시락 '],맛있는 매운족발이였어요^-^!!또 시킬께욤!!너무 맛있었습니당!!~~,['https://rev-static.yogiyo.co.kr/fa0a1ac2dea19d7e375c727cc6230915_tn.jpg']
31,5,['막국수 大'],막국수 먹었는데 맛있네요,[]
32,5,"['족발＋보쌈', '족발 선택(족발', '보쌈 선택(보쌈)', '막국수 小']","양도 많고, 반찬도 다양하게 많이,  정갈하게 구성했네요~근래 먹어본 족발 보쌈 중에 최고였어요.",[]
33,5,"['족발＋보쌈', '족발 선택(불족발', '보쌈 선택(꿀마늘보쌈)', '스프라이트 500mL ']",포장 패키지 받는 순간부터 깜짝 놀랐어요마늘보쌈도 너무 부드럽고 달달하고 불족발도 매운거 못먹는 저한테도 매콤하니 좋았어요!! 부모님이 족발보쌈 안좋아하시는데도 같이 앉아서 다들 여기 맛있다고 칭찬하면서 잔뜩 먹었어요ㅋㅋㅋㅋ 서비스로 주신 막국수도 너무 맛있구ㅠㅠ 아 근데 저는 불족발보다 막국수가 더 매운거 같아서 이건 별로 못먹었어요ㅠ그래도 존맛탱💜,['https://rev-static.yogiyo.co.kr/1aeac7e4b3c1b065eca2cdf2cc3e4f3e_tn.jpg']
34,5,"['데리야끼보쌈도시락 ', '김치찌개 ']",일단 엄청 맛있고요. 양도 미쳤어요...배달도 엄청 빨리오는편이고...매우 만족스러운 곳이에요 가성비 대박에 맛대박...최고!,"['https://rev-static.yogiyo.co.kr/da59add2dfb8ee0e7427dfac6e38ba03_tn.jpg', 'https://rev-static.yogiyo.co.kr/af87b77d6ac7ea0f1183c4bcce016ac8_tn.jpg']"
35,5,"['족발＋보쌈', '족발 선택(불족발', '보쌈 선택(보쌈)', '계란찜 ']",불족은 불같이 맵지않아 누구나 즐길 수 있을 정도며보쌈은 깨작깨작한크기가 아니라 도톰하니 씹을맛이나며막국수는 반반을 시킬시 짝짝꿍으로 같이오며콜라도 시원하게 큰걸로 쥬셨습니다 배달은 빨랐으며포장은 25년전 어린이날 받던 과자종합선물세트같은 감각적 색상을 자랑하며 큰박스 포장으로 정갈하게 세팅되어져 옵니다 매혹적인 자석딱지쿠폰은 냉장고에 악세사리로 붙어있으나 총 사진을 3개밖에 못올리기에 미첨부하는 바-보쌈과 족발중 고민하는 이들에게 매운것을 잘 못먹는 이들에게 콜라대량흡입하는 이들에게 추천합니다 . 양많음,"['https://rev-static.yogiyo.co.kr/89e02ff31ed1aca788de7316f9cf932f_tn.jpg', 'https://rev-static.yogiyo.co.kr/4efb41a56d08e818082185a2f70cd0c9_tn.jpg', 'https://rev-static.yogiyo.co.kr/38bfebad247bbc9555fa5e776c123302_tn.jpg']"
36,4,"['족발＋보쌈', '족발 선택(불족발', '보쌈 선택(보쌈)']",반찬 따로 안 받는다고 했는데 쌈채소 더 챙겨주셔서 감사합니다 배달이 예상 배달시간보다 늦어져서 참을성이 바닥 나려했는데 진라면 서비스 감동이였어요 양도 적당해서 잘 먹었습니다 수고하세요!,"['https://rev-static.yogiyo.co.kr/4d61ddcec7098cee88ac73fdc686168f_tn.jpg', 'https://rev-static.yogiyo.co.kr/7c5bb475ed246c0091f0849ac306a927_tn.jpg', 'https://rev-static.yogiyo.co.kr/19aaeac660ec1d81af5b191d5b472fd3_tn.jpg']"
37,5,['갈릭보쌈도시락 '],먹기전에 당연한 인증샷!!! 먹는도중 넘나맛나서 바로 리뷰작성합니당~~~번창하세용ㅎ,['https://rev-static.yogiyo.co.kr/5fce053660e016b154ed1f20dc60cd27_tn.jpg']
38,5,"['불족발 ', '주먹밥 ']",배달:30분정도 소요(예상소요시간보다빠름)         배달하시는분 친절하셨음포장:여지껏 먹어본 배달음식중 제일 정성스럽게포장맛:불족시켰는데 맵진않지만 맛있음(윤기좔좔)매운거 못먹는사람과 불족을 즐길수 있을정도결론 : 또 불족이 생각난다면 배사장 시켜족!!!,"['https://rev-static.yogiyo.co.kr/daac13ce90691aed8fb54801307291ff_tn.jpg', 'https://rev-static.yogiyo.co.kr/463363543006919260e2c45789e25ae4_tn.jpg', 'https://rev-static.yogiyo.co.kr/c752f46a0c28c0414b16b419ceae32b1_tn.jpg']"
39,5,"['보쌈 도시락 ', '김치찌개 ']",삼겹살만 먹어봤었는데 보쌈도 맛있네요 ㅎㅎ보쌈도시락에 김치찌개 추가했어요리뷰이벤트로 음료 사이즈업했는데 500왔어요. 원래 캔을 주시나봐요마늘 좀 더 부탁드렸는데 한 통 더 주셨어요!도시락만 시켜도 마늘이랑 쌈채소 와요.밥은 흰쌀밥 아니고 볶음밥이 오구요무절임이랑 김치 진짜 맛있어요~김치찌개는 맛있긴한데 조금 짰어요ㅠㅠ 담에 물넣어서 한 번 더 끓여먹어야 되겠더라구요..전체적으로 양이 진짜 많아요.. 보쌈은 절반 먹고 절반 남겼네요ㅋㅋ맛있게 잘 먹었습니다~~,"['https://rev-static.yogiyo.co.kr/1c21b5933d6ce7358c30d0985c93a95c_tn.jpg', 'https://rev-static.yogiyo.co.kr/bed427626ed1f3985148e85db233fa53_tn.jpg']"
40,5,['불족발 '],불족발 넘 맛있어요 하루에다 못먹어서 다음날 전자렌지에 돌려먹었는데도 넘 맛있어요ㅠㅠ배달도 빨리 오고 좋았슴다!,['https://rev-static.yogiyo.co.kr/c719281333aecad104636527cb711fb0_tn.jpg']
41,5,"['족발＋보쌈', '족발 선택(불족발', '보쌈 선택(보쌈)']","먹을때마다 너무 만족해요!! 항상 맛있고 보쌈, 족발 둘다 넘 맛있네요! 막국수가 조금 맵긴한데 양도많고 맛있었어용! 여기는 이제 그냥 믿고시키는거 같아용ㅎㅎㅎ",[]
42,5,"['데리야끼보쌈도시락 ', '펩시  500mL ']",늘 맛도있구 양도많구 배달빨라요:)♡,[]
43,5,['보쌈 '],특별하진않은 맛이었지만 양도 완전 많구 밑반찬도 정갈하고 포장이 센스잇엇슴 아 면 생면인건 알겠지만 너우어우어어우우어워어어어무 부드러워요ㅎㅎ,['https://rev-static.yogiyo.co.kr/ddb92fb31d1358e26e0b9d887d28d4c2_tn.jpg']
44,5,"['족발＋보쌈', '족발 선택(직화족발', '보쌈 선택(보쌈)']",처음시켜봤는데 포장받자마자 센스짱~깔끔하게 왔어용..직화라 탄부분은약간 쓴맛이났는데그래도 맛있었어요 ~또 시켜먹을께용.. 다른맛이 궁금합니당..,"['https://rev-static.yogiyo.co.kr/158ff9d839f348222187af348b39faab_tn.jpg', 'https://rev-static.yogiyo.co.kr/c88991139661e46bb642755231339b8b_tn.jpg', 'https://rev-static.yogiyo.co.kr/5d1781573b8bc69e7a188af41576c46d_tn.jpg']"
45,5,['불족발 도시락 '],와플까지...넘 맛잇엇서요.....오이 냉국이라 쪼꼼...그랫지만....안먹으면 되니까요....잘먹엇습니다....,['https://rev-static.yogiyo.co.kr/82a038180539afc438c98da6df01a5a3_tn.jpg']
46,5,"['족발＋보쌈', '족발 선택(불족발', '보쌈 선택(바베큐보쌈)', '공기밥 ']",맛도 맛있고 양도 많고 무엇보다 한상 푸짐하게 배달오네요 ㅎㅎ,"['https://rev-static.yogiyo.co.kr/b3badbc1690c1837010315c096000c18_tn.jpg', 'https://rev-static.yogiyo.co.kr/eea14a6ec8e7d1ec687304b5b9c407f2_tn.jpg', 'https://rev-static.yogiyo.co.kr/f0fe33b38e722af4055b632a39ebe5bf_tn.jpg']"
47,5,['꿀마늘보쌈도시락 '],양도 엄청 많고 디저트까지 드실 수 있습니다! 혼자 먹기엔 양 많아요!,['https://rev-static.yogiyo.co.kr/6668c9dee165e7fd2324d00f6495d906_tn.jpg']
48,5,"['보쌈 도시락 ', '막국수 小']","배달하시는 분이 문이 부셔질것 마냥 쾅쾅거리시면서 열자마자 에이씨 엘레베이터도 안되네 하시길래 너무 놀라고 기분이 안좋았네요 ㅠㅡ 근데 배달은 가게측과 상관이 없다는걸알아서 별점은 다섯개 남겨요!! 포장이 진짜 정성스럽게 되어 있고 배달원분들때문에 상한기분 음식 먹으면서 풀리네요 ㅎㅎㅎ 고기도 따뜻하게 잘 왔구 막국수도 기분좋은 맵기로 맛있네요 와플도 대박이에요.. 식사하고 단거 딱 먹으면서 기분 좋아지는!! 비닐장갑까지 챙겨주셔서 음식, 포장으로는 전혀 흠잡을곳이 없네요 재구매 의사 백프로입니다 잘먹었습니다~!!",[]
49,5,['보쌈 도시락 '],빠른배달감사드립니다하지만 오이냉국은..,[]
50,5,['보쌈 도시락 '],배달도 넘 깔끔하게 잘하고 음식도 맛있어요 :)1인용 메뉴가 있어서 좋은거 같아요! 양이 많아서 둘이 먹어도 괜찮은거 같아요 ㅎㅎ,"['https://rev-static.yogiyo.co.kr/2d0b40452e7e22c7dccb32926cff6e2a_tn.jpg', 'https://rev-static.yogiyo.co.kr/a4df175c0137c6dc0fa48b59db9c5b94_tn.jpg']"
51,5,['불족발 도시락 '],ㅠㅠ 너무배고파서 급하게 먹는바람에 사진을 못찍었네오불족 시켰는데 달다구리매콤하게 넘 맛있게 먹었구요!!포장도 정말 깔끔하고 메뉴구성도 넘 좋았습니다♡쌈추가 해달라고 했는데 하나더 보내주시고ㅠ아 그리고족발집에서 밥오는거 처음봐서 밥순이인 저는 더 좋았네요!또 시켜먹을게용,[]
52,5,"['직화족발도시락 ', '막국수 小']",포장도 깔끔하고 맛도 좋고 양도 많았어요! 도시락에 푸실리샐러드 대신 막국수가 들어갔음 좋겠어요. 막국수까지 시끼니까 양이 넘 많더라구요! 담에 또 시킬게요,"['https://rev-static.yogiyo.co.kr/19e301d692d6de3915147a7d77473cc2_tn.jpg', 'https://rev-static.yogiyo.co.kr/623e13c5a0821535ac087737cd14d239_tn.jpg']"
53,5,"['족발＋보쌈', '족발 선택(족발', '보쌈 선택(갈릭보쌈)']",맛과 양 모두 충족! 배달이 조금 아쉽지만 뭐 배달은 복불복이죠 ㅎㅎ 리뷰남긴다고 요청사항에 남길걸 ㅜㅜ 깜빡햇더니 500짜리 서비스 주셧어요.아 저는 보쌈이 진짜. 막국수랑 잘어울리더라구요. 갈릭보쌈!,['https://rev-static.yogiyo.co.kr/2e5ba46f43cfe91882bbc8fc44254dd4_tn.jpg']
54,5,"['족발＋보쌈', '족발 선택(직화족발', '보쌈 선택(꿀마늘보쌈)']",추천합니다~~~~~~~~~~~,['https://rev-static.yogiyo.co.kr/ba628d769bf7d67b0ff9cce5bc2d7c62_tn.jpg']
55,5,"['족발＋보쌈', '족발 선택(직화족발', '보쌈 선택(꿀마늘보쌈)', '공기밥 ']",진짜진짜 맛나요 그리고 양 짱많더라고요,['https://rev-static.yogiyo.co.kr/3b53b0e5fd022daa560b37e72320afdf_tn.jpg']
56,5,['직화족발도시락 '],맛도 양도 촤고에요! 쿠폰 수집중 ㅎㅎ,['https://rev-static.yogiyo.co.kr/3244ea6f35b8bc023446066556b2f199_tn.jpg']
57,4,"['족발＋보쌈', '족발 선택(꿀마늘족발', '보쌈 선택(보쌈)']",맛있어요! 배달도 빠르구~ 근데 양이 어어어엄청 많지는 않아요! 서비스로 주시는 막국수를 엄청 맛있게 잘 먹었네유,"['https://rev-static.yogiyo.co.kr/55bbd4311e020a56eef0a57ffb92d8da_tn.jpg', 'https://rev-static.yogiyo.co.kr/ff2d04baed1e58eaed8c3e7f6277b4b0_tn.jpg', 'https://rev-static.yogiyo.co.kr/c890629052120bada0e0994e95816e4c_tn.jpg']"
58,5,"['족발＋족발', '메뉴 선택(직화족', '불족발)']",맛있네요  막국수가  살짝 매우면서도 맛있고  족발도 맛있네요,[]
59,5,"['족발 ', '계란찜 ']",막국수 면을 계란찜 위에 주셔서 뜨거웠던 거 말고는 완전 맛있고 배부르게 잘 먹었습니다! 서비스도 왕창 주시고 양도 많고 포장도 너무 깔끔해서 더 좋았어요 감사합니다!,"['https://rev-static.yogiyo.co.kr/8c5d168b3a135caf90ed95dbff7cbaaf_tn.jpg', 'https://rev-static.yogiyo.co.kr/88e53e128213a19b1f393c067a0addc0_tn.jpg']"
60,5,"['족발＋보쌈', '족발 선택(불족발', '보쌈 선택(보쌈)']",맛있게잘먹었습니다 ~~~~^^,[]
61,5,"['족발＋보쌈', '족발 선택(불족발', '보쌈 선택(꿀마늘보쌈)']",여기서 두 번째 주문이에요! 다른 고민 없이 족발과 보쌈은 이곳에서 먹으려구요음식도 깔끔하고 양도 많고 맛도 좋아요저번에는 컵라면도 주셨었는데 이번에는 없었지만그래도 만족해요! 다음에 또 주문할게요~,['https://rev-static.yogiyo.co.kr/6c2f7b603456a69ccd228e9ad039112c_tn.jpg']
62,5,['갈릭보쌈도시락 '],갈릭보쌈 너무 맛있어요 ~다음에도 시킬게요,[]
63,5,['보쌈 도시락 '],정성 가득 감사합니다 잘 먹었어요,[]
64,5,"['족발＋보쌈', '족발 선택(직화족발', '보쌈 선택(보쌈)', '주먹밥 ']",어제 밤에 주문했었어요. 대 사이즈 콜라가 무색하게끔 엄청 큰 박스가 인상적이었습니다. 구성도 찍으려 했는데 너무배고파서 깜빡했어요 ㅜㅜ 정갈하게 잘 포장되어 와서 맛있게 잘 먹었습니다.!,['https://rev-static.yogiyo.co.kr/58714722f6809920fbe982fe0d7029f5_tn.jpg']
65,5,['꿀마늘보쌈도시락 '],생각보다 양이 엄청 많네요 다 못먹었어요ㅠ 꿀마늘이 진짜 맛있어요. 후식도 맛있음!!,['https://rev-static.yogiyo.co.kr/af5d4453a9154ab2e689df19165ef779_tn.jpg']
66,5,"['족발＋보쌈', '족발 선택(족발', '보쌈 선택(꿀마늘보쌈)']",최근 먹은 족발중 최고였습니다 사업 번창하세요,['https://rev-static.yogiyo.co.kr/77cf66444500a0711f888e283e478dfd_tn.jpg']
67,5,['보쌈 도시락 '],삼겹살도 맛있었는데 보쌈도 맛있어요~~~~!,['https://rev-static.yogiyo.co.kr/0ded0b49b7881bfa506c90f925286845_tn.jpg']
68,4,['족발 '],포장이  깔끔하네요. 주방장님께서 칼질을 잘하시는지 뼈에 붙은 살이 거의 없어서 앞니 불편할 일이 없어요 ㅋㅋㅋㅋ,['https://rev-static.yogiyo.co.kr/31bac79501117697f3eadab3efeb779c_tn.jpg']
69,5,['보쌈 도시락 '],상추 깬잎좀 적은거 빼고 굿입니다,['https://rev-static.yogiyo.co.kr/648f0ed51cba241b903f81b57f4b73ff_tn.jpg']
70,5,"['족발＋보쌈', '족발 선택(간장족발', '보쌈 선택(바베큐보쌈)', '참이슬 후레쉬 ']",다른 브랜드 생각하고 소자를 주문했는데 양이 많습니다전체적으로 매꼼함이 배어있어 술안주를 제격입니다.보쌈이나 족발이나 조리가 잘된거 같습니다. 부드럽게 씹히는 식감이 좋습니다.,['https://rev-static.yogiyo.co.kr/4a08f584ad55598d21269d05ac149abc_tn.jpg']
71,5,['꿀마늘보쌈 '],"배달도 빠르고, 양도 많고~항상 만족하며 먹습니다!","['https://rev-static.yogiyo.co.kr/3de8b4a1a345ae27d8de838c508bdd1e_tn.jpg', 'https://rev-static.yogiyo.co.kr/4b6943630d312b2f9289e0ad9359c01a_tn.jpg']"
72,5,"['족발＋보쌈', '족발 선택(불족발', '보쌈 선택(보쌈)']",에에에에에에에에에에에에에에에에에에에에에에에에에에에에에에에에에에에에에에에에에에에에에애에에에애에에에애에에에에에애애애애에ㅔ에에에에에에에에에엥ㅇㅇ에에에에에에에에에에에에에에에ㅔ에엥에에에에에에에에에에에에에에에에에에에에에에에에에에에에에에에에에에에에에에에에에에에에에애에에에애에에에애에에에에에애애애애에ㅔ에에에에에에에에에엥ㅇㅇ에에에에에에에에에에에에에에에ㅔ에엥,['https://rev-static.yogiyo.co.kr/baefe407c24a84c81df622f8a9c77c66_tn.jpg']
73,5,['꿀마늘보쌈도시락 '],첨먹어봤는데 맛있어요!!!양도많고도시락으로 시켰는데 둘이먹으면 아마 부족할것같아요전혼자먹었는데 배 터질뻔했음 채소도 신선하고 보쌈도 너무맛있었어요!!,['https://rev-static.yogiyo.co.kr/1e8c87fd8be08ddc93c2a73c3249e553_tn.jpg']
74,3,"['족발＋보쌈', '족발 선택(족발', '보쌈 선택(꿀마늘보쌈)']",상자도 이쁘고 배송도 빠르고 깔끔하네요마늘보쌈에 마늘의양이..,"['https://rev-static.yogiyo.co.kr/676c42d363e29c43cbeb442b9a855c71_tn.jpg', 'https://rev-static.yogiyo.co.kr/8a151429fb0babba277e28adfc51ab46_tn.jpg', 'https://rev-static.yogiyo.co.kr/abfa10bf57f412d8332b8d22cac60f1d_tn.jpg']"
75,4,['꿀마늘보쌈도시락 '],사장님... 소스가 다 흘러서 왓어요... 배달 기사분이주실때 손을 조심히 주시던데 흐른거 알고 계셨던 눈치로 보였는데요.... 안에 내용물들 에도 전부다 묻엇네요..,['https://rev-static.yogiyo.co.kr/b69396eb08a77d58b3839dce6c8cd413_tn.jpg']
76,5,"['갈릭보쌈도시락 ', '모듬쌈야채 ', '5찬']",패키지 박스에 갬성문구는 별론데 보쌈은 맛있었어요!!!! 보쌈을 적은양씩 파는곳이 잘 없어서 시켜놓고 남아서 고민이었는데 딱이네요~ 서비스도 주시고 감사히 잘 먹었습니다~,[]
77,5,['꿀마늘보쌈도시락 '],항상맛나게 잘먹고잇습니다♡,"['https://rev-static.yogiyo.co.kr/24e2c44151a0e111af0d72d94c028d28_tn.jpg', 'https://rev-static.yogiyo.co.kr/59e61bb04114ecfa67771c4418362591_tn.jpg']"
78,5,['꿀마늘보쌈도시락 '],배사장님은 역시 ㅎㅎㅎㅎ 배달도 빠르고 맛도 아주 좋습니다!!!!  다른반찬 빼고 무말랭이 요청했는데  아주 너무 잘해주셧네요!!!!,['https://rev-static.yogiyo.co.kr/53a8704e7e381fa68086a5307f40a866_tn.jpg']
79,5,"['족발＋보쌈', '족발 선택(불족발', '보쌈 선택(갈릭보쌈)']",와우~~  완전 맛있네요^^  굿굿~~   소주가 쭉쭉 들가다눈~~,"['https://rev-static.yogiyo.co.kr/c5f5a2cca40dc68d2aeb10f1a5c8e6dd_tn.jpg', 'https://rev-static.yogiyo.co.kr/348bebe008749fa40b991fb37b048948_tn.jpg']"
