,별점,주문메뉴,리뷰,사진
0,5,"['1＋1 두판피자 大', '피자 맛 선택1(일반맛', '피자1 도우 선택(오리지널', '피자2 토핑 선택(슈프림', '피자 맛 선택2(일반맛', '피자2 도우 선택(오리지널)', '갈릭소스（1개）']",콤비와 슈퍼슈프림의 차이가 없는 느낌이 아쉬웠다 페페로니 유무차이?,"['https://rev-static.yogiyo.co.kr/713096420ed56bf049e7f0b6d50d26d5_tn.jpg', 'https://rev-static.yogiyo.co.kr/02731a7a6e72cbeb54fa352d4add27db_tn.jpg']"
1,5,"['세트1（봉수아피자大＋스파게티＋콜라1.25L）', '피자 맛 선택(일반맛', '피자 도우 선택(오리지널)']",울동네에도 드디어 피자먹을때가생김 다른곳은진짜 사람새끼가만드나 의심이 들었는데 ㅇㅈ ㅇㅇㅈ,[]
2,5,"['세트1（봉수아피자大＋스파게티＋콜라1.25L）', '피자 맛 선택(일반맛', '피자 도우 선택(오리지널)']",사장님이 배달오셨어요토핑도 신선하고 풍부해서좋았고디핑소스도 맛있고 스파게티도 좋아요잘먹었습니다,['https://rev-static.yogiyo.co.kr/405bf0521faf5a12e3cf5718d33e0937_tn.jpg']
3,5,"['나홀로SET（봉수아피자中＋스파게티＋콜라500mL） ', '피자 맛 선택(일반맛', '피자 도우 선택(오리지널)', '웨지감자']",너무 맛있어서 사진은 잊어버리고 못 찍었어요.ㅜㅜ  너무 너무 맛났어요!정말 최고에요,[]
4,5,"['포테이토피자 大', '도우 선택(오리지날)']",너무 맛있게 먹었네요 ..^^ 배달오신분도 친절하시고 앞으로 자주 먹으려구요~,['https://rev-static.yogiyo.co.kr/88cd57f6561cc4456c480e926ad054cb_tn.jpg']
5,5,"['고구마피자 中', '도우 선택(치즈크러스트)']",배달원 아저씨도 넘 친절하시고 피자도 맛있게 잘먹었습니당 💕 또 피자생각나면 시켜먹으려고용~,['https://rev-static.yogiyo.co.kr/8b97e1b805b6596569873ceee6d740f7_tn.jpg']
6,5,"['세트1（봉수아피자大＋스파게티＋콜라1.25L）', '피자 맛 선택(일반맛', '피자 도우 선택(오리지널)']",다른 어플에서는 이미 주문해서 먹어보고 칭찬이 일색한 리뷰도 많은데 요기요에서는 아직 가려져 있는 것 같다. 사장님이 친절하게 배달해주시고 어플이여도 쿠폰제공되며 콜라는 펩시 아닌 코카콜라에 토핑은 말할 필요도 없이 듬뿍 넣어주셔서 피자 한입 베어물면 입안 가득 머금을 수 있다. 스파게티 소스도 여유있게 주셔서 부족함 없이 먹을 수 있다. 저런 갈릭 소스 없는 곳도 많은데 여긴 있다(심지어 무료) 피자에 찍어먹으면 괜스레 기분이 좋아진다. 브랜드 있는 피자도 나쁘진 않지만 여기 먹어보면 피자는 봉수아피자가 먼저 생각날지도 모른다.,"['https://rev-static.yogiyo.co.kr/68010d3e38f67c8d6eb1ef63b9a53422_tn.jpg', 'https://rev-static.yogiyo.co.kr/049843220f560598956f70bbe9953767_tn.jpg', 'https://rev-static.yogiyo.co.kr/4e58b561fc7927f5ed03247251ba2cc1_tn.jpg']"
7,5,"['세트1（봉수아피자大＋스파게티＋콜라1.25L）', '피자 맛 선택(일반맛', '피자 도우 선택(오리지널)', '피클（1개） ']",매번맛있게 먹습니다 요기요엔 리뷰가 별로없네요 배달사장님이 오시는데 친절하시고토핑도풍부하고 맛도좋습니다,['https://rev-static.yogiyo.co.kr/e2ee6ed562cdefd051fec38d29301eb0_tn.jpg']
8,5,"['세트1（봉수아피자大＋스파게티＋콜라1.25L）', '피자 맛 선택(일반맛', '피자 도우 선택(치즈크러스트)']",동네에 생긴지는 꽤 됐는데 항상 리뷰가 좋아서 궁금했어요 쿠폰 생긴 김에 처음 시켜봤는데 피자랑 스파게티랑 서비스로 주신 치즈스틱까지 다 너무 맛있었어요 💗 앞으로 자주 시킬게용 !!,"['https://rev-static.yogiyo.co.kr/bdf106b32be2cde77ad89a533d960338_tn.jpg', 'https://rev-static.yogiyo.co.kr/8531542bef667f85f10ff068e5ee0784_tn.jpg']"
9,5,"['세트1（봉수아피자大＋스파게티＋콜라1.25L）', '피자 맛 선택(일반맛', '피자 도우 선택(체다치즈크러스트)']",맛이 깔끔하고 맛있습니다,[]
10,5,"['치즈크러스트 大', '맛 선택(일반맛)']",goooooooood^^,[]
11,5,"['세트1（봉수아피자大＋스파게티＋콜라1.25L）', '피자 맛 선택(일반맛', '피자 도우 선택(치즈크러스트)']",이렇게 괜찮은 피자집은 주위 동네에서 처음인거 같아요 객관적으로 제일 괜찮았어요 리뷰이벤트 깜빡하고 안적어서 전화드렸더니 챙겨주셨어요 양이 진짜 어마어마 합니다 라지 짱크네요 맛도 빵이 부드럽고 엄청 맛있어요 피자로 유명한 곳 거기보다 훨 낫네요 피자는 이제 여기서만 시켜먹어야겠어요 배달도 1시간 걸린다고 떴는데 30분도 안걸린듯 하네요 감사합니다,"['https://rev-static.yogiyo.co.kr/7e98ad0bab7c355afbd1cdbcfb10e542_tn.jpg', 'https://rev-static.yogiyo.co.kr/96e958a1cdf7fbfee71f6587414026c6_tn.jpg']"
12,5,"['쉬림프피자 大', '도우 선택(오리지날)', '갈릭소스（1개）', '요거트 소스（1개）']",너무 친절하시고 양은 그냥... 대박 미쳤고 맛이 너무너무 짱이에요 ㅠ 앞으로 피자는 여기서만 시켜먹을라구여,['https://rev-static.yogiyo.co.kr/e5ad995c694de4d7fab7fe49f35d92ac_tn.jpg']
13,5,"['세트1（봉수아피자大＋스파게티＋콜라1.25L）', '피자 맛 선택(매운맛', '피자 도우 선택(오리지널)']",맛있고 친절하십니다 피자가 매운것도 많이 안매워서 좋음,"['https://rev-static.yogiyo.co.kr/18629b8e72cd2c8221b90f317011e9fe_tn.jpg', 'https://rev-static.yogiyo.co.kr/469fef4fea0439e932fe922743c8aa33_tn.jpg']"
14,5,"['세트1（봉수아피자大＋스파게티＋콜라1.25L）', '피자 맛 선택(일반맛', '피자 도우 선택(오리지널)']",엄청엄청엄~~~~~~청 맛있어요~~~^^치즈도 듬뿍~~~~~~다음날 데워먹어도 굿~~~!!!!!,['https://rev-static.yogiyo.co.kr/feea560a9fb9b496461cdd21856c02d6_tn.jpg']
15,5,"['나홀로SET（봉수아피자中＋스파게티＋콜라500mL） ', '피자 맛 선택(일반맛', '피자 도우 선택(오리지널)']",맛있게 잘 먹었습니다.,[]
16,5,"['세트1（봉수아피자大＋스파게티＋콜라1.25L）', '피자 맛 선택(일반맛', '피자 도우 선택(오리지널)']",포장 잘되어서 오네요 깔끔하니 정말 맛있습니다! 배달도 빠르게 왔어요! 서비스로 주신 치즈스틱도 잘먹었습니다 피자는 요즘 여기가 제일 맛있어서 여기서만 시켜먹네요,"['https://rev-static.yogiyo.co.kr/e99400770bc576427ab357298db9b88a_tn.jpg', 'https://rev-static.yogiyo.co.kr/04295e06314e961c7e44943c7b3d38a7_tn.jpg', 'https://rev-static.yogiyo.co.kr/b0ffc2d848544ab2b5bc3daa2def6ef8_tn.jpg']"
17,5,"['세트1（봉수아피자大＋스파게티＋콜라1.25L）', '피자 맛 선택(일반맛', '피자 도우 선택(오리지널)']",시킬때마다 사장님이 배달오시는데 친절하셔서 기분이좋고 포장도깔끔하고 피자 토핑도 풍부하고 신선한 느낌이 들어 맛이좋습니다스파게티랑 리뷰이벤트 서비스음식도 맛있습니다잘먹었습니다 번창하세요,"['https://rev-static.yogiyo.co.kr/f14ea6bd877794a7e8c70caa4ad1debf_tn.jpg', 'https://rev-static.yogiyo.co.kr/3e7b9cc14b24b1d7f8c53e208a17f859_tn.jpg']"
18,5,"['세트1（봉수아피자大＋스파게티＋콜라1.25L）', '피자 맛 선택(일반맛', '피자 도우 선택(오리지널)']",맛있어여~~~~~~~~ 굳,[]
19,5,"['체다치즈크러스트 中', '맛 선택(일반맛)']",아이랑 맛있게 먹었어요토핑도 푸짐하고 맛도 좋아요,['https://rev-static.yogiyo.co.kr/11600654549c01e415a910bd5143fb14_tn.jpg']
20,4,"['세트1（봉수아피자大＋스파게티＋콜라1.25L）', '피자 맛 선택(매운맛', '피자 도우 선택(치즈크러스트)']",사진이 없어져수 ㅠㅠㅠ 중간에 찍았어요. 저는 도우를 매운 막으로 했는데 칠리새우랑 베이컨이 매워서 일반 맛으로 할 껄이라는 아쉬움 들어요. 하프앤 하프하고 싶어서 한 3~4먼 연랏드렸는데 친절하게 설명해주셔서 정말 기분 좋게 먹었어요! 다에는 포테이토에 불고기를🥰도전해보겜ㅅ어요! 리뷰이벤트로 콜라도 받았지로용,['https://rev-static.yogiyo.co.kr/9a0ca94bedd416e20761563d4e616656_tn.jpg']
21,5,"['페파로니피자 大', '도우 선택(오리지날)', '프리미엄 크림치즈피자 大', '맛 선택(일반맛)', '프리미엄 바이트피자 大', '맛 선택(일반맛)']",가격은 싼데 양도 엄청 많고 맛도 엄청 맛있어요!무엇보다 부부 두분에서 열심히 장사하시려는 모습이 보기좋네요! 일일이 피자 식지말라고 포장하는거랑 등등 세심한부분 신경쓰신거 같아요! 번창하시길 바랍니다!,[]
22,5,"['치킨바베큐피자 大', '도우 선택(치즈크러스트)', '콜라 1.25L']",양도 많고 맛있네요! 다음에도 시킬게요~,['https://rev-static.yogiyo.co.kr/834ea0e164f78b2e447087a30bdc091b_tn.jpg']
23,5,"['세트1（봉수아피자大＋스파게티＋콜라1.25L）', '피자 맛 선택(일반맛', '피자 도우 선택(치즈크러스트)']",처음 시켰는데 정말 맛있게 잘먹었습니다배달하시는분도 친절하시고리뷰이벤트로 준 새우링.해쉬감자도 정말 맛있게 먹었습니다재주문의사 100%입니다~~,['https://rev-static.yogiyo.co.kr/236ad853886bd69bf17bcd0450c7c1e2_tn.jpg']
24,5,"['세트1（봉수아피자大＋스파게티＋콜라1.25L）', '피자 맛 선택(매운맛', '피자 도우 선택(오리지널)']",맛있게 잘먹었습니다.,['https://rev-static.yogiyo.co.kr/0bbc3e955613688abee75cbc81e18ee8_tn.jpg']
25,5,"['불고기피자 大', '도우 선택(오리지날)']",진짜 이 근방 피자집 중에 최고네요 가격도 괜찮고 양도 많고 맛도 좋아요!,[]
