,별점,주문메뉴,리뷰,사진
0,5,['우럭'],훌륭해요~~~!!!! 많이들 드셔보기요~~~,['https://rev-static.yogiyo.co.kr/4312b354f8a5caa974135406da22af9f_tn.jpg']
1,5,['모듬회'],너무맛있어요@!!!!!!!!!!!,[]
2,5,"['사이다355mL', '속초해물물회1人', '처음처럼']",물회가 의외로 양도 많고 배달도 빠르고 맛있었어요~~,['https://rev-static.yogiyo.co.kr/441fd1eb557a2683d673c0e8062ef4a4_tn.jpg']
3,5,"['도다리세꼬시', '속초해물물회1人']",월급날 시켰는데 맛있게 잘 먹었어요찾아보니 저희 집과 거리가 먼 곳인데도배달해 주신 거였네요덕분에 맛있게 먹었습니다앞으로도 번창하세요,[]
4,5,"['활어물회1人', '사이즈 선택(2人)']",너무 맛있어요 배달도 빠르궁 국물 누락되었다고 바로 연락주시고 또 바로 가져다 주셨어요 여러분 다들 두번 드세요!!,['https://rev-static.yogiyo.co.kr/ee3e3f3e2475d7b0aa1c475d37e01869_tn.jpg']
5,5,"['광어', '멍게', '속초해물물회1人']",회도 너무 두툼해서 식감이 좋고!밑반찬들도 맛있어서 재주문했어요!!푸짐해용~서비스 감사합니당,['https://rev-static.yogiyo.co.kr/5ba7072c976f4baa4ec83b4a6646f780_tn.jpg']
6,1,['속초해물물회1人'],가성비.............맛은... 물회치고 저는 좀..... 같이 먹은 사람들모두...싱겁다네요..싱거워요 양땜에 2인분했는데.. 그냥그래요,[]
7,5,"['광어', '회덮밥']",또 주문했어용ㅋㅋ회가 너무 두툼하고 식감이 좋아서 자꾸 시켜먹게되네용 원래 회를 좋아하지만ㅋㅋ서비스 항상 감사합니다!!,['https://rev-static.yogiyo.co.kr/65c2618173d174a4799e7d64cfcbfcc7_tn.jpg']
8,5,"['광어', '초밥용초대리공기밥', '카스']","두툼하면서 신선하고  쌈장,채소도 모두 굿굿입니다.양도 많아서 사이즈 작은건 3명이서 먹어도 될 양입니다.사이드 메뉴도 풍부하고 초밥 만들어  먹는 밥과 식초도 아주 맛있어요~자주  주문할듯 해요~",[]
9,5,['광어'],회가 두툼하고 신선했고.곁반찬들도 풍성하고 맛났습니다~,[]
10,5,"['회덮밥', '활쭈꾸미숙회']",가격대비 좋은거 같습니다,['https://rev-static.yogiyo.co.kr/106a76bdfa1d1786c32e30042e1c044f_tn.jpg']
11,5,['속초스페샬'],두번째 주문이었습니다. 덕분에 손님 대접 잘 했습니다. 무엇보다 회 종류 포스트잇에 써주시는 사장님의 센스가 진짜 좋았습니다. 푸짐한 양에 낙지가 빠진것도 몰랐는데..낙지 배달이 다시 오는바람에 알았네요..믿음이 갑니다.앞으로도자주 이용할 듯 합니다,"['https://rev-static.yogiyo.co.kr/e7ebec60a812f656e54b23d901f5e34b_tn.jpg', 'https://rev-static.yogiyo.co.kr/1dc21a1948503791182ff28e685868fd_tn.jpg']"
12,5,"['모듬회', '추가 선택(옥수수콘치즈구이 추', '고구마튀김 추가)', '속초해물물회1人']",ㅎㅎ오랜만에 맛있는 회 먹었어요,[]
13,5,"['홍어회', '회덮밥']",맛 좋아요. 좋아요,[]
14,5,['우럭'],배민으로시키다가요기요로주문해봣어요~~우럭먹어보고너무맛잇어서시켯는데없다고하셔서농어로주셨어요 항상너무만족한집이라 믿고 알겠다고 한건데 역시나너무만족했습니다조만간또뵈요~~~😊😊😊😊,"['https://rev-static.yogiyo.co.kr/ac61d9bc86e119b88fb6127c0f500552_tn.jpg', 'https://rev-static.yogiyo.co.kr/a0da9e14ecbcf883d70970e80338b985_tn.jpg']"
15,5,"['광어', '봄철 보리숭어 中']",역시 회가 두툼 도톰 맛있어용👍양도 많아서 먹다 지쳐요 ㅋㅋ,['https://rev-static.yogiyo.co.kr/bff186487be4dc7cc6fa5af4c0d88473_tn.jpg']
16,5,"['산낙지', '고구마튀김 추가)', '속초해물물회1人', '고구마튀김 추가)']",속초 청초수물회 너무 좋아하는데 비슷한 물회집을 찾았네요~^^,[]
17,5,['모듬회'],모듬 소 시켰는데 맛있어요양도 많고 스키다시도 다양해서 자주 시킬구같아요!,['https://rev-static.yogiyo.co.kr/b0128d6ab87a083888cb8a36ab411716_tn.jpg']
18,5,['광어'],역시 오늘도 두툼 식감 대박이에요👍항상 잘 먹고있습니당 감사해요!!,['https://rev-static.yogiyo.co.kr/f4d6f2187dc0b36b707e50e103729564_tn.jpg']
19,5,"['모듬회', '추가 선택(매운탕 재료만 제공（야채＋양념＋육수）)']",회가 싱싱하고 사이드음식(무료)도 맛있어요^^,[]
20,5,"['도다리세꼬시', '활어물회1人']",진짜 깔끔하고 맛있네요사이드반찬도 쓸데없는거 안오고 맛있고 깔끔해요,['https://rev-static.yogiyo.co.kr/a93cbf34aedacfef88e628e411eb404f_tn.jpg']
21,5,['광어'],엄청납니다!!! 또 먹고싶어요!,['https://rev-static.yogiyo.co.kr/3ef8111138f6c3628411720b47212737_tn.jpg']
22,5,['광어'],항상 맛있게 잘 먹고있습니다!!!서비스는 항상 감사한 맘으로 먹고있어요 ㅎㅎ,[]
23,5,['모듬회'],"진작 남겼어야했는데 까먹고 이제남겨요! 친절히 포스트잇으로 횟감종류도 알려주시궁, 스끼다시도 푸짐허구, 회도싱싱하구, 직접 가게에서 먹어보기로 신랑과 약속했어요ㅎㅎ 잘먹었습니다~",['https://rev-static.yogiyo.co.kr/47dcba4aa47e8a941768742a5225b5cb_tn.jpg']
24,5,"['속초해물물회1人', '속초스페샬']",이제서야 리뷰남겨요.사장님 최고! 싱싱하고 푸짐함에 반했어요. 전복죽   정말 맛있음!사진 더있지만 세장이 한계라..친절한 사장님덕에 정말 맛잇게먹었어요.^^♡단골등록이요.,"['https://rev-static.yogiyo.co.kr/49399b2c0aea44b72722ec7ac1c537c1_tn.jpg', 'https://rev-static.yogiyo.co.kr/739ec24e010efe7cf15b5531df252074_tn.jpg', 'https://rev-static.yogiyo.co.kr/dd3a5f9035c51b89dc6db5efad6c1830_tn.jpg']"
25,5,"['멍게', '사이다355mL', '속초해물물회1人']",처음시켜봤는데... 맛있어요... 물회양념이나 음료수를 은박팩에넣어줘서 시원하게 받았습니다.,"['https://rev-static.yogiyo.co.kr/8b21834375c4924275c8b6d4cb27ab03_tn.jpg', 'https://rev-static.yogiyo.co.kr/b801d644cbf73e69f75abe87a347c589_tn.jpg']"
26,5,['속초해물물회1人'],세꼬시 빼달라고 요청에 썼는데 미처 못 봤다고 죄송하다고 회 추가로 더 드리겠다고 전화와서 깜짝 놀랐습니다 넘 친절ㅠ 덕분에 잘 먹었구요 일단 물회가 땡겨서 시키긴 했는데 저 혼자 먹는 거였는데 양이 많이 와서 당황했어요 그 엽떡 용기 정도로 예상했는데 거의 그 2배 깊이 되는 용기더라고요.. 솔직히 2명이서 충분히 먹고도 남을 양? 그리고 이렇게 양많으면 보통 야채빨인 경우가 큰데 회랑 해산물도 많아서 마지막까지 건더기가 계속 나오더라구요. 물회는 맵진 않은데 청양고추 쏭쏭 썰어져있어서 새콤칼칼한 맛입니다. 고구마튀김도 맛나용,"['https://rev-static.yogiyo.co.kr/da00bedaf443731255fd0fb96ccb3038_tn.jpg', 'https://rev-static.yogiyo.co.kr/31746d2096f353e957b01cee4aca27cc_tn.jpg']"
27,5,"['속초해물물회1人', '사이즈 선택(2人)']",물회 양많고 맛있어요 해산물이 다양해서 좋네요 잘먹었어요~,[]
28,5,"['우럭', '속초해물물회1人']",맛도 좋고 양도 많고... 넘넘 좋아요~~,[]
29,5,"['광어', '속초해물물회1人']",왠만하면 그냥맛있다고만글쓰는데요 여기는 진짜완벽하네요 물회도너무맛있고 회도싱싱하고 스끼다시로 주신거도 전부맛있게잘먹었습니다ㅎㅎ,[]
30,5,"['광어', '속초해물물회1人']",리뷰 올린 줄 알았는데 안 올려서 이제야 올려요 죄송해요! 밑반찬 종류 많고 맛도 다 좋았어요ㅎㅎ 회도 양이 많아서 둘이서 다 먹지 못했어요😅 잘 먹었습니당,['https://rev-static.yogiyo.co.kr/5643d7a841821472854014507a6654ea_tn.jpg']
31,4,"['모듬회', '추가 선택(고구마튀김 추가)', '활어물회1人']",잘 먹었습니다~^^,[]
32,5,['광어'],여러분 여기는 스끼다시를 많이주셔서 묻혀보이지만 광어 크고 많아요ㅋㅋ두툼 쫄깃★서비스는 항상 감사해요>_<많이파세요!!!!!!!!!!!!,['https://rev-static.yogiyo.co.kr/df517f729188e475d221f6dff567a14a_tn.jpg']
33,5,"['문어숙회', '속초해물물회1人']",시원하고 새콤한게 너무 맛있네요지금바로  주문가즈아!,[]
34,5,"['광어', '속초해물물회1人']",진짜 양도 푸짐하고 물회도 시원하게 보내주셔서 잘먹었어요~,['https://rev-static.yogiyo.co.kr/e61cf3361b4801a820f029e2ad3d99b8_tn.jpg']
35,5,['봄철 모듬세트 小'],와....걍 미쳤어요시키세요그냥수원에서 여기만큼 주는데 없어요,['https://rev-static.yogiyo.co.kr/10dddcad6f453f737b4346a27227ffec_tn.jpg']
36,4,"['회덮밥', '속초해물물회1人', '보해복분자']",제가 좀 많이 먹는편이라 많이와바야 얼마나 많이올까 하는마음에 1인 두종류를 시켰는데 이건 왠걸 어마무시한 양의 배달이 ㅋㅋ 맛도 나쁘지 않아서 먹다보니 그많던게 올인 자주 시켜먹을거 같네여 ㅋ,[]
37,5,['광어'],양도 푸짐하고 맛있어요스끼다시도 맛있었어요,['https://rev-static.yogiyo.co.kr/5ee6aad5b1887ea24cb6ef4ecdd6b91f_tn.jpg']
38,5,['광어'],이제 다른 가게에선 회 못시켜먹겠어요 ㅋㅋ번창하세요!!,['https://rev-static.yogiyo.co.kr/07c6279cb92017b56ab3aa8c639f105d_tn.jpg']
39,3,"['광어', '속초해물물회1人']",리뷰가 좋아 기대가 컷나 봅니다. 제 입맛엔 그닥...스끼다시 다채롭게 오는건 새로웠습니다. 암튼 무난하게 잘 먹었습니다.,"['https://rev-static.yogiyo.co.kr/c451c213ffad495094241b2c37e85b61_tn.jpg', 'https://rev-static.yogiyo.co.kr/16e563ccacfc10c5b365a2579d9fe032_tn.jpg', 'https://rev-static.yogiyo.co.kr/29b3c5994fe7e399b08d81b386278742_tn.jpg']"
40,5,"['광어', '속초해물물회1人']",배달로 회시키면 스키다시 주는곳 없는데 여기는 더 챙겨주려고 하시는게 보이네요ㅎㅎ 회도 와..되게 큼직하그 두툼한게.. 넘맛나고요😆 자주 이용해야겠어요!!😃,['https://rev-static.yogiyo.co.kr/0be48a7cb34312b307a1a7eee4a7c65e_tn.jpg']
41,4,"['모듬회', '추가 선택(매운탕 재료만 제공（야채＋양념＋육수）)']",맛있게  잘먹었습니다,[]
42,5,['광어'],그냥 먹어야됨 볶음밥도있음,['https://rev-static.yogiyo.co.kr/0971e39c61da4ae1deb81112e57799bb_tn.jpg']
43,5,"['모듬회', '속초해물물회1人']",가족이 회를 좋아해서 자주시켜먹었는데 속초대포횟집은 처음 시켜봤어요. 평이 왜 좋은지 알것같아요.^^오늘도 부모님 오셔서 맛난 회 또 주문할께요^^,"['https://rev-static.yogiyo.co.kr/b3bed431f6e4c4e7845b182f3a0a9088_tn.jpg', 'https://rev-static.yogiyo.co.kr/3c798cbe0ff392639d7ae3cb2dfd6422_tn.jpg', 'https://rev-static.yogiyo.co.kr/6b3834278ee6ae728f234002df482714_tn.jpg']"
44,5,"['광어', '속초해물물회1人']",구성 장난없습니다 맛있어요 ㅎㅎ,['https://rev-static.yogiyo.co.kr/abf3fdbaf5e444c9e8a699fc7e226faf_tn.jpg']
45,5,"['모듬회', '초밥용초대리공기밥']",근처에서 젤 나은 횟집주변반찬도잘주시고 회 양도 괜찮은편다만 소짜리는 둘이먹기부족해서 중짜리로 추천,[]
46,5,"['활어물회1人', '속초해물물회1人']",맛있게 잘 먹었습니다~,[]
47,5,['광어＋우럭 小'],왜 별점이 높은 지 알겠어요!! 스끼도 너무 잘 나오고 회도 부위별로 많이 어고 서비스 연어까지!ㅎㅎ 배달도 30분만에 와서 너무 좋았습니다ㅎㅎ 담에 또 시킬게요~~,['https://rev-static.yogiyo.co.kr/c303a4d1649727e7f305f3f999b45599_tn.jpg']
48,5,"['광어＋우럭 小', '속초해물물회1人']",맛있어요막장도 엄청 맛있네요물회도 괜찮고 재주문 1000%입니당~~,['https://rev-static.yogiyo.co.kr/1c14dae508ccfbee94d9d53291a27987_tn.jpg']
49,5,['광어'],어른여자1명 중3아들 초딩 딸 잘 먹었어요 광어회 두툼하게 썰어주셔서 하나만 먹어도 꽉찬느낌고구마튀김도 바로 튀겨서 주시고 콘치즈도 바로 해서 주시나봐요^^,['https://rev-static.yogiyo.co.kr/6d5fb4b3b1cba287065fac3f8305d9a6_tn.jpg']
50,4,"['모듬회', '속초해물물회1人']",너무맛잇고 구성이너믄조아용ㅎ,[]
51,5,"['모듬회', '추가 선택(매운탕 재료만 제공（야채＋양념＋육수）)', '초밥용초대리공기밥']",원래 회 자주 안먹는데 자주먹게되었잖아용....남편이 회 너무 좋아해요모듬회 중짜리로 항상 둘이먹어요 ㅎㅎ모자른것보다 남는게낫다 생각하는데울 돼지남편은 항상 다먹어요보내주시는 밥부터 국 매운탕에밥까지소짜리시키면 전 하나도 안줄기세에요..항상 잘먹습니다^^,[]
52,4,"['속초해물물회1人', '사이즈 선택(2人)']",양도 좋고 맛있게 먹었어요청량고추는 조금 적게 넣어주심 좋겠어요~^^,[]
53,5,"['왕새우소금구이（북엇', '콘치', '소면무', '고구마튀김 제공）', '전어회（밑반찬 포함）']",정말 정말 정말로 맛있어요 ^^,[]
54,5,"['전어회（밑반찬 포함）', '속초해물물회1人']",스끼다시오늘도엄청많이주셔서 맛있게먹다가 리뷰남겨요ㅎㅎ감사합니다,[]
55,5,"['광어', '추가 선택(매운탕 재료만 제공（야채＋양념＋육수）)']",맛있고 양도 짱이예요,['https://rev-static.yogiyo.co.kr/86549642c1a7c4f5917b5c546212c710_tn.jpg']
56,5,['광어＋우럭'],처음 시켜봤는데 너무 만족스럽네요 ^^,[]
57,5,"['B모듬세트（광어＋우럭＋생연어＋참돔 or 농어）', '속초해물물회1人']",배달도 빠르고 물회 넘 맛있네요 회도 두툼하고. 잘 먹었습니다,[]
58,5,"['전어회（밑반찬 포함）', '콜라355mL']",푸짐하고 맛있게 잘먹었습니다~^^,"['https://rev-static.yogiyo.co.kr/3c3213476a53ae6f11b601da98c8ff33_tn.jpg', 'https://rev-static.yogiyo.co.kr/d2cd4390302ec89bf034cdc0aa2c576d_tn.jpg']"
59,5,"['전어회（밑반찬 포함）', '전어구이（4마리）']",가을엔 역시 전어죠..ㅜㅠ 너모 마싯어.. 양도 푸짐하고 역시 만족!,['https://rev-static.yogiyo.co.kr/8d15e51f392b7b9bb718892e1ad37e0a_tn.jpg']
60,5,['광어'],생각보다 양도 너무 푸짐하고 빠르게 받았습니다 스끼다시로 주신 콘치즈와 고구마튀김은 저희애가 너무 잘 먹었어요 다음에 또 주문할게요,[]
61,5,['B모듬세트（광어＋우럭＋생연어＋참돔 or 농어）'],양이 좀 적은가 했는데회가 두툼하고 아주 싱싱쫄깃해서 좋았고특히 쌈장 초장 넉넉하게 주셔서 진짜 좋았네요.종종 시켜먹을게요~~,[]
62,5,"['광어＋연어', '활어물회1人']",배부르게 잘먹었습니다!!,['https://rev-static.yogiyo.co.kr/876d77fcf8f4cc4ad21eecfdb0e4cd0b_tn.jpg']
63,5,['B모듬세트（광어＋우럭＋생연어＋참돔 or 농어）'],다른 회배달로 몇번 돈날리고 다신 안시켜먹겠다 하다가 혹시나하고 시켜봤는데 너무 맛있게 잘먹었네요 회도 두툼하고 양도 좋았어요 신랑은 회 무조건 횟집가서 먹자는 사람인데 여기는 또 시켜먹자고 가게이름 알아두라고 하네요 ㅎㅎ 다음에는 제철회나 다른걸로 먹어보려구요 굳굳,[]
64,5,['광어'],맛있었어요 회도 맛나고 그 주먹밥이랑 콘치즈도 너무 맛있어요 ㅠㅠㅠㅠㅠ,['https://rev-static.yogiyo.co.kr/923ec63fbd177194b223763bb21117a6_tn.jpg']
65,5,['도다리세꼬시'],넘넘 맛있게 잘먹었습니다~^^,[]
66,5,['광어'],시킨날이 휴일 전날이라 80분 꽉채워서 배달 오셨어요광어 엄청 두툼해서 좋아요~와사비도 강해서 좋았어요 ㅎㅎ챙겨주신것들 다 맛있게 먹었는데  한치(?)무침인지 모르겠는데 그게 너무 질겨서 못먹었어요,[]
67,5,['A모듬세트（광어＋우럭＋도다리세꼬시＋참돔 or 농어）'],추천 추천 완전 추천이요,[]
68,5,['C모듬세트（대방어＋광어＋우럭＋도다리세꼬시）'],회들이 포동포동해요 식감도 좋고 배달도 빨라서 맛있게 잘 먹었네요 ~,['https://rev-static.yogiyo.co.kr/83fcbeabb9e4147e742225b6255b184c_tn.jpg']
69,4,"['왕새우소금구이（북엇', '콘치', '소면무', '고구마튀김 제공）']","새우는 맛있어요. 근데 소면무침이 아니라 밥이 왔네요?  이건 별로 안좋아하는데.. 콘치즈의 치즈는 탄맛이 나고, 간장 하나 넣어 주셨음 좋았을걸 하는 생각이 들었어요.","['https://rev-static.yogiyo.co.kr/76f87370e392395fa5b84de6df9a9409_tn.jpg', 'https://rev-static.yogiyo.co.kr/6ac9f503eb425ba1cb3c7dc89507e986_tn.jpg', 'https://rev-static.yogiyo.co.kr/00f92d8cef06b6320e565d94039e491a_tn.jpg']"
70,5,['대방어＋광어'],정말 맛있는 회를 먹었어요!!진짜 너무맛있었고 단골이 되고싶내요 ㅠㅠ,['https://rev-static.yogiyo.co.kr/06a098a76803eab15945816fbe3e14e9_tn.jpg']
71,5,"['광어', '추가 선택(매운탕 재료만 제공（야채＋양념＋육수）)', '참이슬후레쉬']",처음 시켰는데 테이블이 모자르네요ㄷㄷㄷ사장님 너무 맛있게 먹고있습니다~~,['https://rev-static.yogiyo.co.kr/70690da8e069d3242680c5695f8c5a0b_tn.jpg']
72,5,"['왕새우소금구이（북엇', '콘치', '소면무', '고구마튀김 제공）']",배달60분 걸린다햇는데 엄청금방오구역시새우 맛잇음 근데 새우 사이즈가너무작은거같아요ㅠㅠ,['https://rev-static.yogiyo.co.kr/98cec1248892a396d214c7f9ca5be575_tn.jpg']
73,1,"['C모듬세트（대방어＋광어＋우럭＋도다리세꼬시）', '홍어회', '노르웨이 생연어']",배가너무아프네요ㅠㅠ설사도계속하고,[]
74,5,['B모듬세트（광어＋우럭＋생연어＋참돔 or 농어）'],어른둘이서도 회 조금 남을정도예요~~~소자인데 배부르게 맛나게 먹었어요!추천~~ 인정♡,[]
75,5,"['대방어회', '추가 선택(매운탕 재료만 제공（야채＋양념＋육수）)']",아..방어 너무맛있어요..ㅜㅠ 역시 제철 생선은 먹어줘야죠ㅋㅋ여기 물회 맛나고 좋았는데 이젠 안하시나보네요..ㅜㅠ 아쉬워요..그리구 세트메뉴도 매운탕 추가할수있으면 좋겠어요! 세트는 안되서 단품으로 시키고 추가했어요,['https://rev-static.yogiyo.co.kr/65dd5a55cd2c5fa112f0dd5524b2c0f2_tn.jpg']
76,5,['대방어＋광어'],너무너무 맛있습니다,[]
77,5,['A모듬세트（광어＋우럭＋도다리세꼬시＋참돔 or 농어）'],회는 항상 여기서 시켜먹어요! 진짜 맛있어요~~,[]
78,5,['대방어회'],넘 맛있게 잘 먹었습니다 ~~~,[]
79,5,['B모듬세트（광어＋우럭＋생연어＋참돔 or 농어）'],너무 맛잇어서 다먹고 찍엇네요,['https://rev-static.yogiyo.co.kr/2ea093c91676ed4d1cfb6d13c2a15cdd_tn.jpg']
80,5,['D모듬세트（대방어＋광어＋우럭＋생연어회）'],잘먹었습니다~~ 맛있어요,['https://rev-static.yogiyo.co.kr/78fbfef2a5538b934a34302fbe17b9d3_tn.jpg']
81,5,['대방어＋광어'],리뷰를 안남길수없네요 ~ 남편이 이제 회는 여기서 무조건 시키자고하네오 둘다 회 엄청 좋아하는데 맛집 찾아서 너무 기쁘네요 감사합니다 잘먹을께요^^,[]
82,5,['광어＋연어'],"정말 잘 먹었습니다.회 양, 같이 온 밑반찬들까지 정말 맛나게 잘 먹었습니다.다음에 또 회 배달 시킬땐 이곳으로 하려고합니다.그때도 이런 음식 퀄리티 기대할께요~",['https://rev-static.yogiyo.co.kr/4f39c6be9df94abb10c49ec82f836037_tn.jpg']
