,별점,주문메뉴,리뷰,사진
0,5,['엄니 닭볶음탕 '],배달두 빠르고 맛있어영 ㅎㅎ 근데 공기밥이 안왔어요ㅜㅜ 11-4시에 주문하면 밥 온다했는딩,[]
1,5,['엄니 순살닭볶음탕'],먹느라 정신없어서 지금올리네요 ㅋ..계란찜하고 양도풍부하고 매콤하니 맛있읍니다자주시켜먹겠읍니다..,['https://rev-static.yogiyo.co.kr/cc016b7f1f1576eb98a22b26fc65e099_tn.jpg']
2,4,"['엄니 얼큰닭볶음탕', '고구마', '아궁이 누릉지탕']",닭볶음탕 맛있게 잘먹었습니다배달이 늦게와서 누룽지가 다 불어서 오고수제비 사리도 불어있어서 그게 좀 아쉽네요ㅠㅠ그래도 덤으로 주신것까지 잘 먹었습니당ㅎㅎ배달만 신경써주세요~,[]
3,5,"['엄니 묵은지닭볶음탕', '선비밥（일반공기밥）']",맛있읍니다 맛있읍니다 맛있읍니다,[]
4,5,"['엄니 순살닭볶음탕', '사리 선택(밀떡 추가', '사이드 선택(선비밥（일반공기밥） 추가)']",맛나요.밑반찬이 없는게 좀아쉽네요,['https://rev-static.yogiyo.co.kr/8709fa3d90f664076da2c1d1880ab29e_tn.jpg']
5,4,"['엄니 얼큰닭볶음탕', '양반밥（흑미밥＋김）', '부들부들 계란찜', '김말이']",닭볶음탕 굳굳굳 입니당~,[]
6,4,['엄니 얼큰닭볶음탕'],얼큰시켰는데 적당히 맵고 맛있네요,[]
7,5,"['엄니 닭볶음탕 ', '당면']",패키지가 귀엽네여ㅎㅎ무엇보다 맛잇고 양도 많아서 배부르게 잘머것어요!!담에도 또 시킬게여,['https://rev-static.yogiyo.co.kr/8fe359184e45770cbfa5874f6750b854_tn.jpg']
8,4,['엄니 닭볶음탕 '],맛 괜찮아요양 작지않고적당히 매콤하고잡내 없어요,[]
9,5,"['엄니 순살간장찜닭', '당면']",양도많고 엄청 맛잇어요!둘이서 먹는데두 남앗네여ㅎㅎ담에는 닭볶음탕시켜먹어봐야겟네여,['https://rev-static.yogiyo.co.kr/f8cb1ed98adfb03c4407f421546914c8_tn.jpg']
10,4,['엄니 순살닭볶음탕'],맛있었어요! 양도 괜찮아요! 다음에도 시켜먹을거같아요!!,['https://rev-static.yogiyo.co.kr/2e7270fc51dbf6f9d0f698d57f650435_tn.jpg']
11,5,"['엄니 얼큰순살닭볶음탕', '선비밥（일반공기밥）', '콜라 1.25L']",배달도 빠르고 맛도 있고 뜨끈뜨끈하고 양도 많고최고입니다 ㅠㅠㅠ매콤한거 먹고싶어서 매운걸 시켰는데 생각보다많이 맵지는않네요 ㅠ 아쉽지만아쉬움보다 더 맛있으니깐 만족 입니다 ㅠㅠ 번창하세요❤️❤️,['https://rev-static.yogiyo.co.kr/10ecf06a955daef29ae57aa15740d671_tn.jpg']
12,5,"['엄니 닭볶음탕 ', '선비밥（일반공기밥）', '카스']",닭 볶음탕 엄청 맛있어요. 단골 되겠습니다.,[]
13,5,"['엄니 순살닭볶음탕', '사리 선택(당면 추가)']",양도많고 엄청 맛잇오요!잘머것습니당,"['https://rev-static.yogiyo.co.kr/a26bd7ca524a08f50d6f3d538b58639b_tn.jpg', 'https://rev-static.yogiyo.co.kr/c706adb8353c63c5b76e313618883352_tn.jpg']"
14,5,"['엄니 닭볶음탕 ', '선비밥（일반공기밥）']","배달도 빠르고 맛도 좋고 양도 많아요 메추리알이 들어있는건,, 완전 b 자주 시켜 먹을 듯 합니다 아 그리고 뼈봉투까지 있어서 치울때도 좋아요","['https://rev-static.yogiyo.co.kr/f7338bf1c54312329c8cc6a4f052cc16_tn.jpg', 'https://rev-static.yogiyo.co.kr/e5ad1c942b300683d228b5e1935201d5_tn.jpg']"
15,5,['엄니 순살닭볶음탕'],닭살이 연하고 부드러워서 맛이있었습니다,[]
16,5,"['엄니 닭볶음탕 ', '사리 선택(당면 추가)']",닭이 진짜 맛있어요! 매운걸 워낙 못먹어서 안맵게 요청드렸은데도 쪼꼼 맵긴했는데 너무 맛있었어요!다음에 또 시켜먹을에요 !,['https://rev-static.yogiyo.co.kr/09ddb61886e6d0ed1014ec505a36635e_tn.jpg']
17,5,"['엄니 닭볶음탕 ', '사이드 선택(선비밥（일반공기밥） 추가)']",맛잇어요 서비스도좋고 맛별로일줄알았는데 진짜생각보다 훨씬맛잇으여요ㅠ,[]
18,5,['엄니 닭볶음탕 '],두번째시켯는데 안맵게해달라고하니 간도잘해주시고 맛잇습니다’! 친절해서좋아요,[]
19,5,"['엄니 얼큰순살닭볶음탕', '사리 선택(당면 추가)']",맛있어요 반마리인데도 양이 엄청 많아요,['https://rev-static.yogiyo.co.kr/0a206c1f546c0fdce52933e9c6b981b2_tn.jpg']
20,3,['엄니 닭볶음탕 '],잘먹엇습니다 맵게해달라고햇는데..사실 끝맛이 텁텁하고 짯어요ㅠ 감자는 추가를 할걸...으..,['https://rev-static.yogiyo.co.kr/f3eb802eab92f408d8723bd52040fa1e_tn.jpg']
21,5,"['엄니 순살닭볶음탕', '사리 선택(당면 추가)']",맵게 해달라고 했는데 정말 맛있게 잘 먹었어요!!! 감자도 포슬포슬하니 넘 맛있구요ㅎ.ㅎ 저번에도 맛있게 잘 먹었는데 이번에도 잘 먹었어요!!!,['https://rev-static.yogiyo.co.kr/3e93712f5da4fa7a8ceb5b0ad051ae39_tn.jpg']
22,4,"['엄니 닭볶음탕 ', '사리 선택(당면 추가)']",기본 제공 밑반찬이 단무지에 덤으로 주는 마카로니 샐러드 밖에 없었던 점이 아쉬웠습니다.,[]
23,4,"['엄니 닭볶음탕 ', '사리 선택(감자수제비추가', '사이드 선택(선비밥（일반공기밥） 추가)']",잘먹었습니다. 매운거 못먹는 사람이 있어서 안맵게 해달라고 했는데도 좀 매웠지만 맛은 있었어요.,[]
24,5,"['엄니 순살닭볶음탕', '선비밥（일반공기밥）', '사이다 1.25L']",맛있어요 최고최고👍👍,[]
25,5,"['엄니 닭볶음탕 ', '선비밥（일반공기밥）', '사이다 1.25L']",진짜 국물도 얼큰하고 감자고 포슬포슬 하니 너무 맛있었어요 종종 생각나서 시켜먹을 것 같아오 ^ㅇ^,['https://rev-static.yogiyo.co.kr/dc6640a50662d17e07c96286c8c46963_tn.jpg']
26,5,"['엄니 순살닭볶음탕', '사리 선택(감자 추가)']",밥을 주문깜빡했는데 아쉽네요 ㅠㅠ 배달빠르고 엄청맛잇어요 ㅎㅎ,['https://rev-static.yogiyo.co.kr/0fb1e47c583039433bf84eb3d18c191e_tn.jpg']
27,5,"['엄니 얼큰순살닭볶음탕', '사리 선택(당면 추가)']",이번엔 매콤순살닭볶음탕 먹었는데 맛있네요!! 서비스도 많이주시고 감사합니다~,[]
28,5,"['엄니 얼큰닭볶음탕', '사리 선택(당면 추가', '사이드 선택(선비밥（일반공기밥） 추가)']",여기 진짜 맛있어요 ❤️❤️,['https://rev-static.yogiyo.co.kr/1966ccb90bc7f5a6d51ec73036a01309_tn.jpg']
29,5,"['엄니 얼큰닭볶음탕', '사리 선택(감자수제비추가', '사이드 선택(부들부들 달걀찜 추가)']",여기맛있어요조금짠감이있지만신랑이랑너무맛있게먹었네요번창하세요,[]
30,5,"['엄니 얼큰닭볶음탕', '사리 선택(감자수제비추가)']",와 대박이에요 ㅋㅋㅋ배달음식인데도 뚜껑 열자마자 김이 모락모락 ㅋㅋㅋ당연 맛도 좋구요!! 젓가락  숟가락 넘 귀여워요 ㅋㅋㅋ자주 애용하겠습니당♡♡,['https://rev-static.yogiyo.co.kr/908c7b561a90cca03e40b5db59a0fc56_tn.jpg']
31,5,"['엄니 얼큰닭볶음탕', '사이드 선택(참치마요 주먹밥 추가)']",처음시켜밨는데 얼큰하니 맛있습니다!,['https://rev-static.yogiyo.co.kr/5fa1915f56c4e22aa0a98dc3c0ee1f4f_tn.jpg']
32,5,['엄니 묵은지닭볶음탕'],배달도 정확하고 서비스 감사합니다~맛있게 먹엇어요! 양도 많고 잘익어서 맛나요,[]
33,5,"['엄니 닭볶음탕 ', '사이드 선택(참치마요 주먹밥 추가)']",맛있게 잘먹었습니다,['https://rev-static.yogiyo.co.kr/23c4340fb8ff9ddb939734ef938b284b_tn.jpg']
34,4,"['엄니 순살닭볶음탕', '사리 선택(밀떡 추가', '사이드 선택(양반밥（흑미밥＋김） 추가)']",딱 혼자먹기 좋아요. 맛난데 좀 짜구여,['https://rev-static.yogiyo.co.kr/aef3498a4c29f4de678d4e74a58168f2_tn.jpg']
35,5,['엄니 닭볶음탕 '],맛있어요 ^^! 굿 굿 !,[]
36,5,"['엄니 닭볶음탕 ', '사리 선택(당면 추가', '사이드 선택(선비밥（일반공기밥） 추가)']",굿ㅎㅎㅎㅎㅎㅎㅎㅎㅎㅎ,[]
37,5,['엄니 닭볶음탕 '],사장님 너무 맛있게 먹었어요🥰👍강추👐,"['https://rev-static.yogiyo.co.kr/977f67fba4e18f1d620a342717010c19_tn.jpg', 'https://rev-static.yogiyo.co.kr/f98f72485205f1002affd6175be75193_tn.jpg']"
38,5,"['엄니 닭볶음탕 ', '사이드 선택(선비밥（일반공기밥） 추가)', '감자', '선비밥（일반공기밥）']",둘이 먹고도 남았어요ㅎ양이 많아요ㅋ잘먹었습니다리뷰이벤트 참여한다고 코멘트 안써서 계란찜 못먹은게크흡ㅜㅜ한이네요ㅋ담에 또시킬게요,['https://rev-static.yogiyo.co.kr/1fd6942c5c2e684f4998dd54f9e47d34_tn.jpg']
39,5,"['엄니 얼큰닭볶음탕', '사리 선택(감자 추가', '사이드 선택(선비밥（일반공기밥） 추가)', '선비밥（일반공기밥）']",그냥 말이 필요없어요 와...,['https://rev-static.yogiyo.co.kr/4af01a0aeeef2113e0bb643a60e8ae86_tn.jpg']
40,3,['엄니 닭볶음탕 '],양이 적었어요....,[]
41,5,['엄니 닭볶음탕 '],처음 시켜서 먹어봤는데 양도 적당하고너무 맛있게 잘 먹었어요!!❤️❤️ 담에 또 시켜 먹겠습니다!!,['https://rev-static.yogiyo.co.kr/dbebaf3e64fc64179ee02947391ed36a_tn.jpg']
42,5,"['엄니 간장찜닭', '맛 선택(보통맛', '사리 선택(당면 추가)']",평이 좋아서 시켰는데 맛있었어요!!찜닭먹으려했는데 찜닭 소스가 없어서 닭볶음탕 먹었는데 담엔 찜닭도 먹어봐야겠네용반찬이 깍두기랑 마카로니샐러드 2가지뿐인게 좀 아쉬웠지만 닭볶음탕 자체는 맛나요~~,['https://rev-static.yogiyo.co.kr/3eb908205e09525e657516720717ff2b_tn.jpg']
43,4,['엄니 닭볶음탕 '],맛있어요!!! 자주 시켜 먹을 것 같아요~~  잘먹겠습니당,['https://rev-static.yogiyo.co.kr/5d559274ab20a8354efba901a7166efa_tn.jpg']
44,5,"['엄니 닭볶음탕 ', '사리 선택(당면 추가)']",너무 맛있었어요 배달음식 닭도리탕은 별로일거라 생각했는데 닭다리 양도 크구 꿀맛이었습니다 ♡,['https://rev-static.yogiyo.co.kr/2ad0da240f8682c988e39ab24d67547d_tn.jpg']
45,5,"['엄니 닭볶음탕 ', '사리 선택(감자 추가)']",맛있게 잘먹겠습니다,['https://rev-static.yogiyo.co.kr/afbe19a7bdfcaf741be4f2049548a69b_tn.jpg']
46,5,['엄니 닭볶음탕 '],잘먹었습니다......,['https://rev-static.yogiyo.co.kr/212b97c5c3a18be1d72b5fb56a651c1d_tn.jpg']
47,4,"['엄니 순살닭볶음탕', '사리 선택(당면 추가)', '콜라 1.25L']",배달은 예정시간내보다 조금 더 빠르게 왔어요순살을 시켜서인지는 모르겠지만 고기자체보다는 양념이 맛있었네요 다음에 시키게된다면 뼈있는걸 먹어야겠어요,['https://rev-static.yogiyo.co.kr/dfbae9bc3c3141bc6e761d8023885358_tn.jpg']
48,5,"['엄니 순살닭볶음탕', '사리 선택(감자 추가', '사이드 선택(선비밥（일반공기밥） 추가)']",진짜 너무 좋아하는 맛이고 남겨서 계속 밥에 말아먹고 최곱니다,['https://rev-static.yogiyo.co.kr/a1c615d52d597fd6847915a96caa2de2_tn.jpg']
49,4,"['엄니 곱도리탕', '맛 선택(매콤한맛', '사리 선택(당면 추가', '사이드 선택(선비밥（일반공기밥） 추가)']",배불러요 곱창이 양이 적네요,['https://rev-static.yogiyo.co.kr/7ae8050decf34330c4ebbefd3acd29a1_tn.jpg']
50,5,"['엄니 닭볶음탕 ', '사리 선택(당면 추가)']",찜닭시키면 당면만 먹는 스타일인데도 당면이 남았어요!!!넘 좋음 ㅠㅠㅠㅠㅠ 감자도 포슬포슬,['https://rev-static.yogiyo.co.kr/2c36c6732ada3bc445e1965576ed73f7_tn.jpg']
51,5,"['엄니 순살닭볶음탕', '사이드 선택(건달밥（깍두기비빔） 추가)']",전반적으로 얼큰하고 맛있어요-!간장계란밥과 계람찜 조화도 예술이네요 ㅎ간은 좀 쌘 편이라 더 좋았습니다-♡,['https://rev-static.yogiyo.co.kr/30fd5f3805981537b26b18da465a3890_tn.jpg']
52,5,['엄니 닭볶음탕 '],국물에비벼먹었는데진짜맛있었어용~~양도많아서저녁까지해결할수있을거같아요!!,[]
53,5,"['엄니 순살닭볶음탕', '사리 선택(밀떡 추가)']",맛있어요 양도 엄청 많아서 두끼에 걸쳐 다 먹었네요,[]
54,5,['엄니 닭볶음탕 '],집에있던 양파랑 깻잎 대파 떡 넣었더니 양이 너무 푸짐하네요. .고기도 많고 양념이 너무 맛있어요~~너무...너무....맛있어요 ㅎㅎㅎ,['https://rev-static.yogiyo.co.kr/bb3e5cfa30e9d60176be796860d50578_tn.jpg']
55,5,['엄니 닭볶음탕 '],맛도좋고맵기도딱양이조금아쉽,[]
56,4,['엄니 얼큰닭볶음탕'],달지않고 담백깔끔한 맛이었어요,[]
57,5,['엄니 닭볶음탕 '],맛있어요 또 시킬게요,['https://rev-static.yogiyo.co.kr/133a37d480a795ed61a38eefaff06934_tn.jpg']
58,4,['엄니 닭볶음탕 '],배달이 빠른편은 아니나 음식은 맛있습니다,[]
59,4,"['엄니 순살닭볶음탕', '사리 선택(비엔나 추', '우동사리 추가', '사이드 선택(간장 계란밥 추가)', '간장 계란밥']",우선 양이 꽤 됩니다. 맵기도 적당하고 맛있어요!,['https://rev-static.yogiyo.co.kr/30a54a1950e912ea19a0741bd9c11961_tn.jpg']
60,5,"['엄니 순살닭볶음탕', '사이드 선택(선비밥（일반공기밥） 추', '양반밥（흑미밥＋김） 추가)']",맛있고 좋았어요:D,[]
61,5,['엄니 얼큰닭볶음탕'],가성비는 중간이지만맛은 좋았어요! 진한맛이 일품입니다.,['https://rev-static.yogiyo.co.kr/1720c9045e07d84bb744e214ad231b34_tn.jpg']
62,5,"['엄니 순살닭볶음탕', '선비밥（일반공기밥）']",최고의 맛과 양 모두 대만족 한번시키고 꽃혀서 계속시키는 중입니다,[]
63,4,['엄니 순살닭볶음탕'],큰 닭인데도 양이 약간 아쉬웠습니다ㅠ그리고 배달은 50분 걸린다고했는데1시간 정도 걸렸구요맛은 있습니다맛있게 먹었어요,[]
64,4,['엄니 얼큰닭볶음탕'],후기대로 맛있어요 다시 재주문 생각 있습니다 만족합니다,['https://rev-static.yogiyo.co.kr/8a5b95caf0017f69bf94f47c023ef37e_tn.jpg']
65,5,['엄니 닭볶음탕 '],맛은 보장 확실~~~사장님센스에 또 감동...뼈봉투 센스 최고예요 ㅎㅎㅎ,['https://rev-static.yogiyo.co.kr/25e9884975dcc7bce1b27bc52183f8b8_tn.jpg']
66,5,['엄니 순살닭볶음탕'],맛있네요   굿  ㅋ,[]
67,5,"['엄니 닭볶음탕 ', '사이드 선택(선비밥（일반공기밥） 추가)', '선비밥（일반공기밥）']",맛있게 잘 먹었습니다!!,['https://rev-static.yogiyo.co.kr/df78d96128aa4ce93d6b7263223d9482_tn.jpg']
68,5,"['엄니 닭볶음탕 ', '콜라 500mL']",배달이 조금 늦었어요ㅠㅜ,[]
69,5,"['엄니 닭볶음탕 ', '사이드 선택(참치마요 주먹밥 추', '마카로니 샐러드 추가)']",처음시켜봣는데너무맛잇엇어용~집에서해먹엇던닭도리탕맛이에욤~!,"['https://rev-static.yogiyo.co.kr/b3f4ff044004a951d2cd9ef800284184_tn.jpg', 'https://rev-static.yogiyo.co.kr/4c136c98fa32e7854d5197e47475d96c_tn.jpg', 'https://rev-static.yogiyo.co.kr/24b4f63c5406245df1c731850be219f6_tn.jpg']"
70,5,"['엄니 닭볶음탕 ', '사리 선택(곱창사리 추가', '사이드 선택(건달밥（깍두기비빔） 추가)']","엄니닭볶음탕 진짜 맛있어요~ 곱도리탕 걸쭉하니 고소하고 진해요.. 얼큰 칼칼^^ 가격 대비 양도 정말 푸짐하고, 참치 마요 주먹밥은 진짜 2~3인분 같아요! 밥도 많지만 참치도 듬뿍, 소스도 듬뿍~ 그래서 살짝 짜긴 했지만.. 그만큼 아낌없이 많이 주셔서 그런거라 생각하며 밥 추가해서 싹싹 다 먹었네요! 전체적으로 맛, 양, 가격, 구성, 서비스 모두 대만족입니다.","['https://rev-static.yogiyo.co.kr/902c80d2b2399c235f69f6812ceac6a3_tn.jpg', 'https://rev-static.yogiyo.co.kr/c9a0d29d13618d08103d638d8ba61734_tn.jpg']"
71,5,['엄니 얼큰순살닭볶음탕'],얼큰은 처음인데 진짜 맛있어요 그런데 반마리 순살은 양이 조금 적네요 ㅠㅠ 어쩔수없지만 그래도 맛있었습니다!,['https://rev-static.yogiyo.co.kr/b13179680b03463fd4ed11747638c2d0_tn.jpg']
72,5,"['엄니 얼큰닭볶음탕', '사리 선택(감자 추', '치즈 추', '라면사리 추가', '사이드 선택(선비밥（일반공기밥） 추가)']",와..진짜 맛있게 잘먹었습니다,"['https://rev-static.yogiyo.co.kr/6a5926a587025341c1ea2826a4095c12_tn.jpg', 'https://rev-static.yogiyo.co.kr/a1378816ce26a1ad4bb7e296e61c5707_tn.jpg']"
73,3,"['엄니 순살간장찜닭', '맛 선택(보통맛', '사리 선택(치즈 추가)']",찜닭이 너무 간장국물에 빠진 느낌이에요 건더기도 별로없어서 그냥 그랬습니다,[]
74,5,"['엄니 닭볶음탕 ', '사리 선택(감자 추가)']",우왕 맛잇게잘먹엇어요~~👍👍👍,['https://rev-static.yogiyo.co.kr/c69171186105ba5bf8c9cf88454642cb_tn.jpg']
75,5,"['엄니 얼큰순살닭볶음탕', '사리 선택(라면사리 추가', '사이드 선택(선비밥（일반공기밥） 추가)', '선비밥（일반공기밥）']",잘먹었ㅅㄷㅂ니다~~~^^,[]
76,5,"['엄니 순살닭볶음탕', '사리 선택(감자 추', '당면 추가)']",존맛... 이집은 찐이였더,[]
77,5,"['엄니 닭볶음탕 ', '사리 선택(감자 추가)']",대존맛음식도 어쩜 이리 따뜻하게 배송하시는지,[]
78,5,"['엄니 얼큰닭볶음탕', '사이드 선택(참치마요 주먹밥 추가)']",정말맛잇네요ㅋ매콤하니딱입니다~~마요덮밥은 최공ㅋ,['https://rev-static.yogiyo.co.kr/a819ce34c877c48ea94609233c16afcf_tn.jpg']
79,5,"['엄니 얼큰순살닭볶음탕', '선비밥（일반공기밥）', '참치 마요 주먹밥']",닭볶음탕은 당연히 합격!! 참치마요는 참치가 엄청 크네요 ㅋㅋ 양도 엄청 많이 주셨어요 잘 못 비빈건지 좀 느끼하긴했는데 그거 말고는 리뷰이벤 말고 음료도 챙겨주시고 완전 맘에 들었습니다! 담에 또 시킬게요 ㅎㅎ,"['https://rev-static.yogiyo.co.kr/b9a5efa7d551714d915a4a19c8fac074_tn.jpg', 'https://rev-static.yogiyo.co.kr/cb567b4d6188396072aba94aaa5a22c3_tn.jpg']"
80,5,"['엄니 닭볶음탕 ', '사이드 선택(건달밥（깍두기비빔） 추가)']",네 사용하기 편하네요,[]
81,5,"['엄니 얼큰순살닭볶음탕', '사이드 선택(선비밥（일반공기밥） 추가)']",진자 거짓말이 아니구 닭볶음탕 중에 젤 좋아해요 최소 이주에 한 번은 꼭 먹는... 여러분 다들 얼큰으로 시켜드세요 ㅠ 진심 존맛 ㅠ..,['https://rev-static.yogiyo.co.kr/201e6ee943d590e22c5f4aa3d1a0b936_tn.jpg']
82,5,"['엄니 묵은지닭볶음탕', '사이드 선택(선비밥（일반공기밥） 추가)']",이맛이 나오기위해 많이 노력하셨겠죠?? 감사합니다,['https://rev-static.yogiyo.co.kr/803bf140c515419cbc1a8d1e2611d49e_tn.jpg']
83,5,['엄니 묵은지닭볶음탕'],믿고 먹는집~~묵은지가 많이 들어가서인지 국물이 걸죽하지 않고 맑아요.아이들이랑 먹을껀데.. 엄니닭볶음탕 안매웠던거 생각하고 그냥 시켰는데 고추가 10개쯤 들어있어서 깜놀하고 뺐어요. 그거보단 훨씬 맵네요. 큰닭으로 시켰는데.. 전 가심비는 엄니닭볶음 보통사이즈가 더 좋은것 같아요~~,[]
84,5,"['엄니 순살닭볶음탕', '사이드 선택(양반밥（흑미밥＋김） 추가)', '콜라 1.25L']",사장님이 너무 좋은 분이세용 오늘따라 김가루가 떨어졌는지 전화로 친절하게 안내 주시고 계란찜을 서비스로 보내주셔서 만족스럽게 맛있는 식사 했습니다. 음식은 당연히 맛있고요 맵기도 적당하고 양도 둘이서 먹기 좋았습니다 배달이 빨라서 받았을때 엄청 뜨거웠어요 서비스면에서 완전 만족해버려서 앞으로는 닭볶음탕 매일 여기서만 먹을거 같아요 다음엔 뼈있는것도 먹어볼래요 감사합니다,[]
85,5,['엄니 얼큰닭볶음탕'],맛있게 매콤하고 닭상태가 괜찮았습니다. 하루지나고 데워먹으니 더욱 맛있었습니다. 매운것 잘 못드시는 분은 많이 매워합니다. 재주문의사 있어요!,['https://rev-static.yogiyo.co.kr/d02f3183855b3e36b99747a3722e20a5_tn.jpg']
86,4,['엄니 닭볶음탕 '],맛있어요 ㅎㅎ 다음에도 시켜먹을게요,['https://rev-static.yogiyo.co.kr/2890038427bc52368a0917197a721ed9_tn.jpg']
87,5,"['엄니 얼큰닭볶음탕', '사리 선택(라면사리 추가', '사이드 선택(참치마요 주먹밥 추가)']",매웠지만 맛있게 매워서 잘 먹었읍니다~,[]
88,5,"['엄니 얼큰순살닭볶음탕', '사리 선택(감자 추가)']",맛있오요!! 당면 기본으루 있는 줄 알고 추가 안했는데 없었네용 다음엔 추가해서 먹을래요ㅎㅎㅎ 감자 푹 익혀 주셔서 너무너무너무 좋았습니당! 마카로니 샐러드도 맛남!,['https://rev-static.yogiyo.co.kr/00f9d5dfe05e72d9ea19dce3b67ea172_tn.jpg']
89,5,"['엄니 순살닭볶음탕', '사리 선택(치즈떡 추가)']",배달시간보다 조금 늦었지만 맛있었어요 일부러 매운거 안시켰는데도 조금 맵네요(식으니깐 좀 덜매워지긴했어요) 당근 감자 메추리알 양파 여러가지 들어있어서 맛나게 먹었습니다.,['https://rev-static.yogiyo.co.kr/086b2250fd25d2a07b367ab31672644d_tn.jpg']
90,5,"['엄니 순살닭볶음탕', '사리 선택(감자 추가)']",맛있고 양도 충분해요 닭볶음탕 생각나면 여기서 먹어야겠어요,['https://rev-static.yogiyo.co.kr/07b226261dd5ab667c2e5702d82a69f9_tn.jpg']
91,5,['엄니 닭볶음탕 '],맛있어요 양도 괜찮구 당근도 넘 마시써요...계란찜이랑 마카로니도 넘 맛있어요,['https://rev-static.yogiyo.co.kr/8d272843b93281ab77dcc37f53125e44_tn.jpg']
92,5,"['엄니 얼큰닭볶음탕', '사리 선택(감자 추가)']",항상 닭볶음탕 생각나면 시켜요~ 말할 필요가 있나요.존맛탱,['https://rev-static.yogiyo.co.kr/392ffd811bcf510e407456ae15149f24_tn.jpg']
93,5,"['엄니 묵은지닭볶음탕', '사이드 선택(참치마요 주먹밥 추가)']",맛있고 양도 많고 최고예요! ^^,['https://rev-static.yogiyo.co.kr/c6156156134bfa247a8bccb04fc7ff15_tn.jpg']
94,5,"['엄니 닭볶음탕 ', '사리 선택(당면 추가)']",맛있어요 감자가 입에서 없어질만큼 푹 익어서 맛있네요 리뷰 계란찜 썼는데 마카로니 왔어요 근데 이것도 맛있네요,['https://rev-static.yogiyo.co.kr/bf174412abef4a05875230829b5f5d16_tn.jpg']
95,5,['엄니 닭볶음탕 '],맛있다는 리뷰  많은거보고 주문했는데 정말 맛있게 잘먹었어요~~매운거 잘 못 먹는편인데 딱 적당히 맛있게 매운맛이였어요,['https://rev-static.yogiyo.co.kr/267e260617ec98ec8ea0b84b80b769b7_tn.jpg']
96,5,"['엄니 닭볶음탕 ', '선비밥（일반공기밥）']",맛ㅇㅆ어용 언제 먹어도 굿,[]
97,5,['엄니 닭볶음탕 '],맛있어서 정신없이 먹다가 사진을 찍었네요 ㅋㅋㅋ양념도 맛있고 양도 많고 너무 맛있게 먹었어요자주시켜 먹을께용 서비스계란찜도 잘 먹었어요,['https://rev-static.yogiyo.co.kr/15111c24cc6c6da1e8f65aee709b009b_tn.jpg']
98,5,"['엄니 순살닭볶음탕', '사리 선택(당면 추가)']",진짜 맛있어요~ 며칠전에 시켜 먹었는데 후기를 이제 쓰네요.저 달달한맛 별로 안좋아하는데 달지도않고 알맞게 매콤한맛에 진짜 제 입맛에 딱 맞는 맛집을 찾은것 같아요~후기 쓰고있으니 또 먹고 싶어요^^당면추가 했는데 일반당면 아니고 납작한 중국당면(?) 이것도 진짜 쫄깃쫄깃 하고 맛있어요~,['https://rev-static.yogiyo.co.kr/51415ed3fcaff01cb5139aa6b4b200f7_tn.jpg']
99,5,['엄니 닭볶음탕 '],감자가 포실해서 맛있었어요~,['https://rev-static.yogiyo.co.kr/f54ac455558a00ac54b282c5e2869b27_tn.jpg']
100,5,['엄니 닭볶음탕 '],항상시켜먹는데...비오는데 배달하시느라 고ㅛㅐㅇ하셨습니다..마늘장아찌 추가됐는데 넘 맛나요 ㅎㅎㅎ,['https://rev-static.yogiyo.co.kr/0006246353a3bfb086c105a0118c40bb_tn.jpg']
101,5,"['엄니 순살닭볶음탕', '사리 선택(라면사리 추가)']",맛있습니다! 순살 닭이 좀 더 있으면 좋을거같아요ㅜ,['https://rev-static.yogiyo.co.kr/18db7c58e29d08e6bab71b3cd68f74c4_tn.jpg']
102,5,['엄니 얼큰닭볶음탕'],항상 맛있게 먹고있습니다,[]
