,별점,주문메뉴,리뷰,사진
0,5,['콩국수'],시원하면서 국물이 진해서 대게 맛있게 먹었습니다,[]
1,5,"['물냉면', '회냉면']",맛있습니다.회냉면 양념장이 살짝 부족한게 아쉬웠지만...물만두 서비스도 맛나요.ㅎㅎ,['https://rev-static.yogiyo.co.kr/0b9ac6f80ee7f29fcb9f5663a4512690_tn.jpg']
2,4,"['비빔냉면', '열무냉면']",맛있게 먹었습니다만 그냥딱 배달냉면맛이었습니다.,['https://rev-static.yogiyo.co.kr/3aadbccabe7b360ced957d3d3df3a834_tn.jpg']
3,4,"['열무냉면', '묵밥＋공기밥', '사골떡만두국']",맛있어요! 이것저것 시켜서 다같이 먹어봤는데 묵밥이 살짝 아쉽더군요. 전 열무냉면 맛있더라구여ㅋㅋ,['https://rev-static.yogiyo.co.kr/3a8a2933432f27f3f4752acb519379be_tn.jpg']
4,5,"['열무냉면', '왕만두']",맛나요 맛나요 맛나요,[]
5,5,"['비빔냉면', '열무냉면', '콩국수']",냉면육수맛과 양념 맛이 진하고 맛있습니다,[]
6,5,"['열무냉면', '왕만두', '물만두']",맛도 좋고 양도 괜찮아요.다음에 또 주문할꺼에요.,[]
7,5,"['비빔냉면', '열무냉면']",회사에서 시켜먹었어요~ 배달도 시간맞춰서오고 감사합니다 ㅎㅎㅎ리뷰서비스 물만두 맛있어요,['https://rev-static.yogiyo.co.kr/b8a193ab5f3a7087afffac4cdef569a1_tn.jpg']
8,5,['콩국수'],무더운 여름 ! 온수골이랑 함께 할수있어서 다행이에요~~~ ! 역시나 국물까지 완샷! 넘 맛있게 잘먹었습니다 감사해용,[]
9,5,"['매운 물냉면', '열무냉면']",너무 실망이 큽니다 면이 붙어있어서 빼고 먹을라고 했는데 2~3개 더 나오네요... 그리고 열무냉면에 간은 좋았으나 열무김치 자체가 너무 짜서 전부 빼서 먹었어요,"['https://rev-static.yogiyo.co.kr/7668287b2805c3a592c8292c5ac01186_tn.jpg', 'https://rev-static.yogiyo.co.kr/5a292b2a1436a1f6bce4e4ca5719d49f_tn.jpg', 'https://rev-static.yogiyo.co.kr/3a17d6119885675bd63d3d8e1f6200b3_tn.jpg']"
10,5,"['매운 물냉면', '물냉면', '물만두']",잘 먹엇습니다~! 만두가 두개여서 깜짝놀랏네욯ㅎ,[]
11,5,['물냉면'],맛나게 잘먹었습니다,[]
12,3,"['매운 물냉면', '왕만두', '공기밥']",배민으로 몇번 시켜먹다가 요기요에서 처음 시켜먹었는데 비빔냉면으로 잘못 조리하고 육수를 넣으신건지 참기름 둥둥 떠다니고 비빔냉면에 육수 부은맛나네요..참기름 맛 싫어서 물냉면 먹는 사람인데.. 다음엔 실수없으셨으면 좋겠네요 그래도 맛은 있어요,[]
13,5,"['비빔냉면', '콩국수', '콩국수']",배달은 빠르고 맛도 좋습니다,[]
14,4,"['물냉면', '콩국수', '왕만두', '사이다 1.25L']",맛나게 잘먹었습니다~,[]
15,5,['비빔냉면'],엄마랑 같이 먹었는데 맛있었어요~ 여자 혼자 먹기 양도 적당하구요. 비빔으로 시켰는데 양념 맛있다고 엄마께서 말씀하셨어요. 육수 주신것도 따로 먹어봤는데 시원하고 맛있어요 !!,[]
16,5,['물냉면'],어머니 할머니가 아주 맛잇다네요 자주 시켜먹을게요,['https://rev-static.yogiyo.co.kr/ccc0881f63609c477209578841c59700_tn.jpg']
17,4,"['물냉면', '비빔냉면']",비냉 존맛이네요 ㅠㅠㅠ,['https://rev-static.yogiyo.co.kr/3134c69707a49ec6e4e0f638355eba77_tn.jpg']
18,5,"['회냉면', '콩국수', '왕만두', '콜라 1.25L']",회냉면 맛있는 식당 찾아보기 힘들던데 여긴 맛있네요 만두도 집앞 국수 맛집에서 먹던맛!,[]
19,5,"['물냉면', '비빔냉면', '사골떡만두국']","냉면, 떡만둣국 주문했는데 양도 많고 맛있어요..물만두 서비스는 너무 좋아요..",[]
20,5,"['매운 비빔냉면', '비빔냉면']",냉면 맛있어요ㅎㅎ 물만두도 굿,['https://rev-static.yogiyo.co.kr/4ef3d8a12811af9c3224d9146aa98fd4_tn.jpg']
21,2,"['물냉면', '비빔냉면']",리뷰물만두도 안왔고 물냉면은 덜 풀고 삶으셨는지 붙어서 딱딱해서 다 잘라내고 먹었어요~,['https://rev-static.yogiyo.co.kr/c1506846cd9e371f4f8557ccca24f414_tn.jpg']
22,4,"['콩국수', '사골떡만두국']",콩국수가 좀더 진했으면 ㅜ떡만두국은 약간 짭짤해요김치는 너무 맛있ㅋㅋㅋ,['https://rev-static.yogiyo.co.kr/cd6ddbc8f250a5178f7e8a066f54abcf_tn.jpg']
23,4,"['물냉면', '비빔냉면', '왕만두']",물만두서비스 감동♡ 맛있게 잘먹었습니당,[]
24,5,"['물냉면', '비빔냉면']",물냉 비냉 고민하다 둘다 주문했는데 다 맛있었어요. 다이어트중인데 육수까지 원샷... 물만두도 맛있게 잘먹었습니다 :),['https://rev-static.yogiyo.co.kr/26d4bb249d64c4d0b1e78397e5e1a20a_tn.jpg']
25,4,"['물냉면', '비빔냉면']",맛도있고 양도 적당했어요평소 냉면 많이 시켜먹는데 괜찮네요~~,[]
26,5,"['물냉면', '비빔냉면', '열무냉면']",배달도 빠르고 맛있습니다! 열무냉면에 열무도 많이 들어가고 더운데 시원하게 잘 먹었습니다👍👍👍,"['https://rev-static.yogiyo.co.kr/98c94e3c08f61697c6941c8ce2c525b2_tn.jpg', 'https://rev-static.yogiyo.co.kr/5486f2ae539fce92c6d5be00554da3e7_tn.jpg', 'https://rev-static.yogiyo.co.kr/b7d0c4f9aed847db61f9421a854cb91f_tn.jpg']"
27,5,"['물냉면', '열무냉면', '콩국수', '왕만두']",처음에 시킬때는 양이적어보여서 곱배기 시켰는데정말 곱배기인듯 ㅎㅎ맛도 좋네요,[]
28,4,"['매운 비빔냉면', '물냉면']",괜찮아요.맛은 나쁘지않아요,[]
29,4,"['콩국수', '묵밥＋공기밥', '사이다 1.25L']",괜찮네요  맛있게  잘 먹었습니다,[]
30,5,"['물냉면', '열무냉면']",진짜 맛있게 먹었어요~ 물냉면에 면이 덜 익은 듯 뭉친 게 있어서 다음엔 그것만 좀 부탁드릴게요~^^ 열무도 엄청 맛있다고 해서 다음 냉면 먹을 때 무조건 온수골에서 시키려구요~ 잘 먹었습니다 사장님~,"['https://rev-static.yogiyo.co.kr/967dd86675646efd912e4f68ed290ac3_tn.jpg', 'https://rev-static.yogiyo.co.kr/8f69bcff36d49910f89693c4ad948936_tn.jpg']"
31,5,"['물냉면', '콩국수']",맛나게 잘먹었습니다,[]
32,5,"['매운 물냉면', '콩국수']",너무 맛있어서 다시 시켰네요 ㅎㅎ 콩국수도 맛있게 잘 먹었습니다 감사합니다~,['https://rev-static.yogiyo.co.kr/01285e5fee476c89d55288a6abb77c72_tn.jpg']
33,4,"['물냉면', '회냉면']",잘 먹었습니다. 양도 푸짐하고 물만두 서비스도 맛있게 잘 먹었습니다. 그런데 그냥 물냉면을 시켰는데 바닥에 빨간양념이 꽤 많이 있었어요. 원래 그런건가요? 할머니가 매운걸 드시질 못하셔서 조금 번거로웠습니다. 감사합니다.,[]
34,5,['콩국수'],국물이 진하고 맛있네요 추천합니다~^^,['https://rev-static.yogiyo.co.kr/3be4c60f260608748bb3173bfa0edcc7_tn.jpg']
35,5,"['매운 물냉면', '매운 비빔냉면']",육수도 시원하고 비냉은 면이 불어서 온거 같았는데  육수부어먹으니 면발이 장난아님 ㅋㅋ 자주 시켜먹을게요,[]
36,5,"['비빔냉면', '콩국수']",항상 맛있게 먹어요~ 감사합니다~~,"['https://rev-static.yogiyo.co.kr/864772a48f5850ec4b9f43dcb5005e23_tn.jpg', 'https://rev-static.yogiyo.co.kr/b3f12e2c6d5de8bfcf33d31fad045ec6_tn.jpg', 'https://rev-static.yogiyo.co.kr/ef2bb8aad5b615d226b472e7e15364ff_tn.jpg']"
37,3,"['매운 물냉면', '물만두', '콜라 1.25L']",면이 뿔어서 왓어요 후기보고 이젠 안그럴거라거 생각햇는데 뿔어서 오네요.. 면좀 신경써주세요,['https://rev-static.yogiyo.co.kr/fd03540d4ddde4b244c555d32d73e831_tn.jpg']
38,5,"['매운 물냉면', '회냉면']",맛있게 잘 먹었습니다.,['https://rev-static.yogiyo.co.kr/397968b4c5eaca24844c5a718e908814_tn.jpg']
39,5,"['매운 물냉면', '왕만두', '콜라 1.25L']",ㅇㅇㅇㅇㅇㅇㅇㅇㅇㅇ,[]
40,5,"['비빔냉면', '콩국수']",배달도 금방 왔고 맛있습니다~,['https://rev-static.yogiyo.co.kr/4d3042d53bbc0e32f67c1477ded381be_tn.jpg']
41,5,"['물냉면', '비빔냉면', '열무냉면']",서비스까지주시고 맛있어용,['https://rev-static.yogiyo.co.kr/baa82bcb5fb6e9a68016af610ebc88d2_tn.jpg']
42,5,"['물냉면', '물냉면', '콩국수']",맛있게 먹었네요 콩국수가 특히 괜찮았어요,['https://rev-static.yogiyo.co.kr/51eef194a530b146ff88ee8694bf8909_tn.jpg']
43,2,"['물냉면', '물만두']",면이 너무 불어있습니다 심하게요,[]
44,5,"['비빔냉면', '콩국수']",ㅇㅇㅇㅇㅇㅇㄹㅇㅇㅇㅇㅇㅇㅇ,[]
45,5,"['비빔냉면', '사골떡만두국']",주문한 냉면집들 가운데 손에 꼽히네요비냉 맛있어요^^,[]
46,5,['매운 물냉면'],맛있어요~~~~~~~,['https://rev-static.yogiyo.co.kr/eff9936664a5ba575eee38d943b5c797_tn.jpg']
47,5,"['매운 물냉면', '콩국수']",콩국수~매운 물냉면 맛있게 잘 먹었어요강추합니다~,['https://rev-static.yogiyo.co.kr/d499ac87b23c7c89d043382bb3376763_tn.jpg']
48,5,"['매운 물냉면', '콩국수']",너무 맛있어요 근데 냉면 면이 불은건지 너무 차가워서 얼은건지 다 붙어있었어용 콩국수 진하고 맛있고 냉면도 맛있네여,['https://rev-static.yogiyo.co.kr/cb27c3a8385660e2dd23980aac53a001_tn.jpg']
49,5,"['비빔냉면', '콜라 1.25L']",냉면 혼자 두그릇 먹었는데 양념도 맵지 않게 적당하고 물만두 서비스로 주셨는데 정말 맛있습니다 꼭 드세욧,[]
50,5,"['매운 물냉면', '콩국수']",항상 맛있게 먹고 있습니다 ㅎㅎ 이번에도 맛있게 먹었습니다 감사합니다,"['https://rev-static.yogiyo.co.kr/0baa596874eed64dac2bc2f95bb19b09_tn.jpg', 'https://rev-static.yogiyo.co.kr/7603f04954a027b18f0ca349ae6aa259_tn.jpg']"
51,5,"['매운 물냉면', '매운 비빔냉면']",맛잇게 잘 먹엇습니다,[]
52,5,"['매운 물냉면', '물냉면']",지난번 보다 육수가 약간 싱거운거 같아요ㅜ 그래도 맛있게 잘 먹었어요서비스 감사합니다,['https://rev-static.yogiyo.co.kr/f9d28240f06c2e999c6801dac17d4e38_tn.jpg']
53,5,['물냉면'],맛있게 잘먹었습니다.,[]
54,3,"['비빔냉면', '묵밥＋공기밥']",맛은 제 입맛엔 아니네요 ㅠ 묵밥은 너무 시고 비빔냉면은 그냥 저냥 쏘쏘 ㅠ,['https://rev-static.yogiyo.co.kr/75391b2117193bed327c0fe7390f3a4c_tn.jpg']
