,별점,주문메뉴,리뷰,사진
0,5,['차곱순혼술세트（차돌＋곱창＋순대）'],배달음식을 평소 자주 시켜먹는데 여기는 진짜 맛있네요! 양도 많고 맛있게 잘 먹었습니다:),[]
1,5,['차곱순두리세트（차돌＋곱창＋순대）'],"곱 많고, 맛 있습니다. 다음에는 순대, 차돌 빼고 곱창만 시켜볼까합니다",[]
2,4,"['차곱순혼술세트（차돌＋곱창＋순대）', '따끈한 밥한그릇']",재료는 신선한거 같은데 뭘 안넣은건지 너무 맹맛이었네요,['https://rev-static.yogiyo.co.kr/d5fbca96e3a2b4a9152d6eeec6cb3b12_tn.jpg']
3,3,['차곱순혼술세트（차돌＋곱창＋순대）'],곱창 냄새가 나서 소주 붓고 한번 더 팔팔 끓여서 먹었네요;;,[]
4,4,['차곱순혼술세트（차돌＋곱창＋순대）'],좋았어요 다음에 또 시킬게요,[]
5,4,"['차곱순혼술세트（차돌＋곱창＋순대）', '따끈한 밥한그릇']",맛있네요~ 공기밥 양은 적어서 아쉬웠습니다,['https://rev-static.yogiyo.co.kr/d22c8cc43d3cba254e8412d7b7d5823d_tn.jpg']
6,5,"['차곱순두리세트（차돌＋곱창＋순대）', '순진한 계란찜', '따끈한 밥한그릇', '사이다  500mL']",술안주로도 좋지만 항상 한끼식사로 자주 먹게되네요ㅋㅋ 양도 많고 맛도 있고 가격대비 이상이에요!! 대신 공깃밥 시키면 양이 좀 적은거 같아요...,[]
7,3,"['차곱순두리세트（차돌＋곱창＋순대）', '순진한 계란찜', '따끈한 밥한그릇', '사이다  500mL']",항상 자주 시켜먹었는데 오늘은 곱창맛이 너무 쓰네요... 여태까지 먹었을땐 그러지 않았는데 오늘만 그래서 아쉬웠어요...ㅠㅠ,[]
