,별점,주문메뉴,리뷰,사진
0,5,"['까만찜닭', '메뉴선택(순살', '맛선택(아기맛)']",맛있게 잘 먹었습니다~예전 테트리스찜닭이랑 같은 맛이네요^^,['https://rev-static.yogiyo.co.kr/306380c55031036c1a2d66ed2292a790_tn.jpg']
1,5,"['빨간찜닭', '메뉴선택(순살', '맛선택(보통맛)', '참이슬후레쉬']",테찜이나 만병통 생각나네요 잘먹었습니다~~,[]
2,5,"['까만찜닭', '메뉴선택(순살', '맛선택(아기맛)']",요청사항 잘 들어주셔서 감사해요.여전히 맛있어요!서비스 구운계란도 잘먹었어요~~,[]
3,5,"['까만찜닭', '메뉴선택(순살', '맛선택(아기맛)']",흥덕에서 유명한 테트리스찜닭이 이름만 바뀐곳이에요.국내산 닭으로 하는 순살은 흔하지 않은데 국내산이라 더 좋아요. 👍 아이랑 으로 하면 고추가루를 주셔서 어른들은 맵게 아이들은 안맵게 먹을수 있답니다. 강추에요~,['https://rev-static.yogiyo.co.kr/c269bc8131e34085aa4cfef3c3e30c5f_tn.jpg']
4,5,"['빨간찜닭', '메뉴선택(순살', '맛선택(보통맛)', '모듬사리', '콜라1.25L교체']",영통와서 먹어본것중에 1~2위를 다투네요!!누가 이길 까요??ㅋㅋㅋ,['https://rev-static.yogiyo.co.kr/a74dbcd784bc755612980455c1c80604_tn.jpg']
5,5,"['까만찜닭', '메뉴선택(뼈', '맛선택(보통맛)', '납작만두']",맛있어요. 살짝 매콤한게 입맛도 당기게 만듭니다.,['https://rev-static.yogiyo.co.kr/ca30932716c1cea20d01759bb1e8fbcd_tn.jpg']
6,5,"['빨간찜닭', '메뉴선택(순살', '맛선택(순한맛)', '공기밥']",죤맛탱구리네요~^^완전 맛나요 꼭시켜드세요,"['https://rev-static.yogiyo.co.kr/92d58da9c48d62782554274140273214_tn.jpg', 'https://rev-static.yogiyo.co.kr/bc8d72cd49d18804ff72abec16b59d11_tn.jpg', 'https://rev-static.yogiyo.co.kr/743377008e5f84d39f03422d025ef17b_tn.jpg']"
7,5,"['까만찜닭', '메뉴선택(뼈', '맛선택(순한맛)']",문앞 도착 사진도 보내주셨네요. 기분좋은 배달 감사합니다,['https://rev-static.yogiyo.co.kr/1af46ec6b29e6c15e1529ad78685f2d7_tn.jpg']
8,5,"['까만찜닭', '메뉴선택(순살', '맛선택(아기맛)']",맛있게 잘 먹었습니다,['https://rev-static.yogiyo.co.kr/35ee0a382e2c65fe0c83dac3644f5361_tn.jpg']
9,5,"['까만찜닭', '메뉴선택(뼈', '맛선택(아기맛)']",애들이랑같이먹기 너무좋아요^^ 다음에도 시켜먹을께용,['https://rev-static.yogiyo.co.kr/a502108940ee8399aadbe2d08fb23900_tn.jpg']
10,5,"['빨간찜닭', '메뉴선택(순살', '맛선택(순한맛)']",바뀐 상호 찾느라 시간 좀 걸렸네요. 기분탓인지 양은 조금 줄은 느낌인거 같기도..근데 공기밥은 이제 추가주문 사항인가요? 맛은 여전히 맛있고 양도 많은편입니다,['https://rev-static.yogiyo.co.kr/72ba7b9efc7f9e865a2056faa1ec9ff2_tn.jpg']
11,5,"['까만찜닭', '메뉴선택(뼈', '맛선택(순한맛)', '치즈토핑']","클린리뷰 보고 주문한건데 좋은데는 이유가있네요양에 놀라고 밥,무,서비스까지주시고맛도물론, 살도통통한게 정말맛있는 식사였습니다정말푸짐하네요",['https://rev-static.yogiyo.co.kr/99c58554783411e36fdd4d944044c539_tn.jpg']
12,5,"['까만찜닭', '메뉴선택(순살', '맛선택(보통맛)']",상호 바뀐 뒤에는 처음 시켜요여전히 맛도 좋고 서비스도 최고입니당 :)보통맛은 살짝 매콤해서 더 좋았어요!!후식 젤리까지 챙겨주시는 센스~ 감사해요!!오픈이벤트로 주신 맥반석 계란도 참 맛났어요!!다음에 또 시킬께요!!,['https://rev-static.yogiyo.co.kr/921b60226e4b518512f730bd7b4bcf14_tn.jpg']
13,5,"['까만찜닭', '메뉴선택(순살', '맛선택(보통맛)', '모듬사리', '콜라1.25L교체']",맛있어서 좌절 합니다....살은....어떻게 빼야할지...ㅠㅠ,['https://rev-static.yogiyo.co.kr/394406ae6536f5db23dc0b3a0fa1fd2d_tn.jpg']
14,5,"['까만찜닭', '메뉴선택(순살', '맛선택(아기맛)']",정말 맛있습니다!!!,['https://rev-static.yogiyo.co.kr/411d9a4c864a68af3538c0a820703b56_tn.jpg']
15,5,"['까만찜닭', '메뉴선택(순살', '맛선택(보통맛)']",생각보다 양도 많고 맛있네요.,['https://rev-static.yogiyo.co.kr/733781abcac241f26a0a1e5c2198c462_tn.jpg']
16,5,"['까만찜닭', '메뉴선택(순살', '맛선택(보통맛)', '모듬사리', '콜라1.25L교체']",너무 자주 시켜 먹어 리뷰가 몇개 되는듯 하네요;;;;;다 먹어서 예날 사진 투척 ㅎㅎ,['https://rev-static.yogiyo.co.kr/624446fc66f1f30e575b60a21552b184_tn.jpg']
17,5,"['까만찜닭', '메뉴선택(순살', '맛선택(아기맛)']",항상 만족해요!!!!,[]
18,5,"['까만찜닭', '메뉴선택(순살', '맛선택(보통맛)', '공기밥', '치즈토핑']",맛있게 잘먹었습니다.,[]
19,5,"['까만찜닭', '메뉴선택(뼈', '맛선택(보통맛)', '납작만두']",상호가 바뀐지 몰랐네요. 사진도 못찍고 먹어버렸습니다.ㅎㅎ수고하세요!,[]
20,5,"['까만찜닭', '메뉴선택(뼈', '맛선택(보통맛)', '납작당면', '치즈떡']",사장님 서비스까지 잘 받았고찜닭 생각보다 엄청 빨리 도착했어요~보통맛으로 시켰을 때성인이 먹기 살짝 매콤한 맛이라 더 맛있게 먹었습니다~~여기 맛있고 좋아요!!,['https://rev-static.yogiyo.co.kr/a3318bf69929e6fd8b86b160521e619e_tn.jpg']
21,5,"['까만찜닭', '메뉴선택(순살', '맛선택(매운맛)']",배달도 빠르고  양도 많고 맛도있고 좋아요,"['https://rev-static.yogiyo.co.kr/ebf191edddf1836c4a4befe35620878c_tn.jpg', 'https://rev-static.yogiyo.co.kr/8da1f56913c306c2417fb76630871dee_tn.jpg']"
22,5,"['까만찜닭', '메뉴선택(뼈', '맛선택(아기맛)']",아이가 너무 좋아해요. 여기꺼 먹고 찜닭에 눈을 떴어요.,[]
23,5,"['까만찜닭', '메뉴선택(순살', '맛선택(순한맛)', '까만찜닭', '메뉴선택(순살', '맛선택(매운맛)', '납작당면']",양도 많고 맛도 좋았어요,['https://rev-static.yogiyo.co.kr/9a870006d663dfd3217c93788c869291_tn.jpg']
24,5,"['까만찜닭', '메뉴선택(뼈', '맛선택(보통맛)', '공기밥']",두번째 시켜먹는건데 넘 맛있어요^^ 음식을 받아보면 조리실의 청결함을 알꺼같은데 딱 너무 알꺼같아요 깔끔합니다👍🏻,[]
25,5,"['까만찜닭', '메뉴선택(뼈', '맛선택(보통맛)']",대박 맛있네요. 리뷰 이벤트 낚이는거 아닌가 했는데아니였어요. 다들 진심 맛나서 리뷰 올리시는듯요. 양 진짜 대박 많아서 둘이 먹는데 남겼어요. 보통맛으로 시켰는데 살짝 더 매콤했음 좋았을듯요. 여튼 배달도 빨리주시고 강추입니다.,['https://rev-static.yogiyo.co.kr/57520b09ccfd68d3ffe2cda7e4a276af_tn.jpg']
26,5,"['까만찜닭', '메뉴선택(순살', '맛선택(순한맛)', '납작당면']",배달도 빠르고 맛있어요~~^^,[]
27,3,"['까만찜닭', '메뉴선택(순살', '맛선택(보통맛)']",맛있게 잘 먹었습니다.감사합니다.,[]
28,4,"['까만찜닭', '메뉴선택(순살', '맛선택(매운맛)']",리뷰가 좋아서 주문했는데 제 입맛에는 좀 안 맞는 듯해요. 구운계란 감사합니다.,['https://rev-static.yogiyo.co.kr/451918483b8366c8eec6d43d70cde00f_tn.jpg']
29,4,"['까만찜닭', '메뉴선택(뼈', '맛선택(아기맛)']",순한맛으로 시켜 아이들과도 함께 잘 먹었습니다. 보편적이고 깔끔한 맛이라 만족합니다. 조금만 덜 짜도 좋을듯합니다.,[]
30,5,"['까만찜닭', '메뉴선택(뼈', '맛선택(보통맛)']",여기  그냥 묻고 무조건 시키세요 여러분 찜닭은 삼매경입니다...ㄷㄷ,[]
31,5,"['까만찜닭', '메뉴선택(뼈', '맛선택(보통맛)']",맛있어요!! 소스가 진짜 짱인듯!양이 조금 아쉬워서 별 하나 뺐어요 ㅠ서비스 계란 감사해용!,"['https://rev-static.yogiyo.co.kr/e1d12d668d1a64aa1f0238252f6a4b7c_tn.jpg', 'https://rev-static.yogiyo.co.kr/bb9a09acc97b9754adb22c1d9de8e1b3_tn.jpg', 'https://rev-static.yogiyo.co.kr/60c9006c2b5c753f61a7ae7cb516fcaf_tn.jpg']"
32,5,"['까만찜닭', '메뉴선택(뼈', '맛선택(보통맛)', '까만찜닭', '메뉴선택(뼈', '맛선택(아기맛)', '치즈떡']",테트*스 흥덕점 찾는다고 요기요 다 뒤져봐도 없어서 할 수없이 평점 젤 높은데 시키자 하고 들어와 리뷰 보는데 여기가 바로 그 집이네요 ㅋㅋ 너무 맛있어요. 손님 초대용으로 많이 시켰는데 다들 맛있다 하셨어요.^^,[]
33,5,"['까만찜닭', '메뉴선택(순살', '맛선택(아기맛)']",항상 만족해요. 맛과 친절 좋아요.,[]
34,5,"['까만찜닭', '메뉴선택(순살', '맛선택(보통맛)']",맛도좋고 양도 좋아요~ 자주 시켜 먹을 것 같아요,['https://rev-static.yogiyo.co.kr/bc4d2054d1a2b3481b54b6ee084f8c92_tn.jpg']
35,5,"['까만찜닭', '메뉴선택(순살', '맛선택(보통맛)']",맛있어요~ 기본인데도 꽤 맵네요! 전에 시켜먹던곳보다 맛있어서 바꿔보려구요~구운계란도 잘먹었어요^^,[]
36,5,"['까만찜닭', '메뉴선택(순살', '맛선택(매운맛)', '납작당면']",늘 맛있게 먹어요~~~ 맛있게 매운 맛!,[]
37,5,"['까만찜닭', '메뉴선택(뼈', '맛선택(아기맛)', '치즈떡']",상호는 바꼈어도 여전히 깔끔하고 맛있습니다.,['https://rev-static.yogiyo.co.kr/9724da172381798bdae96af2b0193072_tn.jpg']
38,5,"['까만찜닭', '메뉴선택(뼈', '맛선택(순한맛)', '납작만두']","먹느라 정신이 팔려 사진을 찍지 못했어요~~카페에서 올라온 사진 보고 막내가 먹고 싶다고 노래를 해서 주문했어요납작만두, 반마리 추가 함께온 젤리, 계란, 콜라 서비스~~ 저녁으로 잘먹고 아이들도 맛있게 먹었어요 마라닭으로 먹고 싶었는데 애들이 매울까봐서~ 참았는데 다음엔마리닭으로 주문하고 싶네요번창하세요",[]
39,5,"['까만찜닭', '메뉴선택(순살', '맛선택(아기맛)']",맛있어서 자주시켜먹요한마리반시켜서 엄마2.아이4 이 배불리먹었어요점심이라고 주말인데도밥3공기주셨고계란서비스도 좋으네요,[]
40,5,"['까만찜닭', '메뉴선택(뼈', '맛선택(순한맛)']",와이프가 너무 좋아하네요.순한맛으로 했는데 초등4도 잘 먹네요.매운맛도 괜찮을 것 같아서 담에 도전해보려고 해요.,[]
41,5,"['까만찜닭', '메뉴선택(뼈', '맛선택(보통맛)']",멋있어요~ 다음엔 매운맛으로~,[]
42,5,"['빨간찜닭', '메뉴선택(뼈', '맛선택(매운맛)', '참이슬후레쉬', '카스']",제가 찾던집이네용^^정말 맛있어용,['https://rev-static.yogiyo.co.kr/43ab423f62f6c09a32d69b71ab039681_tn.jpg']
