,별점,주문메뉴,리뷰,사진
0,5,"['삼겹김치찜', '추가 선택(김치 추', '삼겹 추', '스팸 추가)', '공기밥']",리뷰가 하나도 없어서 도전 이였지만 요청사항도 잘 챙겨주셨고 너무 맛있네요. 꽂혀가지고 연속으로 두번시켜서 무려 4일 동안 저녁 네끼를 먹었어요. 자주 시켜먹을게요~,[]
1,5,"['삼겹김치찜', '공기밥']",맛좋아요 양도좋고 자주먹을거같아여,[]
2,5,"['삼겹콩비지김치찜', '공기밥']",오ㅏ 저 배달로 먹는 김치찜중에서양념이 달지 않은 곳이 없었거든요?하지만 자취하나까 해먹긴 귀찮구 어쩔수없으니늘 그냥 그런대로 만족하며 먹고했는데이젠 이곳에서만 주문하려합니다!!!!!!!!!정말 양 푸짐하고요ㅠㅠㅠㅠㅠㅠ먹느라 정신없어서 사진못찍었는데 진짜매칼하니 진국인 맛 굿굿 김치며 고기며 뭐하나 아쉬운점없이 밥세공기뚝딱했어용심지어 어떻게 반찬까지 담백하고 메인과 어우러지게간이 되있고 완벽한가요ㅠㅠ저희가족들도 소식가인에 다 밥 두공기씩 콩비지 국물에 쓱썩쓱썩 비벼먹었답니다ㅎㅎㅎ지금처럼 이맛 변치말아주세요!!!,[]
3,5,['고등어김치찜'],고등어 김치찜 맛있어요 비린것도 없이 잘먹었어요,['https://rev-static.yogiyo.co.kr/d740bcaf0b6f3480022e43e904cd61ef_tn.jpg']
4,4,"['삼겹김치찜', '추가 선택(김치 추가)']",저번은고등어찜 맛나게먹고 오늘은삼겹찜으로   맛나게먹었어요 반찬도마카로니만챙겨달라요청했는데 ㅎ 요청대로해주셔서좋네요 아쉬운점은  삼겹살중에 냄새나는게 더러있어 먹기좀힘들었어요 ㅠ 김치찜자체는 쵝오입니다,['https://rev-static.yogiyo.co.kr/6a3792dc6f2fd42a47185ad958479866_tn.jpg']
5,4,['참치김치찜'],참치김치찜을 주문했는데 삼겹김치찜이 왔네요.일단 오픈 해서 먹긴 먹는데. 이런일이 ㅜ,"['https://rev-static.yogiyo.co.kr/f4d2caabd407c4d6f673b20bebd5d103_tn.jpg', 'https://rev-static.yogiyo.co.kr/c7c45959240f8c389005a0da88305d8c_tn.jpg']"
6,5,"['삼겹김치찜', '계란찜']",김치찜을 엄청 좋아하는데..간만에 제대로 된 집을 찾은 거 같네요. 삼겹김치찜 소자와 계란찜 주문해서 먹었는데.. 김치찜이 정말 제가 원하는 그맛~! 정말 기쁘네요. 이제 여기서만 시켜야 겠어요. 두명이서 먹기에는 소자가 충분하네요. ㅎ,"['https://rev-static.yogiyo.co.kr/843593e4b5b78de792ac5a6b66698345_tn.jpg', 'https://rev-static.yogiyo.co.kr/f7db55b97dbdb7140a6938b4570e882b_tn.jpg']"
7,5,['삼겹김치찜'],기대 이상이었습니다. 김치찜 생각나면 또 주문할 것 같습니다.,[]
8,5,['고등어김치찜'],양도 많고 엄마가 해주신 맛이네요. 아이도 너무 잘 먹었어요.,[]
9,5,['고등어김치찜'],배달하시는 분도 인사도 너무 공손하게 하시고 친절하시고 평이 좋아 시켰는데 진짜 맛있네요!! 반찬도 딱 먹기 좋은 것들만!! 아무래도 찜이다 보니 조금 짜긴해요ㅠㅠ,['https://rev-static.yogiyo.co.kr/2d88530185150956d6bb2d7d0ee0f877_tn.jpg']
10,5,['삼겹김치찜'],일전에 배민에서도 시켜먹었는데그때 맛은 있는데 고기냄새가 조금 아쉽다고 평을 했었어요이번에 다시 시키면서 고기냄새나면 주문하지 말아야겠다생각하고 시킨건데 왠걸!! 냄새 안나고 맛있게 잘 먹었어요리뷰에 올라온 글 확인하시고 음식개선하는 음식점인가봐요이제 더 자주자주 시켜먹어야겠네요맛있는 삼겹살 김치찜 감사합니다~~,[]
11,3,['고등어김치찜'],그냥저냥 별로였습니다 다음엔 다른메뉴도전,[]
12,4,"['삼겹김치찜', '추가 선택(삼겹 추가)', '공기밥', '사이다 1.25L']",맛있게 잘먹었습니다 ㅎㅎㅎㅎㅎ,[]
13,5,"['삼겹김치찜', '계란찜']",진짜 맛있습니다~,[]
14,5,"['고등어김치찜', '계란찜']",3인식구 먹기 딱 좋습니다.비린내도 없고 김치찜도 너무 맛있어요.,[]
15,5,['스팸김치찜'],두번시켜먹엇눈데..넘나양도많고 맛잌ㅅ어용🤭🤭두번시켜먹으세영❤️,['https://rev-static.yogiyo.co.kr/0042c76219f106eabe7453458bc78afc_tn.jpg']
16,5,"['삼겹김치찜', '추가 선택(삼겹 추가)']",담에시킬땐 공기밥이랑 밑반찬 빼고 고기 조금이라도 더달라 할래요.. 메인음식이 너무 맛있어서 밥으로 배채우기 아까움,['https://rev-static.yogiyo.co.kr/08faaae20146c69cb69d40203f99a04f_tn.jpg']
17,5,"['삼겹김치찜', '추가 선택(수제비 추가)']",배달도 빠르고 양도 많고 맛있게 잘먹었습니다. 단지 추가로 주문한 수제비가 전부다 너무 딱딱해서 아쉬웠지만 그외엔 다 좋았습니다.,[]
18,5,"['삼겹김치찜', '추가 선택(삼겹 추가)', '공기밥']",양도 푸짐하고 맛있어요,[]
19,5,"['삼겹김치찜', '추가 선택(삼겹 추가)']",술안주로도 최곱니다. 항상 애용하고 있습니다. 감사합니다.,['https://rev-static.yogiyo.co.kr/bf06a69ecebeb7d08f4192eed7f77814_tn.jpg']
20,5,['삼겹김치찜'],처음 시켜봣는데 맛잇어용!!!,[]
21,5,['삼겹김치찜'],양도 많고 맛있어요!!,[]
22,5,"['삼겹김치찜', '추가 선택(삼겹 추가)']",맛있습니다 ㅎㅎ 완전 밥도둑이었어요 ㅎ,[]
23,4,['삼겹김치찜'],아--주 맛있게 잘 먹었습니다,['https://rev-static.yogiyo.co.kr/addbe3335a091339c6c9cc79c76ac2c2_tn.jpg']
24,5,"['삼겹김치찜', '콜라 500mL']",약간 짜긴 했는데 물 부어서 먹으니까 진짜 맛있었어용 싱거운 것 보다는 낫죠 잘 먹었어요,[]
25,4,"['삼겹김치찜', '추가 선택(김치 추가)']",김치추가했더니 3-4인분쯤 되는거 같아요.넉넉하게 잘 먹었어요.버섯이랑 두부도 조금 들어있구요.삼겹살은 좀 더 두툼하면 좋을 것 같아요,"['https://rev-static.yogiyo.co.kr/c101fc2070f79e12133db94d38f88b3a_tn.jpg', 'https://rev-static.yogiyo.co.kr/eea18202fa559908118b8879c17b3266_tn.jpg']"
26,5,"['삼겹김치찜', '추가 선택(삼겹 추가)']",사장님 너무맛있게먹었구요 단골될것같습니다밥을 세공기나먹었네요 너무너무잘먹었습니다!,[]
27,5,"['삼겹김치찜', '추가 선택(두부 추가)']",최고에요 ㅠㅠㅠㅠ진짜 눈물흘리눈 맛 ㅠㅠㅠ,['https://rev-static.yogiyo.co.kr/9aa3a978007834e35d1ab577e7841508_tn.jpg']
28,4,['삼겹김치찜'],친구들이 맛있다고해서 엄청 기대하구시켰는데 김치가 너무 시었어요 ㅠㅠㅠㅠ.....! 원래 그런건가용 ?ㅠㅠ... 그래두 맛있었어요!,[]
29,5,['삼겹김치찜'],김치가 너무 시다는 리뷰에 저도 모르게 홀린 듯 주문.ㅋㅋ 신김치 너무 먹고싶었는데 진짜 완전 맛있는 신김치에요. 김치 추가할걸... 후회중입니다. 근데 고기가 좀 퍽퍽해요ㅠ 그리고 매운맛 초보자에겐 너~~무 매워요. 맛있게 매워서 울면서 먹긴 하는데 저같은 초보님들은 쿨피스를 준비하세요.,['https://rev-static.yogiyo.co.kr/8a3fe5ccc5b1f6891c5ff650fadb0892_tn.jpg']
30,5,['삼겹김치찜'],비싸긴 해도 맛있어요,[]
31,5,['삼겹김치찜'],김치찜은 항상 찜생찜사에요 양도많고 너무 맛있어요~!,[]
32,4,['삼겹김치찜'],"리뷰가 좋아서 고민끝에 시켜봤는데 고기질도 별로인 것 같고, 국물은 시큼함보다 단맛이 강해서 제 취향은 아니었어여 맛이 뭔가 개운하지 못한 느낌이었어요 재구매 의향 없네요.",[]
33,5,['삼겹김치찜'],맛있게 잘 먹었습니다 양도 많아서 남은거 그다음날 또 먹었네요,['https://rev-static.yogiyo.co.kr/620ba517add3329e6c64fb0aad1f4cee_tn.jpg']
34,5,['삼겹김치찜'],역시 너무 맛있음 양도 적당하고 고기도 많이들었고양념도 맛있고 김치도 잘려있어 먹기좋음,['https://rev-static.yogiyo.co.kr/818d94df7e6b631ec8e1c5cdfc09a4a2_tn.jpg']
35,5,"['삼겹김치찜', '추가 선택(두부 추가)']",너무 맛있어요 김치도 짱인데 좀 달았어요ㅠㅠ 담엔 조금 덜 달게 해주세용👀💕,[]
36,3,['삼겹김치찜'],신김치와 돼지고기 나쁘지 않습니다,[]
37,3,['삼겹김치찜'],"맛은 있는데, 고기랑 쌀 질이 별로에요.고기랑 쌀만 좀 바꾸시면, 좋을거 같습니다.",[]
38,5,"['삼겹김치찜', '추가 선택(스팸 추가)', '공기밥']",진짜 스팸추가해서 먹으면...이렇게 밥도둑일 수 없습니다 ㅠ,['https://rev-static.yogiyo.co.kr/ef1130f6316cc18d68fc2a5a476bce7e_tn.jpg']
39,5,"['삼겹김치찜', '계란찜', '공기밥']",양도 많고 맛있네요,[]
40,5,"['스팸김치찜', '추가 선택(삼겹 추가)']",여러번시켜먹지만 느므맛잇어용❤️,['https://rev-static.yogiyo.co.kr/6d22ec9fea802f631797bd692c43d768_tn.jpg']
41,2,['삼겹김치찜'],여기 진짜 좋아하는 집인데 첨으로 맛이 약간 변했어요 ㅠㅠ 고기에서 냄새가 나서.... ㅠㅠㅠㅠ,[]
