,별점,주문메뉴,리뷰,사진
0,5,"['순살두마리세트', '순살 두마리 치킨 선택 2(크리미어니언순살치킨)']","서비스 떡볶이 양이 꽤 넉넉했어요! 특유의 떡도 좋구요!크림양파의 크림,양파가 따로 깔끔히 와서 치킨 바삭하게 잘먹었어요.",['https://rev-static.yogiyo.co.kr/06d6aa2af397d17ef5b965822c305783_tn.jpg']
1,5,['핫쵸킹'],좀 매웠지만 배달도 빠르고 상당히 맛있는집,['https://rev-static.yogiyo.co.kr/d9731e779fe07e4ecfd9297793f244a6_tn.jpg']
2,5,"['순살 반반세트', '순살 핫쵸킹)']",매번 ㄱㅊ치킨 레드콤보만 먹다가 오늘 휴무라 여기시켰는데 양도많고 맛도좋고 13900원에 이래도 되나 싶을정도로 만족하고갑니다. 앞으로 당분간 여기만 시키려합니다.,['https://rev-static.yogiyo.co.kr/c942d61679e62fb7c026ca32084281d5_tn.jpg']
3,5,['바삭한저염후라이드'],i liked it very much,['https://rev-static.yogiyo.co.kr/f5f5e1ade15e5541fb1b3f6528ba5cd2_tn.jpg']
4,5,['크리미어니언순살치킨'],깔끔하고 맛도 있어요~ 서비스로 주신 떡볶이도 맛있어요~,['https://rev-static.yogiyo.co.kr/303a2a4cf34067f533e58ebb2abb8110_tn.jpg']
5,4,"['순살 쉑쉑양꼬치킨', '황금공룡알（5개）']","가격도 적당하고 배달도 빨랐는데,양꼬치킨은 좀 호불호가 갈릴듯 하군요.그리고 공룡알(팥도너츠)에서 닭냄새가 많이나는것이 아쉬웠습니다.",['https://rev-static.yogiyo.co.kr/9151a847c105cd66f9db22c789c21615_tn.jpg']
6,5,['양념치킨'],치킨도 맛있고 서비스로 주신 떡뽁이도 맛있어요사실 떡볶이가 너무ㅜ맛있어요 개깜놀,[]
7,4,"['뼈두마리세트', '뼈두마리 치킨 선택 2(양념치킨)']",두마리 치킨이 보통 작은데 여긴 양도 많고 무엇보다 정말 껍질이 바삭해서 맛나네요~딴데는 염지를 많이해서 짠데 이건 애들 그냥 먹여도 될만큼 안짜고 담백해서 넘 좋았어요.양념도 우리가 아는 딱 그맛이고 역시 껍질이 바삭해서 다먹을때까지 눅눅해지지 않았어요. 배달은 문자주신대로 늦긴했지만 오픈점이라 이해할수있고 배달원분도 친절하셨어요~ 서비스 떡볶이도 면이 독특하고 매콤하니 정말 맛있게 잘먹었습니다. 번창하세요~,[]
8,5,['크리미어니언순살치킨'],배달도 빠르고 치킨 떡볶이 둘다 엄청 맛있어요 다음에 또 시켜 먹을게요!,['https://rev-static.yogiyo.co.kr/8414469c9991aa591db1fd4113f726ac_tn.jpg']
9,5,"['뼈두마리세트', '뼈두마리 치킨 선택 2(핫쵸킹)']",양도 맛도 최고입니다.,[]
10,5,"['순살두마리세트', '순살 두마리 치킨 선택 2(순살 바삭한저염후라이드)']",새로운 단골집이 될것 같습니다. 너무 맛있네요ㅎㅎ 번창하세욧!!,['https://rev-static.yogiyo.co.kr/3ac2177a48c1267d67848ed6b8845a9d_tn.jpg']
11,4,['간장치킨'],서비스도 좋고 맛도있고 자주 먹게될것같네요},[]
12,5,['치킨＋호로록 떡볶이（매운맛）'],완전 맛있어요 떡볶이까지 먹으니 더더더좋네여,[]
13,5,"['뼈 반반세트', '양념치킨)', '콜라 1.25  추가']",배달 45분 문자 왔는데 20분만에왔어여 ㅎ 핫키친이랑 양념치킨 반반세트에 첫주문 이벤트로 떡볶이 주셨는데 다 맛있었어여 떡볶이 의외로 맛있어서 놀랐습니더 ㅋㅋㅋ 핫치킨 맛있게 매콤해서 맛있고 양념은 느끼하지 않고 담백해여 평범해요,"['https://rev-static.yogiyo.co.kr/e82114d00c19270ede8bb825d97ede16_tn.jpg', 'https://rev-static.yogiyo.co.kr/75dbc4edd66c09af98e0780e70bd4616_tn.jpg', 'https://rev-static.yogiyo.co.kr/81c335b80f9b7ddb441feef1c5ac523e_tn.jpg']"
14,5,"['순살두마리세트', '순살 두마리 치킨 선택 2(순살 바삭한저염후라이드)']",ㄱㅊ치킨 시키려다 여기 맛들이고나서 바로 다음날 또시켰는데 이제서야 리뷰쓰네요두번째주문 같이먹은 친구가 오늘 자기집에서 시켜먹었는데 너무 맛있게 잘먹었다하여 까먹었던 리뷰 작성합니다 첫주문 떡볶이가 너무맛있다네요.^^,['https://rev-static.yogiyo.co.kr/e4afe794cb221d9b2aa0cebe90f6451b_tn.jpg']
15,5,['핫쵸킹'],맛이 좋군요! 뼈있는것도 만족스럽습니다,[]
16,5,"['뼈두마리세트', '뼈두마리 치킨 선택 2(꿔바로우치킨)']",맛있었어요~떡볶이도 고퀄리티였습니다. 다음에또시켜먹을게여~~~~,"['https://rev-static.yogiyo.co.kr/fdf1e8785d8e83e1e5c09bf9f15e5914_tn.jpg', 'https://rev-static.yogiyo.co.kr/bcfe84f9dc446b5cab27539e3b981af2_tn.jpg']"
17,4,"['뼈 반반세트', '양념치킨)']",양념&간장 시켰어요~진짜 맛있고 양도 적당하니 좋은데..뼈치킨 시켰는데 순살로 왔네요....ㅎㅎ...이번에는 그냥 먹겠습니다~,['https://rev-static.yogiyo.co.kr/7be46078946e606d800e01a753846743_tn.jpg']
18,5,"['뼈두마리세트', '뼈두마리 치킨 선택 2(마늘스테미나 치킨)']",맛도 좋고 양도 많아요 ㅎㅎ 사는 곳이랑 가까워서 그런지 배달도 빠르네요,[]
19,5,"['순살두마리세트', '순살 두마리 치킨 선택 2(순살 양념치킨)']",저염후라이드 아이랑 먹기 너무 좋아요^^,[]
20,4,"['뼈두마리세트', '뼈두마리 치킨 선택 2(간장치킨)']",싸고 양 많습니다.요청 사항도 잘 들어주셔서 고맙습니다.그렇지만 제가 좋아하는 튀김옷은 아니어서아쉽네요,[]
21,4,['바삭한저염후라이드'],떡볶이가 맛있어요 맛있어요,['https://rev-static.yogiyo.co.kr/be09b3936176168706748582a4f01f1b_tn.jpg']
22,4,"['뼈두마리세트', '뼈두마리 치킨 선택 2(핫쵸킹)']",맛있게 잘먹었어요~생각보다 조금 맵긴했지만후라이드도 잘 튀겨져서 좋았습니다추천추천,[]
23,5,"['뼈 반반세트', '핫쵸킹)']",맛나네요~양도적당하구 곰젤리 서비스로 입가심,['https://rev-static.yogiyo.co.kr/1ed3e26a4741f82ec1f8f945cb6c854c_tn.jpg']
24,5,"['뼈두마리세트', '뼈두마리 치킨 선택 2(간장치킨)']",맛잇어용 ㅎ배달도 빠르고 잘 먹엇읍니당 ㅋㅋㅋ,[]
25,5,"['크리미어니언순살치킨', '고구마스틱 추가']",고구마 튀김 굉장히 맛있었습니다.,['https://rev-static.yogiyo.co.kr/407af465cec6b3e3e6a00e932921ec5d_tn.jpg']
26,4,"['순살두마리세트', '순살 두마리 치킨 선택 2(순살 양념치킨)', '콜라 1.25  추가', '무 추가']",순살 양념 간장시켰어여~맛있었고 서비스로주신 공룡알도 잘먹었습니다. ^^,['https://rev-static.yogiyo.co.kr/0abfbc861d7b1d451570f9fc37286d21_tn.jpg']
27,5,"['뼈 반반세트', '마늘스태미나치킨)']",완전맛있었어요 ㅋㅋ가성비 갑 오브 갑이에요 짱짱,[]
28,5,['크리미어니언순살치킨'],잘먹었습니다!배달도 빨리오고양도 많고양파랑 소스도 따로 주셔서 너무 좋았어요떡볶이는 완전 짱!,['https://rev-static.yogiyo.co.kr/dc79a7081bec62acf483d3f1d5509bf6_tn.jpg']
29,5,['크리미어니언순살치킨'],맛잇어요맛나요맛나요,['https://rev-static.yogiyo.co.kr/3158cf0671b919b54aaec581ac3e488d_tn.jpg']
30,5,"['순살 반반세트', '순살 개매운치킨)']",i liked it very much.. spicy chicken is tooo spicy,['https://rev-static.yogiyo.co.kr/9589ad636a5f56c2f503ed32a1fa701f_tn.jpg']
31,5,"['순살 반반세트', '순살 핫쵸킹)']",떡볶이만 파셔도 대박나실듯요..너무 맛나네요..,['https://rev-static.yogiyo.co.kr/60ef8e3f09bb59f9b999fee08db9280b_tn.jpg']
32,4,[],맛있었어여~다음에또시켜먹울게여~,['https://rev-static.yogiyo.co.kr/9293d76d63681faaa3e0a6d6b758d15c_tn.jpg']
33,5,['크리미어니언순살치킨'],정말 맛잇게 잘 먹엇어용 ㅎㅎ,[]
34,5,"['순살 간장치킨', '콜라 1.25  변경']",정말 맛잇게 잘 먹엇어요 ㅎㅎ,[]
35,5,['바삭한저염후라이드'],첫주문 서비스 떡볶이도 넘 맛있구 치킨도 맛있네요~,['https://rev-static.yogiyo.co.kr/c7fa7ab38f63e6a5322130ff9d124e37_tn.jpg']
36,5,"['순살두마리세트', '순살 두마리 치킨 선택 2(토마토커리순살치킨)']",저희집 바로 옆에 새로생긴집이라서 오다가다 봤었던 집인데 한번 시켜먹어볼까 하고 시켜먹었는데 너무 맛있어요 배달하시는분도 친절하시고 서비스로 주신 떡볶이가 생각보다 진짜 너무맛있어서 놀랐어요 저도 요식업하는 사람이라서 민감한 부분이 많은데 튀김옷 보니까 기름도 깨끗한 기름 쓰시는 것 같네요 맛도 너무 깔끔하고 토마토커리 소스는 독특하고 양파슬라니스랑 먹으니까 너무 잘어울려서 정말 맛있어요 양파 슬라이스 아이디어도 너무 좋은 것 같아요!! 존맛!!,['https://rev-static.yogiyo.co.kr/67504a63b1c5a700f51b398773899a3c_tn.jpg']
37,5,['크리미어니언순살치킨'],"여러분 여기 어니언치킨 꼭 드세요 엉엉....ㅠㅠ어니언치킨 시킬때 소스에 절여서 눅눅하게 올까봐 걱정했는데, 센스있게 이렇게 딱! 빠삭빠삭하게 보내주셨어요 허허 떡볶이 서비스도 너무 맛있었습니다! 배달도 빨랐어요. 패키지에 미아찾기였나 아무튼 따뜻따뜻했어요 다음에 또 시켜먹을게옹.","['https://rev-static.yogiyo.co.kr/50fc26b7938d3cb18d6644000aa1a17b_tn.jpg', 'https://rev-static.yogiyo.co.kr/9f789198f56b07b6c483811e69a6b2cd_tn.jpg']"
38,5,"['순살두마리세트', '순살 두마리 치킨 선택 2(순살 핫쵸킹)']",서비스 떡볶이 진짜 맛있었어요!  다음에 또 시켜먹을것 같아요. 마초킹도 먹을수록 매운맛이라 좋았고 토마토 커리치킨 소스도 독특해서 맛있었습니다!,"['https://rev-static.yogiyo.co.kr/d719c7386a4c0cb56077b8bf48c17d0b_tn.jpg', 'https://rev-static.yogiyo.co.kr/b7d4b747f8b3fa47c1e4c5e405497af7_tn.jpg']"
39,5,"['순살두마리세트', '순살 두마리 치킨 선택 2(순살 양념치킨)']",첫 주문이라 떡볶이도 주셨는데 정말 맛있어요! 제가 주소를 잘 못 써서 전화로 정정했는데 제대로 와서 감사하고 ㅋㅋㅋ 순살이라 먹기 편하네요!  치킨도 바삭하고 만족스럽고 다음엔 다른 맛으로 시켜보려구요~ ㅎㅎ,['https://rev-static.yogiyo.co.kr/6168ba0884e6ba028e91fe5dddc6f5fa_tn.jpg']
40,5,['크리미어니언순살치킨'],양 정말 푸짐합니다. 맛있게 잘먹었어요~,['https://rev-static.yogiyo.co.kr/2cda6c2ee6280441bf3721c5bbad1e3c_tn.jpg']
41,5,['토마토커리순살치킨'],토마토커리 치킨 양념치킨이랑 비슷한데 맛있네요 서비스 치즈스틱도 맛있었습니다 만족스러워요,['https://rev-static.yogiyo.co.kr/c67976932e3560166c9dc2f415c4da90_tn.jpg']
42,5,['크리미어니언순살치킨'],처음 시켜봤는데 치킨도 맛있고 서비스로 주신 떡볶이도 너무 맛있었어요,['https://rev-static.yogiyo.co.kr/fb66af025565d11a2e6e9043f3596635_tn.jpg']
43,5,"['순살두마리세트', '순살 두마리 치킨 선택 2(크리미어니언순살치킨)', '케이준감자 추가', '콜라 1.25  변경']",맛있고 빨리와요ㅎㅎ,[]
44,5,"['치킨＋호로록 떡볶이（보통맛）', '황금공룡알（5개）']",호로록떡볶이 추천별 10만개,[]
45,5,"['순살두마리세트', '순살 두마리 치킨 선택 2(순살 바삭한저염후라이드)']",제가 주소를 전 주소로 써서 배달기사님이 괜히 고생하셨네요 ㅜㅜ 정말 감사해요 ㅜㅜ 서비스 치즈스틱까지도 양이 푸짐해서 두사람이서 완전 배부르게 먹었어요! 다음에 또 시킬게요~,"['https://rev-static.yogiyo.co.kr/22c6c36d1846d62ed0e8a623678e05ca_tn.jpg', 'https://rev-static.yogiyo.co.kr/0b415bba81df67ac820308040911214e_tn.jpg']"
46,5,['핫쵸킹'],맛도 있고 양도 많고 자주 시켜먹을께요~,['https://rev-static.yogiyo.co.kr/4a7739a1fa242a4e24e723ebcc96998e_tn.jpg']
47,5,"['순살두마리세트', '순살 두마리 치킨 선택 2(크리미어니언순살치킨)']",주문누락으로 배달이 엄청늦게 왔지만 미안하셨는지 서비스 메뉴를 많이주셔서 기분이 풀렸습니다. 앞으로도 잘 먹겠습니다 ㅋ,[]
48,5,"['뼈두마리세트', '뼈두마리 치킨 선택 2(바삭한저염후라이드)', '무 추가']",핫쵸킹 기대 일도 안했은데 넘나맛있는고 ㅠㅠㅠㅠㅠ자주 먹어야겠다요 갑사합니다 ㅎㅎ,[]
49,5,"['뼈두마리세트', '뼈두마리 치킨 선택 2(간장치킨)']",저번에도 시켯엇을때도 맛잇엇어여 여전히 맛잇어여,[]
50,5,"['순살두마리세트', '순살 두마리 치킨 선택 2(크리미어니언순살치킨)']",바삭하고 따뜻하게와서 맛있게 잘먹었습니다,['https://rev-static.yogiyo.co.kr/6c79007b091d379ec0b484622a66dc6d_tn.jpg']
51,5,['치킨＋호로록 떡볶이（보통맛）'],양도 많고 떡볶이도 너무 맛있어요~ 자주 시켜먹을게요!,[]
52,5,['순살 핫쵸킹'],이가격에 이 양이라니 좋군요,['https://rev-static.yogiyo.co.kr/61afc6c0355678a59f9566fe8d39e3cd_tn.jpg']
53,5,"['뼈두마리세트', '뼈두마리 치킨 선택 2(양념치킨)']",잘먹었습니다. 다  맛있었어요 재구매의사 있구요 특히 국물떡볶이는 극찬합니다  다만 배달이 한시간이상 걸렸지만 기다릴만했습니다 감사히 잘먹었습니다,['https://rev-static.yogiyo.co.kr/96b8e22b66f57a79799e8708cf67a130_tn.jpg']
54,5,"['순살 반반세트', '순살 양념치킨)', '콜라500ml']",너무맛있어요!! 떡볶이도 맛있고 치킨도 맛있네요잘먹을게요ㅎㅎ,[]
55,5,"['뼈두마리세트', '뼈두마리 치킨 선택 2(쉑쉑양꼬치킨)']",매운양념 짱매움. 뭐 그걸원하고 시킨거니 맛남 맛남,['https://rev-static.yogiyo.co.kr/d4023e5b69e33843feff752c809cd23c_tn.jpg']
56,5,['치킨＋호로록 떡볶이（보통맛）'],완전 맛나네요~~짭짤하니 술안주로 그만이에요.떡볶이는 학창시절 학교앞에서파는 떡볶이맛이구요넘 맛나요.,[]
57,5,"['뼈 반반세트', '양념치킨)', '호로록떡볶이（매운맛）']",금요일이라 많이 바쁘신가바욤..ㅎㅎㅎ오늘도 잘 먹겟습니당..,['https://rev-static.yogiyo.co.kr/05f805c292aee42f13a8c37697d8a474_tn.jpg']
58,5,"['순살두마리세트', '순살 두마리 치킨 선택 2(순살 쉑쉑양꼬치킨)']",오 맛있구 양도 좋았어요 굿,[]
59,4,['순살 크리스피후라이드'],양은 꽤 많았는데  약간 비린내가 나더라구요 ㅠ 닭에서 나는건지 기름에서 이상한 냄새나는지 정확히는 모르겠지만 ㅠ,[]
60,4,"['순살두마리세트', '순살 두마리 치킨 선택 2(순살 양념치킨)']",떡볶이 좋은 치킨보다 떡볶이가 더생각남,[]
61,4,"['순살 반반세트', '순살 마늘스태미나치킨)']",맛있어요! :)10자채우래요 맛있는데!!아배달도빨랐던거같아요!!!,[]
62,5,"['순살 반반세트', '순살 양념치킨)']",맛있습니다. 항상 잘먹고 있어요.,[]
63,5,"['순살 반반세트', '순살 양념치킨)']",맛.배달.가격.서비스 다 마음에 드네요,[]
64,5,"['순살두마리세트', '순살 두마리 치킨 선택 2(순살 마늘스태미나치킨)']",엄청 맛있는 치킨 감사합니다,[]
65,5,"['순살 반반세트', '순살 간장치킨)']",너무  맛있어서 과식했어요치킨도 떡볶이도 깔끔하고 맛있네요단골할께요,[]
66,5,['순살 핫쵸킹'],가격도 싸고 맛도 좋아요 다음에도 시켜먹을게요,[]
67,4,"['뼈 반반세트', '양념치킨)', '콜라 1.25  변경']",일단 서비스로 온 국물 떡뽂이는 정말 맛있었다. 나중에 국물에 밥까지 비벼먹음 ㅎㅎ 자극적인걸 별로 안좋아하는 나한테 저염치킨과 양념의 반반치킨도 괜찮았음.,[]
68,5,"['순살두마리세트', '순살 두마리 치킨 선택 2(순살 간장치킨)']",진짜 적당히 촉촉하면서 적당히 바삭한게 치킨집중에 여기가 최고에요!,['https://rev-static.yogiyo.co.kr/a467ff83cc1dea0f57e5793e158a83dd_tn.jpg']
69,5,['치킨＋까르보 떡볶이'],언제나 참 맛있게 먹고 있습니다,[]
70,5,['크리미어니언순살치킨'],우와ㅋㅋㅋ양 진짜 많아요!! 브라질산이라고해도 언제나 두마리 세마리 먹었는데 요건 한마리라고해도 혼자서 먹기에는 충분하고도 남아요 가격도 싸고!!와ㅋㅋㅋ진짜 양 많네요ㅋㅋㅋㅋ우와ㅋㅋㅋ왜 이제야 알았지???호로록 떡볶이도 양 많도 여기 자주는 아니더라도 시킬 때마다 여기만 할꺼에요 최고!!,['https://rev-static.yogiyo.co.kr/97a87fb10db2e194e6835edf0899262f_tn.jpg']
71,5,"['순살 반반세트', '순살 간장치킨)']",처음 시켜먹어봤는데 떡볶이랑 치킨 둘다 너무 맛있어요! 다음에도 또 시켜먹고싶어요 강추강추♡,['https://rev-static.yogiyo.co.kr/9194a41593cfa8760e1a2014a519d866_tn.jpg']
72,4,['핫쵸킹'],첫주문이라 떡볶이 서비스 주셨는데 정말 맛있는 괜찮은 메뉴입니다. 강추!! 치킨도 딱 매콤하고 양도 좋고 양념도 좋은데 정말....아쉽게 좀 짜요 조금만 덜 짜면 정말 좋을텐데 치킨이 밥반찬?? 느낌 ㅎㅎ,[]
73,5,"['순살 반반세트', '순살 간장치킨)']",우와 50분 걸린다고 하셨는데 30분도 안되서 배달왔어요 감사합니다!!!너무 맛있어요!!!치킨집 여기 정착입니다!!!,['https://rev-static.yogiyo.co.kr/1ad87963d574e99a9d67aec64e7e79c9_tn.jpg']
74,5,"['순살 반반세트', '순살 마늘스태미나치킨)', '콜라 1.25  변경']",짱맛이에요 소스 낭낭하고 떡볶이 존맛탱에 더 말할필요가 없는 맛입니다 짱짱,['https://rev-static.yogiyo.co.kr/b2f62dfa5784b7743c14c05eb2d513de_tn.jpg']
75,5,"['순살두마리세트', '순살 두마리 치킨 선택 2(순살 양념치킨)', '콜라 1.25  변경']",와 진짜맛있어요 후라이드 한입먹고 입맛 엄청 까다로우신 아빠도 맛있다고 감탄하실정도!! 양도 엄청 많고 튀김도 엄청 바삭하고 무엇보다 첫주문이라고 서비스로 주신 호로록떡볶이는 진짜 레전드.. 떡도 맛있구 국물이 특히 너무 맛있어서 그릇째 들고 그냥 마실정도였습니다ㅋㅋㅋ 한가지 아쉬운건 양념치킨이 조금 눅눅하고 너무 달았?어요 다음엔 다른 맛으로 먹어보려구요~ 앞으로는 여기만 계속 이용할것같아요!!,['https://rev-static.yogiyo.co.kr/a6550a7f909762e87da84f6fa494fc02_tn.jpg']
76,5,['순살 양념치킨'],맛있어요 또 시켜먹고 싶어요,[]
77,5,['치킨＋호로록 떡볶이（매운맛）'],여러치킨집을 지나쳐와 결국 여길 왔는데. 오늘부로 정착할겁니당. 영통에서 젤 괜찮은듯!!!,[]
78,4,['순살 핫쵸킹'],맛도 좋고 서비스도 잘 받았습니다 다음에도 먹겠습니다~~,[]
79,5,"['순살두마리세트', '순살 두마리 치킨 선택 2(순살 양파닭)']",배달이 엄청 빠르네요 ㅋㅋ 치킨도 맛있었지만 떡볶이가 진짜 맛있었습니다 ㅋㅋ 그래도 치킨 시켜먹을게요 ㅋ,['https://rev-static.yogiyo.co.kr/d687b6c0372c010f0917d699bf8fb2b9_tn.jpg']
80,5,['순살 마늘스태미나 치킨'],세번째 시켜먹는데 역시 맛있네요 그리고 치즈스틱 서비스 감사해요,['https://rev-static.yogiyo.co.kr/a132b441982ae1dd2875e5550d41795c_tn.jpg']
81,5,"['치킨＋호로록 떡볶이（보통맛）', '눈맞은감자튀김']",치킨에 양파에 소스찍어서 먹고 떡볶이로 입가심하면 완전 꿀맛~~~,[]
82,5,"['크리스피후라이드', '콜라500ml']",서비스로 주신 떡볶이가 너무 맛있어요. 치킨보다 맛있는데...떡볶이만 3개 주문해도 배달해주나요..ㅎ,['https://rev-static.yogiyo.co.kr/0283fad7757c920bab3163405690fbf7_tn.jpg']
83,5,['순살 크리스피후라이드'],맛있게 잘먹었습니다떡볶이도 잘 먹었습니다,[]
84,4,"['순살두마리세트', '순살 두마리 치킨 선택 2(순살 바삭한저염후라이드)']",맛 양 모두 만족합니다 재주문 각이에요 굳굳굳!!!!첫주문 떡볶이 진짜 존맛 ㅋㅋ또주셨으며누좋겟다 ㅠㅠ,[]
85,5,"['순살두마리세트', '순살 두마리 치킨 선택 2(크리미어니언순살치킨)', '호로록떡볶이（매운맛）']",여긴어디든맛나요ㅎㅎ,[]
86,5,['순살 핫쵸킹'],완전 맛있습니다 짱짱,['https://rev-static.yogiyo.co.kr/4976c37d203be3be088ad47163347904_tn.jpg']
87,5,"['뼈두마리세트', '뼈두마리 치킨 선택 2(양념치킨)']",진짜 후라이드가 맛있는 집은 오랜만이며 서비스였던 떡볶이가 말도 안됨 나중에 따로 주문해서 먹을듯,[]
88,5,"['순살 강정치킨', '케이준감자 추가']",첫주문이라 걱정반 기대반인데이젠 그런걱정 안해도될것같네요ㅎㅆㅎ 맛보장,[]
89,5,"['순살 반반세트', '순살 양념치킨)', '호로록떡볶이（보통맛）', '콜라 1.25  변경']",치킨은 항상 여기서,[]
90,5,"['마늘스태미나 치킨', '콜라 1.25  변경']",이가격에 이맛이라니 정말 맛있습니다 특히 떡볶이 너무 맛있어요 배달도 빨랐구요 담에 또 시켜먹을게요!!,['https://rev-static.yogiyo.co.kr/81deb488446b067440b98c44d86c2621_tn.jpg']
91,5,"['순살두마리세트', '순살 두마리 치킨 선택 2(토마토커리순살치킨)', '케이준감자 추가']",맛있게 잘먹었습니다 감사합니다,[]
92,5,"['크리미어니언순살치킨', '콜라500ml', '강정소스']",배달 굿굿~!! 맛도 굿이에요 리뷰보고 평이 괜찮아서 시켜봤는데 ㅎㅎ 좋아요~!!,['https://rev-static.yogiyo.co.kr/4cda2d9ed95df4310f6fc5a59e2b2709_tn.jpg']
93,5,"['뼈두마리세트', '뼈두마리 치킨 선택 2(바삭한저염후라이드)']",오~~~맛나요 국물떡볶이도넘넘맛나요감사합니다~편하게 저녁한끼 해결했어요~,['https://rev-static.yogiyo.co.kr/3a647b2c12c0424eff5ba4e98480a211_tn.jpg']
94,5,"['뼈 반반세트', '양념치킨)', '케이준감자 추가']",너무 맛있게 잘먹었어요. 먹는다고 사진 찍는걸 깜박했네요. 다음에 또 주문할께요,[]
95,5,[],양이 살짝 아쉽지만 전체적으로 맛있고 가격대비 괜찮아요,[]
96,5,"['순살두마리세트', '순살 두마리 치킨 선택 2(순살 마늘스태미나치킨)', '눈맞은감자튀김']","와 장난 아니네요 여기.. 너무 맛잇어서 먹는도중 리뷰씁니다 양파크림 부족할까봐 가져다달라햇는데 가져다주시고 안갖다주셔도 충분한양이네요 ㅠㅠ 치킨 맛 양 너무 맘에들고요 감자도 맛잇고 떡볶이 대박 ,, 짱이에요 ㅠㅠ 앞으로 치킨 여기서만 먹을거에요 ㅠㅠ 번창하세요!!! 배달도 빨라서 매우 만족 ^^!!",['https://rev-static.yogiyo.co.kr/dfbedf97e713f62f94dfbb655f4fd847_tn.jpg']
97,5,[],진짜 맛있고 서비스로 주신 떡볶이 진짜 잘먹었습니다 치킨한입 국물한입 먹으면 게임오버!!!,[]
98,4,"['뼈 반반세트', '양념치킨)']",꺼억~ 잘먹었습니다떡볶이가 신의 한수네요 정말ㅋㅋ가격대비 훌륭합니다! 조만간 또 생각날듯!,[]
99,5,['순살 양파닭'],맛있어서 자주 시켜먹고 있어요 오늘 배달 엄청 일찍와서 놀랐어요,['https://rev-static.yogiyo.co.kr/9a744aaabfc7e1a4d45e9c36ca5daefb_tn.jpg']
100,5,['치킨＋호로록 떡볶이（중간맛）'],너무맛있어용~~^^떡볶이양좀 늘려주세요~~^^,[]
101,4,[],재주문에 리뷰남겼는데 치즈스틱은 안오는건가요?,[]
102,5,[],맛있어요 근데 떡볶이가 더더맛있어요ㅋㅋ 담에 무조건 떡볶이랑 같이 시켜야겠어요,[]
103,5,"['뼈두마리세트', '뼈두마리 치킨 선택 2(바삭한저염후라이드)']",맛있어요 양도많구요 떡복이도 다양한 떡이들어있고 맛있어요 주변이 추천좀해드려야겠어요,[]
104,5,"['순살 반반세트', '순살 강정치킨)']",떡볶이까지 너무 맛있게먹었어요 감사합니다~!! 자주시켜먹을게요,[]
105,4,[],양도 생각보다 많고 바삭바삭 맛있네요!! 양념맛이 조금만 더 매콤하면 좋을것 같아요 시중에 양념치킨보다 좀 더 달달하네요 다음엔 더 매운맛으로 주문해야겠어요 그래도 맛있게 잘 먹었어요 서비스로 주신 떡볶이도 참 맛있구요 기분좋게 잘 먹었어요~~,[]
106,5,[],치킨도치킨이지만 서비스로주신떡볶이 진짜맛있었어요 ㅎㅎ다음에는 치킨 떡볶이 둘다 시킬꺼에요!!!,['https://rev-static.yogiyo.co.kr/d74691b1f4986721cb506b7b7205054f_tn.jpg']
107,4,"['치킨＋호로록 떡볶이（매운맛）', '고르곤졸라']",맛있게 먹었는데요!!!,[]
108,5,"['순살 반반세트', '순살 쉑쉑양꼬치킨)']",요즘 여기만 시켜먹어요 잠실에서도 여기가맛났는데 영통도 마찬가지예요저저번에 안왔던 치즈스틱도 저번엔 제대로왔어요ㅎ,[]
109,5,"['순살 반반세트', '순살 양념치킨)']",핵 존맛에 배달도 엄청빠르고 첫주문 떡볶이도 서비스 퀄리티가 아니에요 여자친구랑 둘이서 먹는데 배부를 정도의 양입니다 강추!!!!,['https://rev-static.yogiyo.co.kr/a6b7578bc76a62431c8b1151a076d8e2_tn.jpg']
110,5,"['순살 반반세트', '순살 핫쵸킹)', '콜라500ml']",처음 시켰는데왜 전 서비스 떡볶이 안주셔씀??치킨은  맛나용ㅎ,[]
111,5,[],너무 맛있게잘먹었습니다~!! 튀김옷도 좋고 양념도 맛있네요~!!,[]
