,별점,주문메뉴,리뷰,사진
632,5,['아이스 아메리카노（오리지널）'],말이 필요없어서사진으로 대신합니다쌍따봉 왕따봉 드립니다이따 또 시킬께요. 감사합니다 사↗️장↗️님👍,['https://rev-static.yogiyo.co.kr/a7017fef60e5e1ef1379d1438f020694_tn.jpg']
633,5,"['블루베리베이글 허니월넛크림치즈', '롱스틱파이', '치킨로제파스타', '아침&딸기우유（200ml）', '아침&후레쉬우유（200ml）']",빵 포장 깔끔하고 맛있어요~ 배달도 정시에 옵니다,['https://rev-static.yogiyo.co.kr/e782b5cb9011da85b3908bc4cc8b9c13_tn.jpg']
634,5,"['먹빵박스', '첫번째 음료선택(아이스 아메리카노', '두번째 음료선택(아이스 아메리카노)']",우유도 쿠키도 감사합니다~,['https://rev-static.yogiyo.co.kr/7d04859e74a05b2cb7e5e98a933863cd_tn.jpg']
635,5,"['추억의 소시지빵', '스위트 몽블랑', '돌돌말린 소시지 도넛', '아이스 아메리카노（오리지널）']",행사할때도 그렇고 자주 시켜먹어요!배달도 빠르고 아메리카노도 맛있어요!,['https://rev-static.yogiyo.co.kr/9951d4cdb2fb1594ecb762e556f80a92_tn.jpg']
636,5,"['꽃맛살 고로케', '명품 잡채고로케', '블루베리베이글 허니월넛크림치즈', '그린티 본델리슈', '치즈 소시지 페스츄리']",항상 흰우유랑 잘먹고있어요,['https://rev-static.yogiyo.co.kr/acc23f20fb300ae15cbe1917538b543d_tn.jpg']
637,5,"['먹빵박스', '첫번째 음료선택(선택안함', '두번째 음료선택(선택안함)']",많이 줬어요 ㅎㅎ 만족스럽습니다,['https://rev-static.yogiyo.co.kr/10ff7c66233185bcc7162c8c2fb20d00_tn.jpg']
638,5,"['먹빵박스', '첫번째 음료선택(선택안함', '두번째 음료선택(선택안함)']",단골이예요  역시나 빠르고 맛있어요,['https://rev-static.yogiyo.co.kr/600481f215955c6ca2779819916881c3_tn.jpg']
639,5,['단백질 듬뿍 로스트치킨샐러드'],샐러드 잘못오는 일이발생했지만..친절하게 다시바꿔주셨어요샐러드 닭고기양이 조금만더 푸짐했음 좋겠어요~~야채는싱싱하고 많고좋아요ㅎ,[]
640,5,"['엘핀단팥빵', '허니본델리슈', '혼자서도즐기는연유브레드', '단팥빵']",항상 잘먹고있어요~~~ 파바는 여기가 진리입니다^^,[]
641,5,"['리코타치즈&치킨샐러드', '모짜렐라 토마토파스타']",샐러드맛있어요야채가싱싱하고좋아요~,[]
642,5,"['참 부드러운 생크림식빵', '로만밀클래식', '그대로토스트', '후레쉬크림샌드빵']",쿠키랑 우유 서비스 주셨어요청명점이 젤 좋아요{,['https://rev-static.yogiyo.co.kr/9d452448076e43041f3c5107c74f4a3f_tn.jpg']
643,5,"['우유가 좋은 뽀로로케익', '닭갈비 고로케', '꽈배기 도넛', '땅콩크림빵', '달콤고소한밤롤브레드']",행사중이라 결품이 많지만 친절하시네욥,[]
644,5,"['쫄깃한 토스트', '초코 왕소라 플러스', '단팥빵 플러스', '모카 크림빵', '런치 샌드위치']",빨리 왔어요 우유도 잘 챙겨주셨어요~ 늘 편하고 맛있어서 시켜먹어요~,['https://rev-static.yogiyo.co.kr/280732ea32293caf1e113d6b8886bb32_tn.jpg']
645,5,['명가명품 우리벌꿀 카스텔라'],오늘은 쿠키가 안 와서 살짝쿵 서운하지만 번개 배송 감사합니다,['https://rev-static.yogiyo.co.kr/0aa1781bc4fb88df621afada8dbf680e_tn.jpg']
646,5,"['닭갈비 고로케', '뽀드득 그릴소시지', '옛날 왕슈크림도넛', '치즈감자봉', '순수（秀） 담백식빵', '명품카레 고로케']",맛과 양이야 프랜차이즈니 다를게 없지만 서비스와 배달은 만족스러웠습니다.,['https://rev-static.yogiyo.co.kr/e42e43323579da4d63f5b228e855722f_tn.jpg']
647,5,"['모짜렐라 토마토파스타', '햄치즈프렌치토스트']",이벤트마지막이라 아쉽네요ㅜㅜ오프라인 파바가게될때 잊지말고 영통청명점으로 갈게요ㅎㅎ냉동스파게티도 꽤 맛나요~~양만좀아쉽..,[]
648,5,"['우유가 좋은 뽀로로케익', '뽀드득 그릴소시지', '케이준 치킨샐러드', '딸기라떼']",매번 만족합니다 굳굳,['https://rev-static.yogiyo.co.kr/049d2cf5a784bd08ac48ad8900f7e1fc_tn.jpg']
649,5,"['토종효모 정통우유식빵', '플레인 베이글', '단백질 듬뿍 로스트치킨샐러드']",신선한 샐러드와 맛있는 식빵쿠키와 우유까지 덤으로 챙겨주셔서감사합니다 잘 먹겠습니다~,[]
650,5,"['런치 샌드위치', '단백질 듬뿍 로스트치킨샐러드', '끼니반란（반숙란2개입）']",항상 서비스도 많이 주시고 샐러드도 듬뿍 주셔서 감사해요,['https://rev-static.yogiyo.co.kr/4d94e65946c0b2680f2391b8518c2156_tn.jpg']
651,5,"['굿모닝롤', '땅콩크림빵', '후레쉬크림샌드빵', '롱스틱파이']",배달앱으로시키는데 청명점처럼 친절하고 배달 좋은데는 없는거같아요ㅠㅠ덕분에빵 편히시켜서 맛있게 잘먹어요♥♥,['https://rev-static.yogiyo.co.kr/3aa2a2f9893335c16aecee2b50842635_tn.jpg']
652,5,"['통밀 가득 로만밀 브레드', '우유가 좋은 뽀로로케익', '초코소라빵', '땅콩크림빵', '소보루빵', '단팥빵', '슈크림빵']",영통 청명점..빵도 신선하고 메세지뒤에 초코쿠키도 선물로 들어있고 배달도 한시간이내로 왔어요..앞으론 이곳에서 주문할듯^^,['https://rev-static.yogiyo.co.kr/e2c70108bc7885e8a8356ef01d15c981_tn.jpg']
653,5,"['단백질 듬뿍 로스트치킨샐러드', '모짜렐라 토마토파스타']",배달이 엄청 빨라서 만족스럽습니다,['https://rev-static.yogiyo.co.kr/801a01079df3ea0fd640816437aad276_tn.jpg']
654,5,"['에그샐러드샌드위치', '리코타치즈&치킨샐러드']",어떻게 평점이 5점인가 했더니이유가 있었군요!포장도 깔끔하고 서비스도 많고맛있게 잘먹었어요 고마워요,['https://rev-static.yogiyo.co.kr/6cb267b8f7a007ede6d826eb38dff009_tn.jpg']
655,5,"['먹빵박스', '첫번째 음료선택(선택안함', '두번째 음료선택(선택안함)']",맛있게 잘먹겠습니다,['https://rev-static.yogiyo.co.kr/1656c1c947cffdcc90dec486305dcee2_tn.jpg']
656,5,['명가명품 제주녹차 카스텔라'],파리바게뜨는 배달시켜본적이 없었는데 이번에 할인쿠폰을 주길래 제일 좋아했던 카스테라로 주문했습니당! 배송은 빵하나뿐이어서 그런지 엄청 빨랐습니당 ㅎㅎㅎ근처 파바중에서 제일 후기가 좋은 청명점에서 시켰는데 받고나니 왜 그런지 알겠더라구요! 리뷰이벤트로는 딸기우유 챙겨주시구 쿠키랑 사탕까지 주셔서 냉큼 먹어버렸어용! 담에도 또 파바 시키게되면 여기서 먹빵박스로 시켜볼듯해용 잘먹었습니다 :),"['https://rev-static.yogiyo.co.kr/699f4c421a88093d40fcabb3bff517e9_tn.jpg', 'https://rev-static.yogiyo.co.kr/d85656e06fc636154b4b3a1419814b4d_tn.jpg', 'https://rev-static.yogiyo.co.kr/8a85655f0e66086273284e5f9036fe58_tn.jpg']"
657,5,['호두파운드'],부모님 생신 이신데 케이크는 안 좋아하셔서 좋아하시는 파운드케이크로 축하했네요.맛있다고 좋아하셨어요. 감사합니다~,[]
658,5,"['단백질 듬뿍 로스트치킨샐러드', '케이준 치킨샐러드']",이 틀 연 속 주 문 ^^~~~,['https://rev-static.yogiyo.co.kr/1e8cd5c727cbb695deafe700fc819b5e_tn.jpg']
659,5,"['먹빵박스', '첫번째 음료선택(선택안함', '두번째 음료선택(선택안함)']","배달가능한 파리바게트가 많지만 평점이 5.0점이길래 주문해봤어요! 왜 평점이 이렇게 높은지 이해가 될 정도로 만족스러운 주문이었네요ㅎㅎ 영통청명점에 주문하고, 리뷰를 약속해서 받은것만해도 쿠키+사탕+우유라뇨ㅠㅠ 너무 퍼주시는거 아닌가요??! 서비스만 후하게 주고 빵이 맛이 없으면 평점이 좋을 수가 없는데 보내주신 빵도 다 정말 맛있어서 가족들 모두 맛있게 먹었어요!! 앞으로 빵은 무조건 파리바게트 청명점에서 주문하려고요ㅎㅎ",['https://rev-static.yogiyo.co.kr/49d356d0ea0bb2d75346ef0e4fb760e9_tn.jpg']
660,5,"['허니본델리슈', '치즈 소시지 페스츄리', '혼자서도즐기는연유브레드', '명품카레 고로케', '카페라떼（시그니처）']",기대할수있는서비스의모든걸충족시킴,[]
661,5,"['단팥빵', '블루베리 듬뿍롤케익']",리뷰 이벤트로 보내주신 딸기우유도 잘 받았어요~ 감사합니다♡,['https://rev-static.yogiyo.co.kr/95bafd6fc872873007d58d527b8a7de2_tn.jpg']
662,5,"['명품 잡채고로케', '후레쉬크림샌드빵', '디럭스 샌드위치', '런치 샌드위치', '에그샐러드샌드위치', '칠리크랩 샌드위치']",깔끔한포장 이쁜 손글씨 서비스우유 잘먹고 감동이네요 번창하세요 ^^,['https://rev-static.yogiyo.co.kr/4e4309d485a7711436fa01f61fb221d7_tn.jpg']
663,5,"['꽃맛살 고로케', '쫄깃한 피자빵', '돌돌말린 소시지 도넛', '양파치즈브레드', '소보루빵', '햄치즈프렌치토스트']",사진을 못찍었네요 하지만 정말 맛있게 잘먹었습니다!,[]
664,5,"['까망베르치즈 듬뿍 치즈후레쉬번', '구름 크림빵', '강원도 찰옥수 수소보루 크림빵', '상큼한크림빵', '블루베리머핀', '초콜릿 머핀']",파리바게트 배달은 항상 여기서 시켜요~~잘먹을게요~~~,['https://rev-static.yogiyo.co.kr/236724d9358be740779511b385e3b50d_tn.jpg']
665,5,['듀엣롤케익'],리뷰가 이렇게 많은데 5점인데는 이유가 있어요 진짜... 배달도 빠르고 맛도 짱이고 무엇보다 서비스!!!!!! 행사중이라 바쁘실텐데 쿠키에 사탕까지 주시고 ㅠㅠ 우유 떨어졌다고 아이스바로 보내주셔서 완전 감동했어요 주변에 파리바게트 진짜 많은데 먹고싶은 빵종류 좀 없어도 무조건 여기서 주문해요 최곱니다👍🐥 빵이 쪼~~금만 더 다양하면 더더 좋을것같아용~~😆,['https://rev-static.yogiyo.co.kr/9f60113dbb97e053f1805d46614caf5c_tn.jpg']
666,5,"['아침&후레쉬우유（930ml）', '초코 아이스캔디']",잘받았습니다 잘먹었어요,['https://rev-static.yogiyo.co.kr/e7b810e1a1a0596fedd7372480eebc1e_tn.jpg']
667,5,"['소라파이', '에그샐러드샌드위치', '단백질 듬뿍 로스트치킨샐러드']",정성스러운 포장과 편지 그리고 서비스까지 완벽합니다👍,['https://rev-static.yogiyo.co.kr/2edb06a59d132747aa5177c07139e205_tn.jpg']
668,5,['정통파운드'],제일 좋아하는 매장입니다이번에도 잘먹을께요^^,['https://rev-static.yogiyo.co.kr/d58b1bc3f884121e9f506a37a0753d13_tn.jpg']
669,5,"['치즈 듬뿍 어니언', '닭갈비 고로케', '치즈 소시지 페스츄리', '치즈감자봉', '딸기라떼', '에그타르트']",고로케 맛있어요 ㅁㄴㅇㄹ,['https://rev-static.yogiyo.co.kr/eca3f2347670375105a1cda0ec0cad6a_tn.jpg']
670,5,"['단백질 듬뿍 로스트치킨샐러드', '치즈불고기도리아']",서비스너무좋아요 ㅎㅎ 잘먹었어요!,['https://rev-static.yogiyo.co.kr/3797eea5a9c779f4407398f578ef7b31_tn.jpg']
671,5,"['우유가 좋은 뽀로로케익', '초코소라빵', '추억의 소시지빵', '후레쉬크림샌드빵']",서비스쿠키도 감사합니다,[]
672,5,"['초코소라빵', '블루베리 베이글', '혼자서도즐기는연유브레드', '아침&후레쉬우유（930ml）']",서비스쿠키도 감사합니다,[]
673,5,"['참 부드러운 생크림식빵', '뽀드득 그릴소시지', '옛날 왕슈크림도넛', '소보루빵', '후레쉬크림샌드빵', '단팥빵 플러스', '디럭스 샌드위치']",포장도 너무 깔끔하고 특히 샌드위치는 아이스팩에 넣어주셔서 너무 감사하네요. 행사로 주신 쿠키도 우유도 너무 좋고 배달도 빠르고 추천요,['https://rev-static.yogiyo.co.kr/7f591973d69a0eb6e470ba121971b593_tn.jpg']
674,5,"['커피번', '정통크라상', '강원도 찰옥수 수소보루 크림빵', '소보루빵', '단팥빵', '단팥빵 플러스', '쫄깃한 왕꽈배기', '모카 크림빵']",청명점 써비스도 좋고 배달도 빨라서 좋아요! 다만 너무 빠르게 재고가 나가서 ㅠㅅ ㅠ 빵골라두면 품절이고 골라두면 품절이구.... 속상했어용!,['https://rev-static.yogiyo.co.kr/aeecb10075c5cde99aab709065b12fb6_tn.jpg']
675,5,"['망고소르베빙수', '아이스 카페라떼（시그니처）']",🤩👍👍👍👍👍👍👍😍,['https://rev-static.yogiyo.co.kr/50e43b6c1e99425d13cf9ad51e2206b0_tn.jpg']
676,5,"['치즈불고기도리아', '치킨로제파스타']",잘 먹었습니다 굿굿,[]
677,5,"['우유가 좋은 뽀로로케익', '치즈 듬뿍 어니언', '땅콩크림빵', '후레쉬 크림빵', '초코 왕소라 플러스', '한입에 두번 반한 단팥크림빵', '완두앙금빵']",우유와 사탕은 아이들이 벌써 순삭했어요^^;;항상 빠른 배달과 정성든 서비스넘나 좋아요^^,['https://rev-static.yogiyo.co.kr/e92b1db7280dda5048752e9f7da20cf8_tn.jpg']
678,5,"['먹빵박스', '첫번째 음료선택(선택안함', '두번째 음료선택(선택안함)']",배달아저씨가 좀 이상하시긴 했지만 빵은 엄청 마음에 들어요!!,['https://rev-static.yogiyo.co.kr/4642aed0b209805e3e55f8cbf07ba6ba_tn.jpg']
679,5,"['혼자서도즐기는연유브레드', '소보루빵', '단팥빵', '콰트로치즈머핀', '쫄깃한 왕꽈배기']",빵맛있고생각보다 빠르게 옵니다행사기간에 늘 주문해요,[]
680,5,"['치즈 듬뿍 어니언', '커피번', '모닝토스트', '목초란으로 만든 핑거스틱', '우리찹쌀모카찰떡빵']",서비스도 좋고 배달도 빨라서 좋아요~~,[]
681,5,"['초콜릿 머핀', '런치 샌드위치', '에그타르트', '블루베리마카롱', '바닐라마카롱']",이벤트로 저렴하게 잘 먹었어요,['https://rev-static.yogiyo.co.kr/215561abf633345b12317af880ac464b_tn.jpg']
682,5,['케이준 치킨샐러드'],잘먹었습니다 굳굳 포장이 기분이 좋네요,"['https://rev-static.yogiyo.co.kr/a243729466bf0402953e0a8786a551a3_tn.jpg', 'https://rev-static.yogiyo.co.kr/f27494d6232720d3a7aaa4a9d137a5a9_tn.jpg', 'https://rev-static.yogiyo.co.kr/685a917f048d0e8dcc4704a8bd6f9efe_tn.jpg']"
683,5,"['쫄깃한 왕꽈배기', '미니버거 샌드위치', '샐러드빵', '에그타르트']",잘먹었습니다 다 맛있습니다,"['https://rev-static.yogiyo.co.kr/ffd73d7b1eb8bd62e9a3fc64175230b6_tn.jpg', 'https://rev-static.yogiyo.co.kr/d222f04a974644b706deac5fc9a4c047_tn.jpg']"
684,5,"['치즈 듬뿍 어니언', '꽃맛살 고로케', '명품카레 고로케', '초콜릿 머핀']",말이 필요없습니다! 항상 애용하는 지점입니다. 빵도 맛있구 서비스도 짱!,['https://rev-static.yogiyo.co.kr/09f74b9dc08c4cbc11960b49b34872b5_tn.jpg']
685,5,['명가명품 우리벌꿀 카스텔라'],최고의 파빠 예요. 빠르고 친절하고.,['https://rev-static.yogiyo.co.kr/ef761e4631e85074e182df23a668a832_tn.jpg']
686,5,"['단팥빵 플러스', '미니버거 샌드위치', '런치 샌드위치']",빵 맛있어요~~잘먹었읍니다,[]
687,5,"['추억의 소시지빵', '스위트 몽블랑', '달콤고소한밤롤브레드', '햄치즈프렌치토스트']","주문 후 바로전화로 재고 부족한 항목 있다고 친절히 안내해 주시고, 원하는 빵으로 대체하거나 부분 환불해서 현금으로 동봉해 주시겠다고 하셨어요. 재고가 없던 항목은 사진처럼 현금으로 거슬러 주셨습니다. 이벤트 기간이라 밀리는 주문으로 바쁘셨을 텐데 도 불구하고 더 세심하게 신경써 주셔서 감동이었어요. 배달은 정말 10분도 안 걸려서 받았고, 서비스 쿠키, 물티슈와 냅킨 모두 감사히 잘 받았어요. 매장도 종종 들르겠습니다. 번창하시길 바랍니다!❤️",['https://rev-static.yogiyo.co.kr/f79b1dc922cd34375bcf38141228a81e_tn.jpg']
688,5,"['쫄깃한 피자빵', '뽀드득 그릴소시지', '치즈감자봉', '후레쉬크림샌드빵', '명품카레 고로케']",배달은 빵인거 치고는 많이 느린듯 나머진 굿,['https://rev-static.yogiyo.co.kr/42b6f5677b40ef64948f4232086535db_tn.jpg']
689,5,"['단백질 듬뿍 로스트치킨샐러드', '리코타치즈&치킨샐러드']","말해뭐합니까,,영통청명점 최고에요,, 이제 최고라고 말하기도 지칠정도,, 포장도 꼼꼼히 오고 샐러드도 신선하고 양도 푸짐하고 서비스는 더 푸짐해요🥙🍪🥛🍬",['https://rev-static.yogiyo.co.kr/adaa7d2c31bc62963d85cb0f63355509_tn.jpg']
690,5,"['초코소라빵', '슈크림빵', '모닝토스트', '우리찹쌀모카찰떡빵', '햄치즈프렌치토스트']",이런 빠바 또 없습니다..항상 서비스로 오는 쿠키나 캔디.. 그런데 우유까지. 정성어린 편지까지.여기서 안 시킬수가 없슈,['https://rev-static.yogiyo.co.kr/b2e311d5694456a34a624bbbc25157ce_tn.jpg']
691,5,"['엘핀단팥빵', '추억의 소시지빵', '까망베르치즈 듬뿍 치즈후레쉬번', '후레쉬 크림빵', '소보루빵', '한입에 두번 반한 단팥크림빵']",정말 친절하시고  맛있어요,['https://rev-static.yogiyo.co.kr/00d3dbcf6ff7f0351f5031ff7dfac743_tn.jpg']
692,5,"['건포도 쏙쏙 롤링 브레드', '흑당 버블 라떼', '커피 아이스캔디', '바닐라 아이스캔디', '파인깔라만시 아이스캔디']",커피흘리지 않게 잘 포장해주셨어요^^ 서비스 좋구 빵도 맛나요^^,['https://rev-static.yogiyo.co.kr/fd7877db95f7dc8a43d3ff493ad60a5d_tn.jpg']
693,5,"['치즈 소시지 페스츄리', '후레쉬크림샌드빵', '에그샐러드샌드위치']",서비스도오고좋네용무엇보다 크림이 많은 크림빵..최고입니당,['https://rev-static.yogiyo.co.kr/5dcbe362d2be6fe6fceb60b541eff6bc_tn.jpg']
694,5,"['치즈 듬뿍 어니언', '닭갈비 고로케', '초코소라빵', '꿀 토스트 플러스', '한입에 두번 반한 단팥크림빵', '명품카레 고로케']",잘 받았어요^^ 맛있네요,['https://rev-static.yogiyo.co.kr/330c569a0e8305938859cc0a3ccb6395_tn.jpg']
695,5,"['부드러운 연유브레드', '쫄깃한 피자빵', '아메리카노（오리지널）', '바닐라라떼']",포장도 꼼꼼히 이쁘게 해주셔서 너무 기분좋게 먹어요^^ 감사합니다,[]
696,5,"['허니본델리슈', '롱스틱파이', '아이스 아메리카노（오리지널）']",포장도 꼼꼼하게보내주시고 맛있어요 ㅎㅎ,['https://rev-static.yogiyo.co.kr/3ce721ecd878b23c8d49b1f2abd5265f_tn.jpg']
697,5,"['커피번', '모카 크림빵', '목초란으로 만든 핑거스틱', '롱스틱파이', '디럭스 샌드위치']",항상 믿고먹어요..청명점 좋아요,['https://rev-static.yogiyo.co.kr/3ac334475d64988894d8d18872932f4d_tn.jpg']
698,4,"['치즈감자봉', '한입에 두번 반한 단팥크림빵', '아이스 아메리카노（오리지널）', '초코 아이스캔디', '딸기 아이스캔디', '팥 아이스캔디']",리뷰쓰기로하고 우유보내주시기로했는데 안와서 별하나 뺐어용..'.서비스 맛 최고입니당.',['https://rev-static.yogiyo.co.kr/a2d8bbba3937e000b5e7e119f715d19e_tn.jpg']
699,5,"['에그샐러드샌드위치', '리코타치즈&치킨샐러드']",와우 너무너무 맛있어요,['https://rev-static.yogiyo.co.kr/332fdbf0bd15c117108d47e892ac01c1_tn.jpg']
700,5,"['스위트 몽블랑', '포켓샌드 땅콩', '쿠키앤크림 마카롱 아이스크림', '바닐라마카롱']",몽블랑 엄청 맛있어요 ㅋㅋㅋ,['https://rev-static.yogiyo.co.kr/dffa398d1e0e61981903ea1a89032826_tn.jpg']
701,5,"['허니본델리슈', '치즈 소시지 페스츄리', '양파치즈브레드', '완두앙금빵']",항상 잘먹고있습니다,['https://rev-static.yogiyo.co.kr/6c48946098f32198551ef48f3f312c72_tn.jpg']
702,5,"['치즈 소시지 페스츄리', '치즈가 부드러운시간', '가나슈생크림 조각케이크']",항상 친절하세요! 번창하세요,['https://rev-static.yogiyo.co.kr/6f2a86f33f83c75e7dfd55fc38f114d0_tn.jpg']
703,5,"['부드러운 연유브레드', '강원도 찰옥수 수소보루 크림빵', '치즈감자봉', '달콤고소한밤롤브레드']",항상 여기서만 시킵니다,['https://rev-static.yogiyo.co.kr/765280548bbc0c79055edad5463bcd7b_tn.jpg']
704,5,"['꽃맛살 고로케', '돌돌말린 소시지 도넛', '소보루빵', '완두앙금빵', '케이준 치킨샐러드']",항상 믿고 먹습니다! 오늘 샐러드도 푸짐푸짐하네요~우유 품절에 아이스크림으로 대처해주시는 센스까지👍👍,"['https://rev-static.yogiyo.co.kr/cb44d4af38085f8282d31e70e87a7ea7_tn.jpg', 'https://rev-static.yogiyo.co.kr/b3e341fb8b1fdc15dccdd2226b94ed36_tn.jpg']"
705,5,"['초코반 딸기반 케이크', '케이크 칼 선택(케이크 칼', '큰 초 선택(6개', '작은 초 선택(6개)']",굿굿 근데 리뷰 이벤트 안 적어서 우유 못 받은 거 너무 아  ㅣ워여,['https://rev-static.yogiyo.co.kr/4c1889ddbbfbbcb2733af2652eb0f23e_tn.jpg']
706,5,"['참 부드러운 생크림식빵', '찹쌀도넛', '추억의 소시지빵', '밤식빵', '완두앙금빵']",배달 진짜빨라요!글구 밤식빵에 밤 진짜많구용 ㅋㅋㅋ 딴데는 한두개? 많아봐야 세개정도 있던데 대박이에여선물이랑 우유도 잘먹고 마실게요! 감사합니당,['https://rev-static.yogiyo.co.kr/f7c92d00af42e707189a451d40b0bfd3_tn.jpg']
707,5,"['소보루빵', '실키롤케익']",항상 믿고 맛있게 먹는 청명점,['https://rev-static.yogiyo.co.kr/b774136d19d9cd96fd940058398a922b_tn.jpg']
708,5,"['찹쌀도넛', '옛날 왕슈크림도넛', '초콜릿 머핀', '케이준 치킨샐러드', '아침&바나나우유（200ml）']",포장도 깔끔하고 서비스까지!! 최고에용,['https://rev-static.yogiyo.co.kr/516a99742180515de268a5640da4f27a_tn.jpg']
709,5,"['단백질 듬뿍 로스트치킨샐러드', '아이스 아메리카노（오리지널）', '아이스 카페라떼（오리지널）']",파리바게트는 여기만 시킵니다,['https://rev-static.yogiyo.co.kr/6f894ec6911e5a3879f1a84a496c50ce_tn.jpg']
710,5,"['치즈 듬뿍 어니언', '찹쌀도넛', '혼자서도즐기는연유브레드', '단팥빵', '모카빵', '아이스 카페모카']",와..사장님 감동 받아서눈물 흘릴 뻔 ㅎㅎ통크시네요진짜 앞으로 부자 되실 일만남았어요 ㅎㅎ이런 맘씨라면분명 큰 복 받으실겁니다♥♥♥♥,['https://rev-static.yogiyo.co.kr/d4cf64b51b8f4724622b2435d336ef0c_tn.jpg']
711,5,"['먹빵박스', '첫번째 음료선택(아메리카노', '두번째 음료선택(선택안함)']",가까운 데 마다하고 주문한 보람이 있네요.평점 높은 곳은 브랜드는 같아도 역시 다릅니다.맛있게 먹을게요~,[]
712,5,"['먹빵박스', '첫번째 음료선택(아이스 아메리카노', '두번째 음료선택(아침&후레쉬우유（200ml）)']",여기 파바 사장님이랑 직원분들 적게 일하시고 부자되셨으면 좋겠습니다서비스도 서비슨데 정성이 남다르세요 아메리카노 얼음 녹을까봐 걱정되서 물이랑 얼음 따로 주는 곳은 처음이에요 그리고 스티커  매번 붙이는 것도 번거로우실텐데 정말 세심한거 같습니다!앞으로 영통 파리바게트는 닥 청명점입니다. 사장님 오래오래 번창하세요 감사합니다:D,"['https://rev-static.yogiyo.co.kr/a87b2648a37063ee5632019835d21ca5_tn.jpg', 'https://rev-static.yogiyo.co.kr/09f951c8887dd0bfdf0ed3953ff75d9c_tn.jpg', 'https://rev-static.yogiyo.co.kr/19e0c06487458c53eca28af61a07bd9d_tn.jpg']"
713,5,"['치즈감자봉', '아이스 아메리카노（오리지널）', '아침&후레쉬우유（200ml）', '조각호두파이']",항상 잘챙겨주셔서 넘 감사합니당..맛도 서비스도 최고입니당..,['https://rev-static.yogiyo.co.kr/6cb9639863e66ccbb45acee1667ec4c1_tn.jpg']
714,5,"['치즈 듬뿍 어니언', '명품 잡채고로케', '추억의 소시지빵', '단팥빵 플러스', '명품카레 고로케', '아침&후레쉬우유（200ml）']",배달도 빠르고 서비스도잘받았습니다 역시믿고먹는빠바,['https://rev-static.yogiyo.co.kr/9ed39e50dd2ef2739a21dbd7e778d031_tn.jpg']
715,5,"['모카빵', '후레쉬크림샌드빵', '완두앙금빵']",언제나 신경써주셔서 감사합니다,[]
716,5,"['굿모닝롤', '혼자서도즐기는연유브레드', '후레쉬크림샌드빵', '순수（秀） 담백식빵']",잘먹었습니다~^^보내주신 서비스도 잘 받았어요,[]
717,5,"['먹빵박스', '단', '페스츄', '머핀류 중심', '첫번째 음료선택(선택안함', '두번째 음료선택(선택안함)']",제가 늘 부탁드리는 초코소라빵을 포함해 넉넉히 담아주십니다. 항상 여기서 주문하게 되네요.,['https://rev-static.yogiyo.co.kr/6f85bdd21c80e66fe65b4d45074162b4_tn.jpg']
718,5,"['치즈가반한티라미수', '케이크 칼 선택(케이크 칼', '큰 초 선택(선택안함', '작은 초 선택(선택안함)']",케잌이 생각보다 너무 작아서 놀랐지만 그래도 맛있게 너무너무 잘먹었어요~~~~ 반반 먹는 재미가 있네용 ㅋㅋㅋ 영통청명점은 매번 너무 친절하셔서 더 좋구요~~ 감사합니당 ^^,['https://rev-static.yogiyo.co.kr/e576ed5b3b1b9d384d1561bd89e47f65_tn.jpg']
719,5,"['애플파이', '돌돌말린 소시지 도넛', '치즈 소시지 페스츄리', '명품카레 고로케']",맛있다맛있다맛있다맛,[]
720,5,"['치즈 소시지 페스츄리', '런치 샌드위치', '프렌치토스트', '아이스 아메리카노（오리지널）']",항상 맛있게 먹어요 감사합니다,[]
