,별점,주문메뉴,리뷰,사진
377,5,"['쫄깃한 피자빵', '단팥빵', '런치 샌드위치', '아이스 카페라떼（오리지널）']",배달빠르고 감사합니다ㅎ.ㅎ,['https://rev-static.yogiyo.co.kr/6a6c6964ba724125b01a145b97e78427_tn.jpg']
378,5,"['치즈 듬뿍 어니언', '커피번', '찹쌀도넛', '아이스 아메리카노（오리지널）', '아침&후레쉬우유（200ml）', '커피 아이스캔디', '딸기 아이스캔디']",두번째 배달도 베리 만족 사장님 쿠키도 항상잘먹고있습니다! 자주 시킬게요,['https://rev-static.yogiyo.co.kr/9d8073944e567b437cafb606ab207464_tn.jpg']
379,5,"['치즈감자봉', '단백질 듬뿍 로스트치킨샐러드', '카페라떼（시그니처）', '아침&딸기우유（200ml）']",라떼 진짜 뜨끈뜨끈하게 와서 감동했습니다 또 시킬거예요,['https://rev-static.yogiyo.co.kr/b839a85c37c2ce47731856c199f4b294_tn.jpg']
380,5,"['통밀 가득 로만밀 브레드', '땅콩크림빵', '콰트로치즈머핀', '모카 크림빵', '단백질 듬뿍 로스트치킨샐러드']",샐러드랑 빵 잘 먹었습니다 다음에 또 주문할게용 ㅎㅎ,"['https://rev-static.yogiyo.co.kr/728f127a2fd75f8384e4e860592f9568_tn.jpg', 'https://rev-static.yogiyo.co.kr/c2466ca07446b9ea32934361320280b2_tn.jpg']"
381,5,"['쫄깃한 토스트', '스위트 몽블랑', '단백질 듬뿍 로스트치킨샐러드']",여기서만 시켜요~행사 안해도 여기서만 시켜ㅇ서비스 최고최고,['https://rev-static.yogiyo.co.kr/c102a3cc6ad40c1cc3516c355ecc67b2_tn.jpg']
382,5,"['명품 잡채고로케', '추억의 소시지빵', '치즈 소시지 페스츄리', '모카빵', '후레쉬크림샌드빵']",아침식사로 빵을 주로 먹다보니 자주 주문하게 되는데 사장님이 친절하세요,[]
383,5,"['치즈 듬뿍 어니언', '닭갈비 고로케', '치즈 소시지 페스츄리', '양파치즈브레드', '단팥도넛', '아침&후레쉬우유（200ml）']","서비스로 쿠키랑 아이스크림 잘 받았어요빵도 맛있고 서비스도 좋고, 빵은 계속 여기서 시켜먹을게요!",['https://rev-static.yogiyo.co.kr/969a91c3a7fedbaf46e19fb16e72eff3_tn.jpg']
384,5,"['엘핀단팥빵', '쫄깃한 토스트', '우유가 좋은 뽀로로케익', '치즈 듬뿍 어니언', '쫄깃한 피자빵']",예상시간보다 훨씬 빠르게 왔어요~~서비스로 쿠키와 아이스크림도 보내주시고~넘넘 잘먹었네요^^,['https://rev-static.yogiyo.co.kr/68a2fb8d47f99b03c1150edc520f7dcc_tn.jpg']
385,5,"['런치 샌드위치', '샐러드빵', '리코타치즈&치킨샐러드']",결제한지 9분만에 받았어요 ㅋㅋㅋ 날아오셨나요 ㅠㅠ 리뷰 이벤트 제가 원하는 맛으로 챙겨주시고 샐러드랑 샌드위치 다 아주 신선하고 재료 풍부하게 왔어요! 샐러드는 진짜 영통청명점 같은 곳이 없어요 ㅠㅠ 샐러드 맛집이에요 ㅠㅠㅠㅠㅠㅠ 항상 포장 뜯을 때 마다 설레는 곳입니다! 내일 또 사먹을게요 맛있게 잘먹었습니당.,['https://rev-static.yogiyo.co.kr/ec0e4c40f16577657da3e5095a0f0453_tn.jpg']
386,5,"['초코소라빵', '쫄깃한 피자빵', '단백질 듬뿍 로스트치킨샐러드', '아이스 아메리카노（오리지널）']",정성 가득 보내주셔서 너무 기분좋게 잘먹엇습니다^^,"['https://rev-static.yogiyo.co.kr/9eca24c7f65ff32868821149cc1fc280_tn.jpg', 'https://rev-static.yogiyo.co.kr/8ed22ef8536b8ba7d1f6acb787dbbf42_tn.jpg']"
387,5,"['꽈배기 도넛', '초코소라빵', '후레쉬 크림빵', '강원도 찰옥수 수소보루 크림빵', '초코 소보루빵', '옛날 왕슈크림도넛', '단팥소보루', '소라파이', '슈크림빵']",배달시간에 정확히 왔어요 주문대로 잘 맞춰서 왔어요~,['https://rev-static.yogiyo.co.kr/75101f1a8c96476b1e3800af140d8e1a_tn.jpg']
388,5,"['그대로토스트', '맘모스브레드', '런치 샌드위치']",배달도 빠르고 친절하고 사장님의 마음이느껴집니다 감사합니다  빵도 맛있어요,"['https://rev-static.yogiyo.co.kr/1333114d3b5e77b131de0d85f6d9709c_tn.jpg', 'https://rev-static.yogiyo.co.kr/d66341266304eace0474a0c240691b7e_tn.jpg', 'https://rev-static.yogiyo.co.kr/32274916718491a28ece48b9041cb878_tn.jpg']"
389,5,"['로만밀 슈퍼플러스', '옛날 왕슈크림도넛', '초콜릿 머핀', '케이준 치킨샐러드']",여기 살면서 파리바게뜨 배달은 처음 해봤는데주문 가능한 지점이 6-7개는 되더라구요. 그래서 어디서 주문해야할지 고민하던 차에 리뷰가 좋아서 시켰어요~~진짜 샐러드도 꽉 채워서 보내주시고 서비스로 아이스크림이랑 쿠키도 주시는게 대박이에요ㅠㅠ다시 시킨다면 꼭 이 지점에서 시킬거에요!!맛있게 먹었습니다 감사합니다~~,['https://rev-static.yogiyo.co.kr/769b5fbcb291c04f8899e36654dda5d0_tn.jpg']
390,5,"['통밀 가득 로만밀 브레드', '뽀드득 그릴소시지', '블루베리 베이글', '쫄깃한 토종효모빵', '플레인 베이글']",요청사항도 다 반영해주시고 빠른배달 감사합니다! 샐러드 시키고싶었는데 샐러드가 없어서 아쉬웠어요 흑 잘먹겠숩니다~~감사해요,['https://rev-static.yogiyo.co.kr/5b6d266f37a0c5c0208101d837a17849_tn.jpg']
391,5,"['치즈 소시지 페스츄리', '목초란으로 만든 핑거스틱', '아이스 아메리카노（오리지널）', '바닐라 아이스캔디']",배달예상시간보다  빨리왔어용...아아도 아이스크림도 꼼꼼하게 포장해주셔서잘먹었습니당... 편안하게 맛나게 먹었답니다..  서비스로주신 것도  넘넘감사합니당..,['https://rev-static.yogiyo.co.kr/318f35fa40e77c091beca798c28ba279_tn.jpg']
392,5,"['꽈배기 도넛', '추억의 소시지빵', '돌돌말린 소시지 도넛', '양파치즈브레드', '소보루빵']",서비스 아이스크림에 쿠키까지 감사합니다!! 그리고 양파치즈브레드 각지점에서 먹어봤는데 진짜 청명점이 제일맛있어요!!!!!,['https://rev-static.yogiyo.co.kr/f77f1d7e44f68881289f2a58557d7c3a_tn.jpg']
393,5,"['닭갈비 고로케', '명품 잡채고로케', '찹쌀도넛', '뽀드득 그릴소시지', '추억의 소시지빵', '돌돌말린 소시지 도넛', '단팥소보루']",사장님 메모지 감사합니다별거아니지만 세심한 느낌주셔서 감동이에요빵도 맛있고!따뜻한 마음도 받고앞으로 파리바게뜨는 여기만 이용할래요!!품절된것들은 전화와서 다른것으로 대체해주세요ㅠ착하신분들,['https://rev-static.yogiyo.co.kr/3f725cf2eda0ca3159f05a2e4d7de3d2_tn.jpg']
394,5,"['건포도 쏙쏙 롤링 브레드', '치즈 듬뿍 어니언', '땅콩크림빵', '단팥소보루', '혼자서도즐기는연유브레드', '촉촉한 치즈케익', '한입에 두번 반한 단팥크림빵']",예상시간보다 배달도 빠르게오고 포장 꼼꼼히잘 받았어요🤗🤗오랜만에 단팥소보루있어서 시켜무겄는데 역시존맛!연유라떼랑 건포도뭐시기도 맛있어요ㅎㅎ빵으로 점심든든히 채웠네요 후식아이스도 잘먹었습니다 맛난빵 감사합니당😘😘,['https://rev-static.yogiyo.co.kr/d6311744e7077994227c4063dad391af_tn.jpg']
395,5,"['블루베리베이글 허니월넛크림치즈', '뽀드득 그릴소시지', '양파치즈브레드', '밤식빵']",감사합니다 잘먹었어요,['https://rev-static.yogiyo.co.kr/a5ab1e25a0e20a311a98cd71c26369dc_tn.jpg']
396,5,"['치즈감자봉', '소보루빵', '시나몬 롤식빵', '디럭스 샌드위치']",늘 시켜먹는빵들이예요. 감사합니다.,[]
397,5,"['추억의 소시지빵', '시나몬 롤식빵', '샐러드빵', '케이준 치킨샐러드']","원래 다른 지점을 이용하다 이용하던 지점에 빵재고가 없어 처음 주문하게 되었어요배달도 빨랏고 특히 배달온 빵을 보고 깜짝 놀랐어요파리바게트에서 이런포장 받아 본적 처음이예요^^꼼꼼한 포장과 손글씨,그리고 쿠키선물까지너무너무 감동이고 자주자주 주문할께용^^","['https://rev-static.yogiyo.co.kr/1ab087eae1f593b2488a058834a6fbd2_tn.jpg', 'https://rev-static.yogiyo.co.kr/5cf7fa97e4839a13fcf17f9a2797fb64_tn.jpg']"
398,5,"['쫄깃한 토스트', '돌돌말린 소시지 도넛', '한입에 두번 반한 단팥크림빵', '단백질 듬뿍 로스트치킨샐러드']",너무너무 좋아요행사든 아니든 여기서만 주문해요대박나세요 싸장님,['https://rev-static.yogiyo.co.kr/ad2b04065dd31d88ba1d2b28cd8eb036_tn.jpg']
399,5,"['커피번', '옛날 왕슈크림도넛', '케이준 치킨샐러드', '아침&딸기우유（200ml）', '아침&바나나우유（200ml）']",샐러드는 영통청명점!!! 완전 굿굿굿,"['https://rev-static.yogiyo.co.kr/30d3d3937694842da66def6c4a283cc0_tn.jpg', 'https://rev-static.yogiyo.co.kr/691ddcf9a53214ca85f98f011d434c02_tn.jpg', 'https://rev-static.yogiyo.co.kr/da008639e49202a0f978fc5f4dc0a46a_tn.jpg']"
400,5,"['토종효모 정통우유식빵', '단팥빵', '명품카레 고로케', '단백질 듬뿍 로스트치킨샐러드']",정말 빨리보내주시고친절한멘트도 감사합니다또 주문할께요^^,"['https://rev-static.yogiyo.co.kr/2c44f6f303c00760200a31c9b8ec83bc_tn.jpg', 'https://rev-static.yogiyo.co.kr/44b62c898a61811171ea92b7edf6e7fa_tn.jpg']"
401,5,"['콰트로치즈머핀', 'EAU（오） 스파클링 라임', '에그타르트', '콰트로치즈범벅타르트']",배달주신 분 짱짱 친절하심요! 배려 끝판왕! 요기요는 배달분도 훌륭하시네용ㅎㅎ 청명점은 항상 감동이구용~ 타르트는 언제쯤 질릴까요ㅜ 이거땜에 끊을수가 엄서용ㅎㅎ,['https://rev-static.yogiyo.co.kr/180f0754d4df0bd6bbfe738bdf3d807b_tn.jpg']
402,5,"['그대로토스트', '추억의 소시지빵', '런치 샌드위치']",식빵  유통기한이 내일까지 ㅠ 유통기한이 좀 더 여유있었으면 좋게네요,"['https://rev-static.yogiyo.co.kr/cb3e12b192b90eccf1a9ac9fe102c8d3_tn.jpg', 'https://rev-static.yogiyo.co.kr/c53581e7d2a54094d95ada6a102dd018_tn.jpg']"
403,5,"['꿀 토스트 플러스', '옛날 왕슈크림도넛', '한입에 두번 반한 단팥크림빵', '단백질 듬뿍 로스트치킨샐러드']",배달 예상시간보다 훨씬 일찍왔네요포장도 신경써서 해주신것 같고 서비스 쿠키도 맛있게 먹었습니다앞으로 자주 배달시킬것 같아요 잘먹었습니다,['https://rev-static.yogiyo.co.kr/8e420a7798e0fba5ca59651cf0330a4e_tn.jpg']
404,5,"['그린티 본델리슈', '치즈감자봉', '블루베리 베이글', '후레쉬크림샌드빵']",이지점에서만 시켜먹어요!!,['https://rev-static.yogiyo.co.kr/104bd06de49970b20f520bedea394f89_tn.jpg']
405,5,"['치즈 듬뿍 어니언', '닭갈비 고로케', '콰트로치즈머핀', '트러플오일 크로크무슈']",허겁지겁 먹느라 사진을 못찍었네요 ㅠㅠㅠㅠ항상 애용하고 있습니다! 일주일에 두세번은 먹는 빵집!! 빵맛 최고 서비스 최고..,[]
406,5,"['통밀 가득 로만밀 브레드', '커피번', '부드러운 연유브레드', '명품카레 고로케']",배달이 빨리 왔어요 아이스크림도 녹지 않고 잘 와서 좋아요,['https://rev-static.yogiyo.co.kr/79c519578ef91f5ca9332921a70ffdeb_tn.jpg']
407,5,"['단팥소보루', '후레쉬크림샌드빵', '햄치즈프렌치토스트']",배달잘받았어요 서비스도 좋아요^^,['https://rev-static.yogiyo.co.kr/1553f13716c823641f66dc13a7e5df20_tn.jpg']
408,5,"['혼자서도즐기는연유브레드', '리코타치즈&치킨샐러드', '흑당 버블 라떼']",예상시간보다 배달도 빨리 오고 종류별로 꼼꼼하게 포장해주셨어요. 샐러드 맛있어서 열자마자 바로 다먹었어요! 서빗로 챙겨주신 아이스크림과 쿠키도 감사합니다 :),"['https://rev-static.yogiyo.co.kr/8bafbe129dfa3a6e78dfe17674d70b72_tn.jpg', 'https://rev-static.yogiyo.co.kr/0913424a4e21c1e056616650b916f5ad_tn.jpg']"
409,5,"['건포도 쏙쏙 롤링 브레드', '소보루빵', '단팥빵', '모카빵', '맘모스브레드']",5000원의행복이네요  감사해요,[]
410,5,"['토종효모 정통우유식빵', '시나몬 롤식빵', '단백질 듬뿍 로스트치킨샐러드']",요근처 파리**트중 최고에요배달도 빠르고  서비스도 최고에요^^잘먹겠습니다,"['https://rev-static.yogiyo.co.kr/90d098a8bd4b432ee3f080e32cc1db94_tn.jpg', 'https://rev-static.yogiyo.co.kr/925b7d5e8d5abace0dcbf7d23ffc7a3c_tn.jpg']"
411,5,"['먹빵박스', '첫번째 음료선택(선택안함', '두번째 음료선택(선택안함)']",배달도 제시간에 왔고 먹빵박스를 시켰는데 제 마음을 읽었는지  제가 좋아하는것으로 넉넉하게 와서 맛있게 먹었어요 서비스로 주신 쿠키와 아이스바도 감사하게 잘 먹었습니다  번창하세요~,[]
412,5,"['치즈 듬뿍 어니언', '아이스 아메리카노（오리지널）', '커피 아이스캔디', '바닐라 아이스캔디']",비오는날 편안하게 먹을수 있어서 넘 감사합니다.. 요청사항 빠짐없이 들어주시고맛있게 잘 먹었습니당 ~^^,"['https://rev-static.yogiyo.co.kr/858a0ebfcc7eeec9faf7e28d3db7587b_tn.jpg', 'https://rev-static.yogiyo.co.kr/2fb8db287dfd433f24969c498d84e2f2_tn.jpg']"
413,5,"['닭갈비 고로케', '꽈배기 도넛', '찹쌀도넛', '양파치즈브레드', '소보루빵']",배달이 20분만에 와서 놀랐어요 맛있는빵 감사합니다~~,['https://rev-static.yogiyo.co.kr/928fd46945c0c7b854e2fa613922c4c9_tn.jpg']
414,5,"['명품 잡채고로케', '찹쌀도넛', '치즈감자봉', '미니버거 샌드위치']",항상 감사합니다 수고하세요,['https://rev-static.yogiyo.co.kr/784dd2875a2e0dfbb44dd07f18cb7988_tn.jpg']
415,5,"['뽀드득 그릴소시지', '허니본델리슈', '옛날 왕슈크림도넛', '단팥소보루', '골든크림메론빵', '촉촉한 치즈케익']",빵도 신선하고 배달도 빠르게 왔어요~~ 서비스도 굿굿!!다음에 또 주문할게요^^,['https://rev-static.yogiyo.co.kr/890124cadfbfc043d12d4b54d3bba634_tn.jpg']
416,5,"['강원도 찰옥수 수소보루 크림빵', '옛날 왕슈크림도넛', '치즈감자봉', '케이준 치킨샐러드', '프렌치토스트']",역시 빠르고 정확하고 친절하도 쿠키도 주십니다❤ 샐러드 정말 맛있고 든든해요,['https://rev-static.yogiyo.co.kr/ed0267d3c5302c5da98b39edd0e7cc13_tn.jpg']
417,5,"['단백질 듬뿍 로스트치킨샐러드', '리코타치즈&치킨샐러드']",배달 빠르고 서비스도 잘 챙겨주시고 감사합니다,[]
418,5,"['커피번', '부드러운 연유브레드', '스위트 몽블랑']",비오는데 배달 빠르고 서비스에 친절하시고 부족한게없음ㅠㅠ,"['https://rev-static.yogiyo.co.kr/b809c6353db74b52481c0e86f02b42d6_tn.jpg', 'https://rev-static.yogiyo.co.kr/ec43817f8294ae65899a6df754bf00a1_tn.jpg']"
419,5,"['로만밀 슈퍼플러스', '그린티 본델리슈', '까망베르치즈 듬뿍 치즈후레쉬번', '소라파이']",쿠키도 주시고 정성스런 메모에 ~~♡감사합니다,[]
420,5,['명가명품 제주녹차 카스텔라'],이구역 파바는 여기가젤좋아요~종류가좀만더 다양했음 하는바램이있어요,[]
421,4,"['치즈 듬뿍 어니언', '커피번', '찹쌀도넛', '치즈 소시지 페스츄리', '후레쉬크림샌드빵']",항상 잘 주문해서 먹고있어요~ 오늘은 서비스쿠키가 없어서 살짝 아쉬웠어요 ㅎㅎㅎ 많이파세요~,['https://rev-static.yogiyo.co.kr/5b580cb67fb15f1fcde3ea2ba4e4fcda_tn.jpg']
422,5,"['단호박검은깨 식빵', '커피번', '블루베리베이글 허니월넛크림치즈', '소보루빵', '베이컨해쉬머핀']",비오는데도 배송이 엄청 빨랐어요~! 서비스 쿠키 감사해요,['https://rev-static.yogiyo.co.kr/a7c26e7e2d71de1c0002963d65c26e83_tn.jpg']
423,5,"['치즈가 부드러운시간', '쿠키앤크림 마카롱 아이스크림', '블루베리 마카롱 아이스크림']",배달도 빠르고 맛있게 잘먹었습니다.,['https://rev-static.yogiyo.co.kr/c0faa4398ae0de632dea244214705fea_tn.jpg']
424,5,"['건포도 쏙쏙 롤링 브레드', '우유가 좋은 뽀로로케익', '초코소라빵', '땅콩크림빵', '토종효모 정통우유식빵', '쫄깃한 피자빵', '후레쉬 크림빵']",가까운 파바있어도 항상 여기서 시켜요~,"['https://rev-static.yogiyo.co.kr/c17d338fdee280678f3e86334a0e9e50_tn.jpg', 'https://rev-static.yogiyo.co.kr/1fa12506cfce998195152b2059502c6f_tn.jpg']"
425,5,"['케이준 치킨샐러드', '아침&딸기우유（200ml）', '아침&후레쉬우유（200ml）', '아침&바나나우유（200ml）', '콰트로치즈범벅타르트']",영통 파바매장들 중에서 영통청명점이 가장 최고예요~~~~~10점 만점에 10점,"['https://rev-static.yogiyo.co.kr/cfa2cc852d71cece681960dfdac877d3_tn.jpg', 'https://rev-static.yogiyo.co.kr/599767ed19546b43050124dd4d02373c_tn.jpg']"
426,5,"['먹빵박스', '첫번째 음료선택(선택안함', '두번째 음료선택(선택안함)']",배달시간도 빨리오고 후기가좋아서 집근처 빠바말구 좀 거리있는곳에서 시켰는데 시키길 잘했네요^^ 다음에 떠 시킬게여~~,[]
427,5,"['우유팥빙수', '파인깔라만시 아이스캔디', '블루베리 마카롱 아이스크림']",며칠전에 시키고 재주문이에요~~사탕 서비스가 생겼네요!!정성 가득ㅠㅠ 감사합니다!,['https://rev-static.yogiyo.co.kr/beb7035adb82b3e102c7484d18551413_tn.jpg']
428,5,['단백질 듬뿍 로스트치킨샐러드'],다른 곳과 달리 보냉백에 신선하게 포장되어와서 좋았습니다 배달도 빨랐습니다 쿠키 감사합니다,['https://rev-static.yogiyo.co.kr/77ed66091d90aa51c7972f5486a41886_tn.jpg']
429,5,"['닭갈비 고로케', '케이준 치킨샐러드', '가나슈생크림 조각케이크']",맛있어요!,['https://rev-static.yogiyo.co.kr/c07f43e9499b2eee808c780131ea4356_tn.jpg']
430,5,"['커피번', '단팥빵 플러스', '치즈가 부드러운시간']",빵 맛있어용 굿굿 서비스도좋구요^^,[]
431,5,"['치즈 듬뿍 어니언', '닭갈비 고로케', '촉촉한 치즈케익', '단백질 듬뿍 로스트치킨샐러드']",샐러드가 만족스러웠습니다! 가끔 파리바게트에서 샐러드를 시켜먹는데 포장이 두종류가 있더라구요! 다른지점에서 시켰을때 작은용기에 와서 실망했었는데 이번에 시킨거는 완전 대성공!! 푸짐하게 배부르게 먹었습니다! 쪽지와 서비스 주신거에서 사장님의 정성이 느껴졌어요~ 맛있게 잘 먹었습니다:),"['https://rev-static.yogiyo.co.kr/f794cda37dc1b4142e8e02842435d04a_tn.jpg', 'https://rev-static.yogiyo.co.kr/f0fe1911912c73245f6fa314a8917d98_tn.jpg']"
432,5,"['쫄깃한 피자빵', '골든크림메론빵', '후레쉬크림샌드빵', '순수（秀） 우유 후레쉬번']",맛있어요 생각보다 빨리왔어요,[]
433,5,"['초코 아이스캔디', '바닐라 아이스캔디']",맛있게 잘먹었습니다,[]
434,5,"['초코 아이스캔디', '바닐라 아이스캔디']",잘먹었어요 감사합니다,[]
435,5,['제주녹차 롤케익'],감사합니다 잘먹었어요,['https://rev-static.yogiyo.co.kr/735aef0a6c1bed78bd22422581ba7af1_tn.jpg']
436,5,"['치즈 듬뿍 어니언', '애플파이', '옛날 왕슈크림도넛', '치즈감자봉', '소라파이', '명품카레 고로케']",서비스가 어째 더 느네요ㅎㅎ 거리상으로 멀어도 여기서 시키게 돼요 만족만족,"['https://rev-static.yogiyo.co.kr/1fa29057732ae3848a5519c426395f18_tn.jpg', 'https://rev-static.yogiyo.co.kr/2ff30a660ebcf4b011024da5173aa698_tn.jpg']"
437,5,"['땅콩크림빵', '블루베리베이글 허니월넛크림치즈', '런치 샌드위치', '샐러드빵']",토스트도 맛있고 서비스아이스크림도 최고입니다,['https://rev-static.yogiyo.co.kr/107a6d2ea7624a4ff13aa237d9d5e7b1_tn.jpg']
438,5,['단백질 듬뿍 로스트치킨샐러드'],여러곳에서 시켜봤지만 청명점이 최고에요...잘먹었습니다 !!,['https://rev-static.yogiyo.co.kr/25bbce2637285463458ff5ad2b9e51b5_tn.jpg']
439,5,['단백질 듬뿍 로스트치킨샐러드'],샐러드는 역시 영통청명점이에요. 재료 신선하고 풍부한 거 모든 사람들이 봐야해요. 서비스 잘 챙겨주셔서 감사해요 ❤️,"['https://rev-static.yogiyo.co.kr/fe06efca1dfd22b0e5ef98287ebf3f0f_tn.jpg', 'https://rev-static.yogiyo.co.kr/5730e0a9c9ec4176ee80b554f3b0546b_tn.jpg']"
440,5,"['꽈배기 도넛', '그린티 본델리슈', '단팥빵', '슈크림빵']",빵도 꼼꼼하게 챙겨주시고 서비스 잘 챙겨주셔서 감사해요 💚 영통청명점은 믿고 시키는 곳이에요,['https://rev-static.yogiyo.co.kr/32d0d1326e21291c2cfb9bfac0572aea_tn.jpg']
441,5,"['후레쉬식빵', '토종효모 정통우유식빵', '단팥빵 플러스', '케이준 치킨샐러드']",오늘도 주문한상품들 잘받았어요최고입니다^^,['https://rev-static.yogiyo.co.kr/5299df71a14ac1acc679bc2236bdf133_tn.jpg']
442,5,"['꽈배기 도넛', '추억의 소시지빵', '옛날 왕슈크림도넛', '골든크림메론빵', '슈크림빵', '후레쉬크림샌드빵', '한입에 두번 반한 단팥크림빵']",배달이 항상 표시된 시간보다 너무 빨라요 ㅎㅎ 보통 퇴근길에 예상시간보고 주문하는데 저보다 빨리오면 난감할때가 있습니다 (물론 배부른소리일수도 있습니다만)아무튼 쿠키나 다른것도 잘챙겨주시고 앞으로도 잘 시켜먹겠습니다,['https://rev-static.yogiyo.co.kr/22af7fcb23a959654cc3799c9ea058d9_tn.jpg']
443,5,"['건포도 쏙쏙 롤링 브레드', '플레인 베이글', '아이스 아메리카노（시그니처）', '아침&후레쉬우유（200ml）', '커피 아이스캔디', '딸기 아이스캔디']",정말 신경써서 보내주신게 느껴져요^^ 감사합니다!!!!!^^,['https://rev-static.yogiyo.co.kr/cf62d2da5af96901e7406178fe84fabb_tn.jpg']
444,5,"['순수（秀） 담백식빵', '초코 아이스캔디', '딸기 아이스캔디', '팥 아이스캔디']",잘먹었습니다,['https://rev-static.yogiyo.co.kr/bf4c3840a3ef57cf349d6e8186f95e2f_tn.jpg']
445,5,"['꿀 토스트 플러스', '양파치즈브레드', '골든크림메론빵', '달콤고소한밤롤브레드']",매번 감동 그 자체입니다..와.. 서비스를 3개나 주시다니요 ㅠㅠㅠㅠ.. 예쁘게 포장된 모습에 두 번 감동했습니다. 오늘도 만족스럽게 잘먹었습니다!! 맛도 다른 점포에 비해 굉장히 좋습니다. 제가 아는 매장 중에선 이 곳이 최고입니다. 주문하시면 절대 후회 안합니다ㅋㅋㅋㅋ,"['https://rev-static.yogiyo.co.kr/02da022c0b7a2952f2ef29b4e49212c9_tn.jpg', 'https://rev-static.yogiyo.co.kr/2d115e6c2adddc56c378a41be03dea27_tn.jpg']"
446,5,"['단호박검은깨 식빵', '커피번', '정통크라상', '강원도 찰옥수 수소보루 크림빵', '흑당 버블 라떼']",맛있게 먹고 잇어요~,['https://rev-static.yogiyo.co.kr/fedad06be4e82aaf7aa1a22b7a99fab4_tn.jpg']
447,5,"['리코타치즈&치킨샐러드', '케이준 치킨샐러드']","샐러드 영통 주변에서 많이 먹었는데 다른 파리파게트 지점보다 포장,서비스 모두 훨씬 좋았어요 :)",[]
448,5,"['모카 크림빵', '단백질 듬뿍 로스트치킨샐러드', '리코타치즈&치킨샐러드']",샐러드랑 빵 잘 먹었습니다 다음에 또 주문할게용 ^~^,"['https://rev-static.yogiyo.co.kr/d420b7dd37966e56e17d7e512a1746a7_tn.jpg', 'https://rev-static.yogiyo.co.kr/ac507e87330878176335bc01339e0a57_tn.jpg', 'https://rev-static.yogiyo.co.kr/d6b405297f46ab336f32a46d01115be2_tn.jpg']"
449,5,"['로만밀 슈퍼플러스', '치즈 듬뿍 어니언', '커피번', '강원도 찰옥수 수소보루 크림빵', '돌돌말린 소시지 도넛', '아침&바나나우유（200ml）']",가서 사는것보다 편하고 좋아요!빵도 맛있게 잘먹었습니다,[]
450,5,['명가명품 우리벌꿀 카스텔라'],배달 빠르게 잘 왔어요 이것저것 챙겨시주시는것도 많아서 항상 여기서 시켜요~,['https://rev-static.yogiyo.co.kr/153d5f1375590793ad725c893c956c08_tn.jpg']
451,5,"['런치 샌드위치', '리코타치즈&치킨샐러드']",정말친절한청명점~^^,['https://rev-static.yogiyo.co.kr/40d9c62ca656f1ab0112a5eb1b8adc8a_tn.jpg']
452,5,"['굿모닝롤', '추억의 소시지빵', '강원도 찰옥수 수소보루 크림빵', '초코 소보루빵', '후레쉬크림샌드빵']",맛있게 잘 먹겠습니다! 주문 누락건이 있었지만 바로 가져다주시고 서비스 빵까지 주셨네요 잘 먹겠습니다!,['https://rev-static.yogiyo.co.kr/72ee50cb256ccd1ed043ba6dfd88937c_tn.jpg']
453,5,"['건포도 쏙쏙 롤링 브레드', '우리찹쌀모카찰떡빵', '런치 샌드위치', '프렌치토스트']","사장님, 남는 거 있으신지..매번 주문할 때마다 쿠키며, 캔디며 선물을 가져다주세요. 예쁜 편지와 함께^^많이 사는 편도 아닌데 매번 가져다주시니 왠지 미안하네요ㅎ 그리고 샌드위치 하나 산 것도 보냉백에 예쁘게 밀봉해서 보내주신 것도 너무나 감동이었어요ㅠ 케이크살 때는 꼭 여기서 시키겠습니다. 번창하세요!",['https://rev-static.yogiyo.co.kr/c4d3452f85de1337d9b9a8846ca43c02_tn.jpg']
