,별점,주문메뉴,리뷰,사진
0,5,[],치킨 살이 먹어본 것 중 제일 부드러워요. 여기만 찾게 되네요^^,[]
1,2,['푸라닭치킨（오리지날）'],그냥 그러네요. 엄청 기대했나봐요,[]
2,3,['푸라닭치킨（오리지날）'],추가로 매운 양념시켯는데 전화응대하시는분이 넘 불친철하시더군요. 몇번이나 이야기했는데 결국 고추마요하나 추가로 가져오셨더군요.(고추마요는 먹지도 않는데 추가요금도 드리고) 첨에 가게이름도 이야기안해서 전화 잘 못 건줄알았네요. 예전엔 이런응대 안하셨던거 같은데 서비스가 점점 좋지않은것 같네요.(알바생이면 교육 잘 하셔야할 것 같습니다),[]
3,5,['푸라닭치킨（오리지날）'],진자맛잇어요 ㅋㅋㅋ,[]
4,5,['고추마요치킨'],맛있게 잘 먹었습니다,['https://rev-static.yogiyo.co.kr/79e662ee379bd2f0569cae0b791ea481_tn.jpg']
5,4,['순살 고추마요치킨'],맛있게 잘 먹었습니다 아 그리고 기분탓인지 이 치킨은 식었을때 먹는게 덜 느끼하고 더 맛있는거 같았어요,['https://rev-static.yogiyo.co.kr/edeb0961e3660dc1a0f2f8977c00b950_tn.jpg']
6,4,"['푸라닭치킨（오리지날）', 'R 감자']",지금  80분 기다렸으나 안  오고  보지도 못하고 전화하려다 리뷰 나오길래  먼저  씀,[]
7,5,['블랙알리오 치킨（간장&갈릭）'],역시 맛있어요! ㅋㅋㅋㅋㅋ,['https://rev-static.yogiyo.co.kr/cb34a2f63cb5811ff37a4e4a7c3ac8c8_tn.jpg']
8,5,['푸라닭치킨（오리지날）'],맛있게 잘 먹었습니다,['https://rev-static.yogiyo.co.kr/fb94718d8db072180b20cb9cd1fe2c2f_tn.jpg']
9,5,['푸라닭치킨（오리지날）'],맛있게 잘 먹었습니다 근데 이번엔 닭이 조금 작았던거 같아요,['https://rev-static.yogiyo.co.kr/f2d2a8882f94edbaf704e7b438bdff62_tn.jpg']
10,4,['푸라닭치킨（오리지날）'],진짜 맛있는데 양이 좀 적어요 ㅜㅜ 배달은 55분 걸린다고 했는데 한시간 정도 걸려서 왔습니다,['https://rev-static.yogiyo.co.kr/6425c92b23f97590abc484a4599535fb_tn.jpg']
11,2,"['블랙알리오에 반하다', '레귤러컷']",양이 너무 적음배달시간도 너무 길고,[]
12,5,['순살블랙알리오（간장&갈릭）'],남자혼자 먹기 좋음 포장같은게 신경쓴 느낌임,[]
13,5,"['블랙알리오에 반하다', '캥거루빵', '달콤양념소스（40g）']",다맛있어요 굿굿ㅎㅎ,[]
14,5,['블랙알리오에 반하다'],뇨ㅕ됴ㅐ7÷>#>>₩#,[]
15,5,"['순살 고추마요치킨', '치자 치킨무']",맛있고 새우튀김이 진짜 맛있어요,[]
16,1,['고추마요치킨'],너무 느끼해요예전에 감자튀김이랑 같이 오던 와사비소스인 줄 알고 시켰는데 다른 소스네여 ㅜㅜ그 소스면 더 맛있을 거 같아여 ㅠㅠ그리고 부어서 오지않았으면 좋겠어요 ㅠㅠ 최강느끼했습니다 ㅠㅠㅠㅠ 푸라닭 메뉴 좋아하는데 이번꺼는 실패네여 ㅠㅠ 제 취향에 안 맞아요 ㅠㅠ,[]
17,5,['순살블랙알리오（간장&갈릭）'],여기 순살 맛있네요,[]
18,5,[],맛있어요 추천 ㅎㄹㅎ,[]
19,5,['블랙알리오 치킨（간장&갈릭）'],짭쪼름하니 맛있습니다,[]
20,5,['순살블랙알리오（간장&갈릭）'],추천으로 처음 시켰는데 너무 맛있게 먹었어요~오자마자 정신없이 먹어서 사진은 못 찍었어요.ㅡㅡ,[]
21,4,['블랙알리오 치킨（간장&갈릭）'],어제 저녁 시켰는데 아시안게임덕분인지 주문 많이 밀려서 겨우 먹었는데 맛남,['https://rev-static.yogiyo.co.kr/971f8128fad7e422f84ad90f36f0c551_tn.jpg']
22,4,"['블랙알리오 치킨（간장&갈릭）', '코카콜라 1.25L']",처음 먹어봤어용 맛있어요,[]
23,5,['푸라닭치킨（오리지날）'],분위기만으로 반은 먹고가는 치킨 맛은 평범,[]
24,5,['블랙알리오 치킨（간장&갈릭）'],"저번에 먹을때 닭다리가 하나만 있길래 전화드렸더니 서비스로 콜라 넣어주신다고 해서, 이번에 주문하면서 콜라서비스 부탁드렸는데 안 주셨어요 ㅠㅠ 뿌우 - 3-치킨은 눈물나게 맛있어요. 뿌우",[]
25,5,[],푸라닭 첨 먹어본 이후로푸라닭밖에 안먹어요 인생치킨!,['https://rev-static.yogiyo.co.kr/b52184258797c7a20f0a104e221e3bbf_tn.jpg']
26,5,"['블랙알리오 치킨（간장&갈릭）', '청고추소스（40g）)']",치킨 진짜 맛있어요 ㅋㅋ 많이들 알려진 프렌차이즈치킨이랑은 확연히 다른맛이에요! 청양고추소스도 안맵고 맛나여 ㅠㅠ 통으로 팔면 좋겠어요 ㅋㅋ 근데 여자 둘이서 배불리 먹기엔 좀 아쉬운 양이에요 ㅋㅋ 남자면 1일1닭 해야될듯해요 ㅋㅋ,['https://rev-static.yogiyo.co.kr/0d1fb2be9deef37b0cba932960223ebb_tn.jpg']
27,5,['푸라닭에 반하다'],맛있게 잘 먹었습니다,"['https://rev-static.yogiyo.co.kr/0420f75ba31b3d0fff9db12972547763_tn.jpg', 'https://rev-static.yogiyo.co.kr/c7974ed4bca2000a33424d21aa96e4ee_tn.jpg']"
28,4,['블랙알리오 치킨（간장&갈릭）'],맛은있었으나.. 무슨일이었는 배달이 너무 오래걸렸내요.아무일도없는 평일인데도 1시간 30분이나 걸리다니요.. 배달만 좀 개선되면 괜찮은듯 합니다.,[]
29,4,"['블랙알리오 치킨（간장&갈릭）', '푸라닭치킨（오리지날）']",맛있고 양도 푸짐하고 배달해주신분도 아주 친절하셨는데 배달시간이 오래걸렸어요.. (주문후 1시간15분정도 걸린것 같아요).,[]
30,3,"['푸라닭치킨（오리지날）', '코카콜라 1.25L']",깔끔하고 맛있는데 양이 많지는 않고 배달이 너무 늦어요 ㅠㅠ,[]
31,4,['악마치킨（특제매운소스）'],맛은 최고지만 배달이 너무 오래걸리네요,[]
32,5,"['순살 씨즐링', '코카콜라 1.25L']",항상 맛있게 먹고 있습니다,[]
33,5,['순살 매드갈릭'],배달느린거빼고는 만족..! 맛있습니다,[]
34,1,[],오늘 너무 실망했네요..(12월31일) 환불 처리해서 리뷰 못남겨서 다른날 시켜먹은걸로 리뷰씁니다.배달쪽 신경좀 써주셧으면 좋겟어요. 시키면 한시간은 기본이니까요...;처음엔 맛있으니까 늦어도 뭐! 이랬는데오늘은 아무리 연말이어도 2시간 기다렷내요.. 그정도 걸린다고 말도 안해주고 요기요에는 한시간맘에배달되니까 오 개꿀하면서 시켰습니다.배달 두시간 걸렸구요 . 진짜 다식은 치킨이 배달되서 왔네요;; 전화해서 환불해달라했더니 진짜 바빠서 11시에 환불전화 준다고하네요.. 앞으론 안시켜먹을듯,"['https://rev-static.yogiyo.co.kr/9a93f5b386c7670321f2e4a6e52132be_tn.jpg', 'https://rev-static.yogiyo.co.kr/87466f2a017e543ddc68bcb01a4507bb_tn.jpg', 'https://rev-static.yogiyo.co.kr/04a66bb8f0f90131797addbfa3599c33_tn.jpg']"
35,4,"['순살 매드갈릭', '코카콜라 1.25L']",주문했는데 연말이라 그런지 3시간 걸렸어요 다른때에는 배달 잘됐습니다.,[]
36,5,['푸라닭치킨（오리지날）'],항상 맛있게 먹고있습니다,[]
37,5,['순살 고추마요치킨'],순살소추마요는 다른 치킨집에서 맛 볼수없는 푸라닭만의 독특한 메뉴네요 ㅋㅋ 바삭바삭한 치킨은 아니에요 치킨살이 넘 부드러워서 놀랬어요 ㅋㅋㅋ 양은 혼자먹기엔 좀 많고 둘이 먹기에는 모자라는? ㅋㅋ 또 먹어볼꺼에요~~,['https://rev-static.yogiyo.co.kr/25d6674f5eb1ddd07b37576961a6a24b_tn.jpg']
38,5,['순살블랙알리오（간장&갈릭）'],퍽퍽한 가슴살이 아니라서 짱맛나요👍👍,[]
39,1,['블랙알리오 치킨（간장&갈릭）'],주위에서 푸라닭 맛있다고해서 한시간씩 기다려가며 주문했데 한개먹고 음~맛있네 하다 두개째때 저렇게 머리카락이나와서 치킨맛 다떨어졌어요...배달이라 내머리카락이 아니냐 하겠지만 제머리카락은 두껍고 검정머리가 아니네요...반죽이나 튀길때 들어간거같은데....머리카락하나때문에 치킨맛떨어졌어요,['https://rev-static.yogiyo.co.kr/19957f457a7ea96bcb8ccd267410c976_tn.jpg']
40,5,['푸라닭치킨（오리지날）'],배달이조금 아쉬운부분이있었는데 그래도 맛!!,[]
41,4,['악마치킨（특제매운소스）'],마시쏘용! 저번엔 악마 암청 매웟는데 조절해주신건지 맛잇게매우네용!! 이조합 완전 사랑입니당❤️,['https://rev-static.yogiyo.co.kr/dadf9a6d40429da5af77c6768af004e7_tn.jpg']
42,5,['순살블랙알리오（간장&갈릭）'],포장 가방이 인상적이네요. 맛있게 잘 먹었습니다!^^,[]
43,5,['순살 고추마요치킨'],맛있게 잘먹었습니다,[]
44,5,['푸라닭치킨（오리지날）'],항상 맛있게 먹고있습니다,[]
45,5,['스파이시 걸스（매콤 후라이드）'],항상 맛있게 먹고있습니다 제일 좋아하는 메뉴입니다,[]
46,5,['푸라닭치킨（오리지날）'],배달빠르네요여전히 맛나요,[]
47,5,"['푸라닭치킨（오리지날）', '스프라이트 1.5L']",푸라닭 맛 아이도 좋아합니다~,[]
48,5,['순살 고추마요치킨'],존맛탱입니다. 맛있습니다.,['https://rev-static.yogiyo.co.kr/ccdc2394253819a17d01d945bd79d055_tn.jpg']
49,3,['블랙알리오 치킨（간장&갈릭）'],처음으로 주문한 푸라닭인데 닭에서 기름이 너무 많아서 먹다가 버렸어요. 실망이네요.. 다음에는 주문 안할듯.,[]
50,5,['블랙알리오'],그나마 조금 건강한거 같아서 시켰습니다 ㅋㅋㅋ,[]
51,5,"['순살 블랙알리오', '빅치즈스틱 2', '기름떡볶이 （달콤）)']",대박추천 치즈스틱진심너무 맛잇어요오오,[]
52,5,"['순살 고추마요', '떡 추가)']",떡추가해서 친구랑 나눠먹었는데둘다 배부르게 잘 먹었습니다.양도 많고 맛잇네요,['https://rev-static.yogiyo.co.kr/3e1a6d7d5227e165e66ca2715e3d6dce_tn.jpg']
53,5,['고추마요 치킨'],배달이 생각보다 빨랐고 정말 맛있더라구요~ 다음엔 유명한 블랙알리오로 먹어볼게여̊̈.,['https://rev-static.yogiyo.co.kr/220363f9807257d6b23b5704cd77a70e_tn.jpg']
54,5,['순살 고추마요'],순살고추마요랑 계란반숙해가지고 스윽 계란떠먹으면 개꿀맛 인죵? 어 인죵,[]
55,5,['블랙알리오'],블랙알리오치킨 맛있네요.,[]
56,5,['푸라닭 치킨'],처음시켰는데 겉은 바삭 속은 촉촉 맛있네요#,"['https://rev-static.yogiyo.co.kr/38ccab2600c32f1d301abc987649328d_tn.jpg', 'https://rev-static.yogiyo.co.kr/a3b2177cd4d0e8ecf5f1bb4d2b766f66_tn.jpg']"
57,5,['블랙알리오'],메뉴마다 다 맛있어요..포장은 좀 과대포장 인듯하지만..,[]
58,5,"['순살 블랙알리오', '빅치즈스틱3개)', '레귤러컷']",항상 맛있어요 치즈스틱도 진짜 맛있어요,[]
59,3,"['순살 블랙알리오', '달콤양념소스 추', '웨지감자 추가)']",고추마요 소스와 달콤양념소스 하나씩 추가했는데 고추마요소스만 세개왔네요,['https://rev-static.yogiyo.co.kr/d506d11440d7ad378e73fd1bb1fe4fda_tn.jpg']
60,5,['순살 치킨'],순살이랑 오리지날이 제일 맛있어요,[]
61,5,"['스파이시걸스', '악마소스 추가)']",화끈한여자들 처음 시켜봤는데 역시 후라닭 짱맛,[]
62,5,['푸라닭 치킨'],여기 소스 너무 맛있고 치킨 자체도 존맛입니다.. 천원이천원 더 내는 거 1도 안 아까움,['https://rev-static.yogiyo.co.kr/181f63f42ea0bf43489de49e412b96ac_tn.jpg']
63,5,['블랙알리오'],자극적이지 않고 새롭게 느껴지는 맛이네요 마늘 후레이크가 좀 더 뿌려졌으면 좋겠네요,[]
64,5,"['블랙알리오', '어니언링', '어니언불고기피자']",👍👍👍👍👍,[]
65,4,"['악마 치킨', '빅치즈스', '악마소스 추가)']",역시!! 믿고 먹는 푸라닭,['https://rev-static.yogiyo.co.kr/9dff3483c6c7cb0016595ce1a78612f2_tn.jpg']
66,5,"['푸라닭 치킨', '코카콜라 1.25L']",진짜 반할 만한 맛이었어요. 처음에는 소스 없이 먹었는데 그대로도 좋고 이후 소스 찍어 먹으니 또 그 맛대로 좋았어요배달도 엄청 빠르고 배달 하시는 분도 친절하시고☆재구매 의사 100%,"['https://rev-static.yogiyo.co.kr/5f87f6b0c32c7c2b400205ade0e281f1_tn.jpg', 'https://rev-static.yogiyo.co.kr/b306f0a6cbda17b1bfd502c73ff68249_tn.jpg']"
67,5,"['블랙알리오', '코카콜라 1.25L']",👍👍👍👍👍,[]
68,1,['블랙알리오'],닭상태 좋지만 너무 달아요,[]
69,5,"['순살 고추마요', '블랙치즈볼']","초복에 요기요 이벤트로 배달은 늦었지만 언제나 그렇듯 맛, 양 둘다 최고","['https://rev-static.yogiyo.co.kr/1b99b274c37e26e3ed579e73257c13bc_tn.jpg', 'https://rev-static.yogiyo.co.kr/be59b498c638429b0b886d9792322dd4_tn.jpg']"
70,5,['고추마요 치킨'],푸라닭진짜진짜 맛잇어요ㅠㅠ..... 다음에는순살로 시켜먹을게요,['https://rev-static.yogiyo.co.kr/cdc6e3816644542732b88957922294e3_tn.jpg']
71,5,['스파이시걸스'],배고파서 먹다 사진 찍었네요.맛있게 잘 먹었습니다.,['https://rev-static.yogiyo.co.kr/1d03eeab67f8ec499e4b3a12ba0bac42_tn.jpg']
72,5,"['블랙알리오', '떡 추가)']",가슴살 부위 마저도 부드러운 편이었습니다.,[]
73,5,['순살 고추마요'],정말 맛있게 잘 먹었어요~ 또 먹을게요!,[]
74,5,['블랙알리오'],역시 믿고 먹는 푸라닭!!!!!블랙알리오 뒷날 후유증은 좀 오지만 너무 맛있어용,[]
75,5,['순살 고추마요'],여러분 모두 푸라닭 순살 고추마요 안드시고 뭐하세요!!!진짜 훟회안해요ㅜㅜ 닭다리살 순살 진짜 너무 맛있고 심지어 양도 많아요.......... 진짜 믿고 먹는 푸라닭 .....ㅜ 타지역에서 먹고 놀랬는데 요기요 뒤지다가 수원에도 있는거 보고 바로 시켰는데 너무 맛있게 해서 보내주셨어요 ㅎㅎ 다들 꼭 드셔보세요〰️,['https://rev-static.yogiyo.co.kr/2c85533307393c212911f7bd46fb70d6_tn.jpg']
76,5,[],맛있어요 푸라닭닭닭닭닭닭닭닭,[]
77,5,['순살 블랙알리오'],와.. 같이 보내주신 고추마요소스 JMT다음엔 고추마요를 먹어야겠어요,[]
78,5,['순살 고추마요'],고추 마요 맛있어요~ 악마소스에 같이 찍어먹으니 더 맛있네요~~,['https://rev-static.yogiyo.co.kr/8da42f15ac16ac8c04d8c7417ff9d724_tn.jpg']
79,5,['순살 고추마요'],진짜 맛있게 맵다의 기준인 듯. 근데 매운맛 초보자에겐 너무 맵기도 해요ㅠㅠ 치킨먹으면서 눈물 콧물 빼보긴 오랜만이네요. 그래도 맛있어요!! 기름떡볶이도 소금 살짝 쳐서 먹으니 이게 바로 단짠의 완성!! 만족입니다,['https://rev-static.yogiyo.co.kr/f11bac54f6289d300a22952e00adf2c3_tn.jpg']
80,5,['고추마요 치킨'],친구 추천으로 처음 시켜먹었는데 존맛이네요 앞으로 자주 시킬듯~,[]
81,5,"['블랙알리오에 반하다', '기름떡볶이 （레드）']",맛나요~~맛나요 재주문요~~~,[]
82,5,['순살 고추마요'],완전 빨리왔어요! 맛도 있었어요 ㅋㅋㅋㅋㅋㅋㅋ맨날 뼈 시키다가 처음으로 순살시켜봤는데양이 뼈보다 좀 적은것 같은건 기분탓이겠져(뼈가 빠졌으니...ㅋㅋㅋㅋ)그래도 맛있고 그래서 다음에 또 주문할게요!,[]
83,5,['블랙알리오'],푸라닭 완전 맛있어요! 치즈볼도 최고에용,[]
84,5,['푸라닭 치킨'],배달 빨라요 진짜 빨라요,[]
85,5,['블랙알리오'],정말 맛있었어요~~~~또먹고싶어요0000,[]
86,5,['순살 고추마요'],배달이 1시간 가량 걸린걸 제외하면 역시 최고의 치킨!,[]
87,5,['블랙 윙콤보'],두번째 먹는건데 완전 맛있어요^^배달도 빨리 해주셔서 치킨이 너무 뜨거워서 혀데일뻔요ㅋㅋㅋㅋㅋ,['https://rev-static.yogiyo.co.kr/e3d19ccd69aa18eb6d70cc2a4fcc8689_tn.jpg']
88,5,['고추마요 치킨'],맛있습니다. 다만 다 먹어갈때쯤이면 조금 느끼하네요,[]
89,5,['스파이시걸스'],양념된걸로 먹다가 스파이시걸스 먹어보는데 이것도 제취향이네요!,['https://rev-static.yogiyo.co.kr/0b4d974abef841771f2f2659edf1c1e1_tn.jpg']
90,5,['블랙알리오'],너무 맛있었어요~!,[]
91,5,"['순살 블랙알리오', '기름떡볶이 （레드）)']","배달이 느리다고 하였는데 생각보다 빨리 왔어요. 양도 많고 맛있네요~ 어니언링, 기름 떡볶이도 맛있는데 사이드가 비싸고 양이 많아요. 양을 좀 줄이고 가격을 줄였으면 좋겠네요",[]
92,5,['매드갈릭 치킨'],치킨도 맛있는데 어니언링은 더더 맛있네요^^,[]
93,5,"['고추마요 치킨', '블랙알리오']","맛있어요!고추마요가 느끼할까봐 걱정했는데, 전혀 그렇지 않아요! 적절하게 부드럽고 매워서 너무 맛있었습니다.다른 치킨 하나는 마늘맛 많이 나는 간장 느낌인데 그것도 맛있었어요!","['https://rev-static.yogiyo.co.kr/b7e801f59f1b0301130e7647c28b29ca_tn.jpg', 'https://rev-static.yogiyo.co.kr/8918127651e5c803f4c4a9994e39f2d3_tn.jpg']"
94,5,['블랙알리오에 반하다'],사진은 깜빡하고 못 찍었는데 맛있게 먹었습니다~!,[]
95,5,['푸라닭 치킨'],여긴 말이 필요없음 ㅋㅋ맛있고 따뜻하게 배달와요.,[]
96,5,['푸라닭 치킨'],배달도 좋고 맛도 좋고,[]
97,5,['순살 고추마요'],맛있어요~ 소스 양도 많고 깔끔해요,[]
98,5,['고추마요 치킨'],고추마요 주변에서맛있다고해서 시켰는데맛은있으나 예상되는맛이었어요너무기대를했나;그래도 담에 블랙알리오는 시키보려고요,['https://rev-static.yogiyo.co.kr/bce57612165cbae26ae0a24a0278f730_tn.jpg']
99,5,"['고추마요 치킨', '배달생맥주 1000cc']",첨엔 맛있었는데 약간 느끼했어요담엔 후라이드 시켜야겠어요,[]
100,5,"['블랙알리오', '악마소스 추가', '고추마요소스 추가']",겉바속촉원하면 푸라닭 배달시간 타이트하니까 집가까우면 테이크아웃하자,['https://rev-static.yogiyo.co.kr/4c56d02121e282014ae3fbb4e09531bc_tn.jpg']
101,3,"['순살 고추마요', '처음처럼']",맛있어요~~!!양이적을뿐ㅠ,"['https://rev-static.yogiyo.co.kr/a243bf46926509380b5f2c23507909a3_tn.jpg', 'https://rev-static.yogiyo.co.kr/fd1c675244de3f02b4bd70833a1017ca_tn.jpg']"
102,5,"['푸라닭 치킨', '코카콜라 1.25L']",배달도 빠르고 맛도 최고였어요,[]
103,4,['순살 고추마요'],자주 시켜먹는 푸라닭! 믿고 또 시킵니다.,"['https://rev-static.yogiyo.co.kr/835f9e5168b1d8e7a55ad522dce2e5ad_tn.jpg', 'https://rev-static.yogiyo.co.kr/4dd7721e123f41bae29f4befce28d1dc_tn.jpg']"
104,4,"['블랙알리오', '고추마요소스 추가']",맛있어여,['https://rev-static.yogiyo.co.kr/27a70e8ae420905439a2177da9ebc326_tn.jpg']
105,4,['블랙알리오'],양도많고 푸라닭만에 느낌이 너무 좋아오!,[]
106,3,['블랙 윙콤보'],맛은 그냥 살짝 매콤한 간장치킨 맛이고무난무난 먹을만했어요!,[]
107,5,['순살 블랙알리오'],배송도 빨랏고 맛과 포장 다 좋았어요젓가락은 안오더군요^^;;치킨무까지 맛있는 곳은 여기가 첨이네요,"['https://rev-static.yogiyo.co.kr/f3508bb9065cd40e7f867d9f495a9523_tn.jpg', 'https://rev-static.yogiyo.co.kr/888b8a99c3be3e5d8843d8a9117393e8_tn.jpg', 'https://rev-static.yogiyo.co.kr/72fbcfe4bfae15c066357ebf84fac629_tn.jpg']"
108,5,['블랙알리오'],미쳤습니다...핵존맛이에요!!!!!,['https://rev-static.yogiyo.co.kr/a77ba3f273bbf27e6f9affbaec68e6c2_tn.jpg']
109,5,['순살 고추마요'],서울에서 처음 먹어보고 여기 생겨서 시켜봤는데 맛도 똑같고 양은 오히려 더 많았던 것 같네요,[]
110,5,['순살 블랙알리오'],맛있습니다 또 시켜먹을게요,[]
111,5,['순살 블랙알리오'],너무 맛있어서 먹다 찍었네요,['https://rev-static.yogiyo.co.kr/ea18a155b08d6e479de8f81ed9c270fc_tn.jpg']
112,5,['순살 블랙알리오'],참PD 영상보고 주문했는데맛나네요,['https://rev-static.yogiyo.co.kr/97936db7d7994d4aae18e4c008c3dded_tn.jpg']
113,5,"['블랙알리오', '떡 추가)']",부모님 시켜드렸어요.빠르게 배달되었어요~맛있는 냄새 난다고 좋아하시네요~,[]
114,5,['순살 고추마요'],맛잇네요~. 포장이  이쁘네요~.,"['https://rev-static.yogiyo.co.kr/1b5decf2d9e55003546933d5950f0d95_tn.jpg', 'https://rev-static.yogiyo.co.kr/78c137ab460f75a9ff59ef9cebba88ab_tn.jpg']"
115,5,['순살 블랙알리오'],순살블랙알리오는 진리네요!치킨무도 무지맛있네요ㅋㅋ,['https://rev-static.yogiyo.co.kr/a71da4f1f76eac7465b54f9eabc13f0f_tn.jpg']
116,5,['순살 고추마요'],고추마요 느끼하지않고 매콤하니 맛나요~오늘도 시키려고 하니 주문폭주로 주문이 안되네요ㅠ,[]
117,4,['블랙알리오'],맛있고좋았습니다7시넘어서 시키는데 주말에 시킬때마다순살이 다팔렸다고해서 조금아쉽네요 그거빼고 좋았네요,[]
118,5,['순살 블랙알리오'],친절하고 맛있었어요~,[]
119,5,['순살 고추마요'],순살치킨이 뻑뻑한 부위가 아니라 좋았습니다. 고추마요 맛있습니다. 고추가 더 많이 들어가도 좋을거같애요.마요라서 느끼 한게 있지만 고추의 약~간의 매운맛이 약간 잡아줍니다.,[]
120,5,['순살 블랙알리오'],남들과는 다른 리뷰를 남겨보았습니다.https://youtu.be/c8yLFd3D61A,['https://rev-static.yogiyo.co.kr/55ee81e5a4639e5bc6087b2adb7acb93_tn.jpg']
121,5,['순살 고추마요'],맛있다고만 들었는데 진짜 맛있네요! 할라피뇨가 신이 한수인거 같아요~~,['https://rev-static.yogiyo.co.kr/96d15742b71e0db8ab697b1b07d0e6d0_tn.jpg']
122,4,['순살 블랙알리오'],맛은 있는데 배달하시는분이 치킨주시고 한숨 푹 쉬면서 가시던데 제가 예민하게 받아들이는건진 모르겠는데 살짝 기분이 나쁘네요 문을 늦게연것도 아니였는데 말이죠 ㅋㅋ 배달하시는분이 힘드셔서 그랬으려니 해야겠네요,[]
123,4,['순살 블랙알리오'],기본소스에 찍어먹는소스까지 궁합 굿굿사진처럼 바닥에 국물이 많아 치밥파도 굿굿다음에 다른 치킨 한번 시켜봐야겟어용,['https://rev-static.yogiyo.co.kr/aea5b1f23b96e1d1106cd3c6702d23ec_tn.jpg']
124,5,"['블랙알리오', '코카콜라 1.25L']",맛있어요~~~~~~~,[]
125,5,"['순살 블랙알리오', '웨지감자 추가)']",블랙 알리오 개꿀맛,[]
126,4,"['순살 블랙알리오', '고추마요소스 보틀（240g）']",블랙알리오 너무 좋아요고추마요 소스도 좋음오븐구이 후 튀겨서 튀김가루 없어서 부담이 조금 덜 합니다요청사항 다 해주셔서 감사합니다잘먹었습니다,['https://rev-static.yogiyo.co.kr/520adc8384925e1bc4041bd142811be3_tn.jpg']
127,5,['블랙알리오'],맛있어요!! 또 이용하게요,[]
128,5,"['고추마요 치킨', '블랙알리오']","블랙알리오 간장치킨의 고급진 맛이라고나 할까!! 간간히 씹히는 마늘칩과 과하지 않은 간장 양념. 생각보다 더 맛있었고, 고추마요치킨은 느끼한듯 하지만 자꾸 끌리는 맛^^ 둘다 넘 맛나요~","['https://rev-static.yogiyo.co.kr/55c00408a820a91036d6e7f76a2f0b06_tn.jpg', 'https://rev-static.yogiyo.co.kr/539399507ad043a71ab44a73725cbffc_tn.jpg']"
129,5,"['푸라닭에 반하다', '고추마요 치킨']",맛있고 생각보다 배달도 빨리왔습니다,[]
130,5,"['순살 고추마요', '웨지감자 추가)']",고기가 엄청 부드럽고 맛있어요,[]
131,5,['고추마요 치킨'],맛있었어요 할라피뇨가 따듯한게 조금 맞지않았습니다,['https://rev-static.yogiyo.co.kr/5e10b76b8f2ea3f61d8a17bc38848de7_tn.jpg']
132,5,['순살 고추마요'],너무 맛있어서 양이 적어보였나...맛있습니다,"['https://rev-static.yogiyo.co.kr/81a7c18b92f89e146f1329de43bc87ea_tn.jpg', 'https://rev-static.yogiyo.co.kr/709d8ac12066c1cf936dfca1d918e19d_tn.jpg']"
133,5,"['순살 블랙알리오', '고추마요소스 추가)']",처음 시켜먹어봣는데 정말맛있어요 ㅠㅠ 순살원래 잘 안먹는데 쵝오 ㅠㅠ 어니언링도 맛잇어요! 고추마요에 찍어먹으니까 더 존맛!,[]
134,4,['순살 블랙알리오'],밖에서 일보느라 배달 전에 전화부탁드렸는데 전화는 안 주시고 도착해서 화난 목소리로 문열어 달라고 전화하시니 기분이 안 좋네요. 말하는데 전화 끊어버리는 것 보너스고요... 바쁘시고 배달업체의 행동인건 이해하지만...맛은 최고입니다.,['https://rev-static.yogiyo.co.kr/7b889856eaf6c5042be5d219c3b328b7_tn.jpg']
135,5,['순살 블랙알리오'],순살 떡추가해서 먹었는데 떡 엄청 많고 맛있어요!!!,['https://rev-static.yogiyo.co.kr/d5023339d83352599606c69897e9344e_tn.jpg']
136,5,['순살 블랙알리오'],ㅅㅅㅅㅅㅅㅅㅅㅅㅅㅅㅅ,['https://rev-static.yogiyo.co.kr/ffa925320786c216aedac8bb8006c872_tn.jpg']
137,5,['순살 고추마요'],"맛, 배달, 양, 위생 모두 최고입니다!!",['https://rev-static.yogiyo.co.kr/d2864d9dc4b563ad94ec706107c5d978_tn.jpg']
138,5,['순살 고추마요'],대충맛있다는내용ㅇㅇㅇ,['https://rev-static.yogiyo.co.kr/89faf174eea4aa3e9d2ee32551b473f7_tn.jpg']
139,5,['블랙알리오'],블랙 알리오 맛나연. 배달도 빠르고 친절하고 포장도 깔끔하고 맛도 좋아연. 상세히 표현 하기엔 너무 길어질꺼 같으니직접 먹어보는 게 나을듯해연 ㅋㅋ 굿굿,[]
140,5,['순살 블랙알리오'],맛있습니다 블랙알리오 순살완전 맛있고 배달도 친절하십니다,[]
